{
    "files": [
        {
            "type": "file",
            "id": 1033,
            "date": "2025-09-10 12:44:52",
            "created_date": "2025-09-10 12:44:52",
            "size": "2.75 MB",
            "is_under_scanned_path": true,
            "bytes": 2886533,
            "name": "00025-3347898819.png",
            "fullpath": "/Users/pixelkaos/Library/Application Support/StabilityMatrix/Packages/Stable Diffusion WebUI reForge/outputs/txt2img-images/2025-09-10/00025-3347898819.png",
            "gen_info_obj": {
                "steps": 40,
                "sampler": "DPM++ 2M",
                "Schedule type": "Karras",
                "cfgScale": 7,
                "seed": 3347898819,
                "size": "832x832",
                "Model hash": "6330883d2c",
                "Model": "artium_v20",
                "Denoising strength": 0.3,
                "RNG": "CPU",
                "Hires CFG Scale": 7,
                "Hires upscale": 2,
                "Hires steps": 15,
                "Hires upscaler": "ESRGAN_4x",
                "TI hashes": "CXL-Mech: 000b204acc87, CXL-Mech: 000b204acc87, CXL-Mech: 000b204acc87, CXL-Mech: 000b204acc87, CXL-Mech: 000b204acc87, CXL-Mech: 000b204acc87, CXL-Mech: 000b204acc87, CXL-Mech: 000b204acc87, CXL-Mech: 000b204acc87, CXL-Mech: 000b204acc87, CXL-Mech: 000b204acc87, CXL-Mech: 000b204acc87, CXL-Mech: 000b204acc87, CXL-Mech: 000b204acc87, zip2d_neg: a764ec702efd, zip2d_neg: a764ec702efd, CXL-Mech: 000b204acc87, CXL-Mech: 000b204acc87, zip2d_neg: a764ec702efd, zip2d_neg: a764ec702efd",
                "Pad conds": "True",
                "Version": "f1.0.0v2-v1.10.1RC-latest-2454-g9086b215",
                "Source Identifier": "Stable Diffusion web UI",
                "ControlNet 0": "Module: CLIP-ViT-H (IPAdapter), Model: ip-adapter-plus_sdxl_vit-h [bc449f62], Weight: 0.35, Resize Mode: ResizeMode.INNER_FIT, Processor Res: 0.5, Threshold A: 0.5, Threshold B: 0.5, Guidance Start: 0.3, Guidance End: 0.7, Pixel Perfect: False, Control Mode: ControlMode.BALANCED, Hr Option: HiResFixOption.BOTH",
                "ControlNet 1": "Module: CLIP-ViT-H (IPAdapter), Model: ip-adapter-plus-face_sdxl_vit-h [368cf551], Weight: 1, Resize Mode: ResizeMode.INNER_FIT, Processor Res: 0.5, Threshold A: 0.5, Threshold B: 0.5, Guidance Start: 0.1, Guidance End: 0.9, Pixel Perfect: False, Control Mode: ControlMode.BALANCED, Hr Option: HiResFixOption.BOTH",
                "prompt": "A vibrant cyberpunk illustration, comic-book/anime hybrid, bold colors, high-contrast neon lighting.\nA ((Reptilian, lizard)) Mothership RPG Scientist character, defined line art, 29 years old.\nThe character is skilled in Field Medicine, Biology, and Xenobiology.\nThese skills are represented visually through specific details:\n- Field Medicine → medical patches and medkit\n- Biology → Petri dishes and scientific insignia\n- Xenobiology → alien specimen jar\n(Holding Ancient Fossil:1.8), (Distinctive Feature: glowing sample vial:1.6).\nThese must be clearly visible and easily identifiable.\nThe background is sci-fi corridor with glowing panels, detailed yet subtle, adding depth without distracting from the character,\nBust shot, centered composition, clean silhouette, no extra text or logos, ZIP2D,  CXL-Mech",
                "negativePrompt": "Compression artifacts, bad art, worst quality, low quality, plastic, fake, bad limbs, conjoined, featureless, bad features, incorrect objects, watermark, ((signature):1.25), logo, zip2d_neg",
                "width": 832,
                "height": 832,
                "hashes": {
                    "model": "6330883d2c"
                },
                "resources": [
                    {
                        "type": "model",
                        "name": "artium_v20",
                        "hash": "6330883d2c"
                    }
                ]
            },
            "gen_info_raw": "A vibrant cyberpunk illustration, comic-book/anime hybrid, bold colors, high-contrast neon lighting.\nA ((Reptilian, lizard)) Mothership RPG Scientist character, defined line art, 29 years old.\n\nThe character is skilled in Field Medicine, Biology, and Xenobiology.\nThese skills are represented visually through specific details:\n- Field Medicine → medical patches and medkit\n- Biology → Petri dishes and scientific insignia\n- Xenobiology → alien specimen jar\n\n(Holding Ancient Fossil:1.8), (Distinctive Feature: glowing sample vial:1.6).\nThese must be clearly visible and easily identifiable.\n\nThe background is sci-fi corridor with glowing panels, detailed yet subtle, adding depth without distracting from the character,\n\nBust shot, centered composition, clean silhouette, no extra text or logos, ZIP2D,  CXL-Mech\nNegative prompt: Compression artifacts, bad art, worst quality, low quality, plastic, fake, bad limbs, conjoined, featureless, bad features, incorrect objects, watermark, ((signature):1.25), logo, zip2d_neg\nSteps: 40, Sampler: DPM++ 2M, Schedule type: Karras, CFG scale: 7, Seed: 3347898819, Size: 832x832, Model hash: 6330883d2c, Model: artium_v20, Denoising strength: 0.3, RNG: CPU, ControlNet 0: \"Module: CLIP-ViT-H (IPAdapter), Model: ip-adapter-plus_sdxl_vit-h [bc449f62], Weight: 0.35, Resize Mode: ResizeMode.INNER_FIT, Processor Res: 0.5, Threshold A: 0.5, Threshold B: 0.5, Guidance Start: 0.3, Guidance End: 0.7, Pixel Perfect: False, Control Mode: ControlMode.BALANCED, Hr Option: HiResFixOption.BOTH\", ControlNet 1: \"Module: CLIP-ViT-H (IPAdapter), Model: ip-adapter-plus-face_sdxl_vit-h [368cf551], Weight: 1, Resize Mode: ResizeMode.INNER_FIT, Processor Res: 0.5, Threshold A: 0.5, Threshold B: 0.5, Guidance Start: 0.1, Guidance End: 0.9, Pixel Perfect: False, Control Mode: ControlMode.BALANCED, Hr Option: HiResFixOption.BOTH\", Hires CFG Scale: 7, Hires upscale: 2, Hires steps: 15, Hires upscaler: ESRGAN_4x, TI hashes: \"CXL-Mech: 000b204acc87, CXL-Mech: 000b204acc87, CXL-Mech: 000b204acc87, CXL-Mech: 000b204acc87, CXL-Mech: 000b204acc87, CXL-Mech: 000b204acc87, CXL-Mech: 000b204acc87, CXL-Mech: 000b204acc87, CXL-Mech: 000b204acc87, CXL-Mech: 000b204acc87, CXL-Mech: 000b204acc87, CXL-Mech: 000b204acc87, CXL-Mech: 000b204acc87, CXL-Mech: 000b204acc87, zip2d_neg: a764ec702efd, zip2d_neg: a764ec702efd, CXL-Mech: 000b204acc87, CXL-Mech: 000b204acc87, zip2d_neg: a764ec702efd, zip2d_neg: a764ec702efd\", Pad conds: True, Version: f1.0.0v2-v1.10.1RC-latest-2454-g9086b215, Source Identifier: Stable Diffusion web UI"
        },
        {
            "type": "file",
            "id": 1034,
            "date": "2025-09-10 12:36:51",
            "created_date": "2025-09-10 12:36:51",
            "size": "2.70 MB",
            "is_under_scanned_path": true,
            "bytes": 2830314,
            "name": "00024-3347898818.png",
            "fullpath": "/Users/pixelkaos/Library/Application Support/StabilityMatrix/Packages/Stable Diffusion WebUI reForge/outputs/txt2img-images/2025-09-10/00024-3347898818.png",
            "gen_info_obj": {
                "steps": 40,
                "sampler": "DPM++ 2M",
                "Schedule type": "Karras",
                "cfgScale": 7,
                "seed": 3347898818,
                "size": "832x832",
                "Model hash": "6330883d2c",
                "Model": "artium_v20",
                "Denoising strength": 0.3,
                "RNG": "CPU",
                "Hires CFG Scale": 7,
                "Hires upscale": 2,
                "Hires steps": 15,
                "Hires upscaler": "ESRGAN_4x",
                "TI hashes": "ZIP2D: 353cf9be0675, CXL-Mech: 000b204acc87, ZIP2D: 353cf9be0675, CXL-Mech: 000b204acc87, CXL-Mech: 000b204acc87, CXL-Mech: 000b204acc87, CXL-Mech: 000b204acc87, CXL-Mech: 000b204acc87, CXL-Mech: 000b204acc87, CXL-Mech: 000b204acc87, CXL-Mech: 000b204acc87, CXL-Mech: 000b204acc87, CXL-Mech: 000b204acc87, CXL-Mech: 000b204acc87, CXL-Mech: 000b204acc87, CXL-Mech: 000b204acc87, CXL-Mech: 000b204acc87, CXL-Mech: 000b204acc87, zip2d_neg: a764ec702efd, zip2d_neg: a764ec702efd, CXL-Mech: 000b204acc87, CXL-Mech: 000b204acc87, zip2d_neg: a764ec702efd, zip2d_neg: a764ec702efd",
                "Pad conds": "True",
                "Version": "f1.0.0v2-v1.10.1RC-latest-2454-g9086b215",
                "Source Identifier": "Stable Diffusion web UI",
                "ControlNet 0": "Module: CLIP-ViT-H (IPAdapter), Model: ip-adapter-plus_sdxl_vit-h [bc449f62], Weight: 0.35, Resize Mode: ResizeMode.INNER_FIT, Processor Res: 0.5, Threshold A: 0.5, Threshold B: 0.5, Guidance Start: 0.3, Guidance End: 0.7, Pixel Perfect: False, Control Mode: ControlMode.BALANCED, Hr Option: HiResFixOption.BOTH",
                "ControlNet 1": "Module: CLIP-ViT-H (IPAdapter), Model: ip-adapter-plus-face_sdxl_vit-h [368cf551], Weight: 1, Resize Mode: ResizeMode.INNER_FIT, Processor Res: 0.5, Threshold A: 0.5, Threshold B: 0.5, Guidance Start: 0.1, Guidance End: 0.9, Pixel Perfect: False, Control Mode: ControlMode.BALANCED, Hr Option: HiResFixOption.BOTH",
                "prompt": "A vibrant cyberpunk illustration, comic-book/anime hybrid, bold colors, high-contrast neon lighting.\nA ((Reptilian, lizard)) Mothership RPG Scientist character, defined line art, 29 years old.\nThe character is skilled in Field Medicine, Biology, and Xenobiology.\nThese skills are represented visually through specific details:\n- Field Medicine → medical patches and medkit\n- Biology → Petri dishes and scientific insignia\n- Xenobiology → alien specimen jar\n(Holding Ancient Fossil:1.8), (Distinctive Feature: glowing sample vial:1.6).\nThese must be clearly visible and easily identifiable.\nThe background is sci-fi corridor with glowing panels, detailed yet subtle, adding depth without distracting from the character,\nBust shot, centered composition, clean silhouette, no extra text or logos, ZIP2D,  CXL-Mech",
                "negativePrompt": "Compression artifacts, bad art, worst quality, low quality, plastic, fake, bad limbs, conjoined, featureless, bad features, incorrect objects, watermark, ((signature):1.25), logo, zip2d_neg",
                "width": 832,
                "height": 832,
                "hashes": {
                    "model": "6330883d2c"
                },
                "resources": [
                    {
                        "type": "model",
                        "name": "artium_v20",
                        "hash": "6330883d2c"
                    }
                ]
            },
            "gen_info_raw": "A vibrant cyberpunk illustration, comic-book/anime hybrid, bold colors, high-contrast neon lighting.\nA ((Reptilian, lizard)) Mothership RPG Scientist character, defined line art, 29 years old.\n\nThe character is skilled in Field Medicine, Biology, and Xenobiology.\nThese skills are represented visually through specific details:\n- Field Medicine → medical patches and medkit\n- Biology → Petri dishes and scientific insignia\n- Xenobiology → alien specimen jar\n\n(Holding Ancient Fossil:1.8), (Distinctive Feature: glowing sample vial:1.6).\nThese must be clearly visible and easily identifiable.\n\nThe background is sci-fi corridor with glowing panels, detailed yet subtle, adding depth without distracting from the character,\n\nBust shot, centered composition, clean silhouette, no extra text or logos, ZIP2D,  CXL-Mech\nNegative prompt: Compression artifacts, bad art, worst quality, low quality, plastic, fake, bad limbs, conjoined, featureless, bad features, incorrect objects, watermark, ((signature):1.25), logo, zip2d_neg\nSteps: 40, Sampler: DPM++ 2M, Schedule type: Karras, CFG scale: 7, Seed: 3347898818, Size: 832x832, Model hash: 6330883d2c, Model: artium_v20, Denoising strength: 0.3, RNG: CPU, ControlNet 0: \"Module: CLIP-ViT-H (IPAdapter), Model: ip-adapter-plus_sdxl_vit-h [bc449f62], Weight: 0.35, Resize Mode: ResizeMode.INNER_FIT, Processor Res: 0.5, Threshold A: 0.5, Threshold B: 0.5, Guidance Start: 0.3, Guidance End: 0.7, Pixel Perfect: False, Control Mode: ControlMode.BALANCED, Hr Option: HiResFixOption.BOTH\", ControlNet 1: \"Module: CLIP-ViT-H (IPAdapter), Model: ip-adapter-plus-face_sdxl_vit-h [368cf551], Weight: 1, Resize Mode: ResizeMode.INNER_FIT, Processor Res: 0.5, Threshold A: 0.5, Threshold B: 0.5, Guidance Start: 0.1, Guidance End: 0.9, Pixel Perfect: False, Control Mode: ControlMode.BALANCED, Hr Option: HiResFixOption.BOTH\", Hires CFG Scale: 7, Hires upscale: 2, Hires steps: 15, Hires upscaler: ESRGAN_4x, TI hashes: \"ZIP2D: 353cf9be0675, CXL-Mech: 000b204acc87, ZIP2D: 353cf9be0675, CXL-Mech: 000b204acc87, CXL-Mech: 000b204acc87, CXL-Mech: 000b204acc87, CXL-Mech: 000b204acc87, CXL-Mech: 000b204acc87, CXL-Mech: 000b204acc87, CXL-Mech: 000b204acc87, CXL-Mech: 000b204acc87, CXL-Mech: 000b204acc87, CXL-Mech: 000b204acc87, CXL-Mech: 000b204acc87, CXL-Mech: 000b204acc87, CXL-Mech: 000b204acc87, CXL-Mech: 000b204acc87, CXL-Mech: 000b204acc87, zip2d_neg: a764ec702efd, zip2d_neg: a764ec702efd, CXL-Mech: 000b204acc87, CXL-Mech: 000b204acc87, zip2d_neg: a764ec702efd, zip2d_neg: a764ec702efd\", Pad conds: True, Version: f1.0.0v2-v1.10.1RC-latest-2454-g9086b215, Source Identifier: Stable Diffusion web UI"
        },
        {
            "type": "file",
            "id": 843,
            "date": "2025-09-10 09:39:48",
            "created_date": "2025-09-10 09:39:48",
            "size": "2.86 MB",
            "is_under_scanned_path": true,
            "bytes": 2995738,
            "name": "00005-2660490907.png",
            "fullpath": "/Users/pixelkaos/Library/Application Support/StabilityMatrix/Packages/Stable Diffusion WebUI reForge/outputs/txt2img-images/2025-09-10/00005-2660490907.png",
            "gen_info_obj": {
                "steps": 40,
                "sampler": "DPM++ 2M",
                "Schedule type": "Karras",
                "cfgScale": 7,
                "seed": 2660490907,
                "size": "832x832",
                "Model hash": "6330883d2c",
                "Model": "artium_v20",
                "Denoising strength": 0.3,
                "RNG": "CPU",
                "Hires CFG Scale": 7,
                "Hires upscale": 2,
                "Hires steps": 15,
                "Hires upscaler": "ESRGAN_4x",
                "TI hashes": "ZIP2D: 353cf9be0675, CXL-Mech: 000b204acc87, ZIP2D: 353cf9be0675, CXL-Mech: 000b204acc87, CXL-Mech: 000b204acc87, CXL-Mech: 000b204acc87, CXL-Mech: 000b204acc87, CXL-Mech: 000b204acc87, CXL-Mech: 000b204acc87, CXL-Mech: 000b204acc87, CXL-Mech: 000b204acc87, CXL-Mech: 000b204acc87, CXL-Mech: 000b204acc87, CXL-Mech: 000b204acc87, CXL-Mech: 000b204acc87, CXL-Mech: 000b204acc87, CXL-Mech: 000b204acc87, CXL-Mech: 000b204acc87, zip2d_neg: a764ec702efd, zip2d_neg: a764ec702efd, CXL-Mech: 000b204acc87, CXL-Mech: 000b204acc87, zip2d_neg: a764ec702efd, zip2d_neg: a764ec702efd",
                "Pad conds": "True",
                "Version": "f1.0.0v2-v1.10.1RC-latest-2454-g9086b215",
                "Source Identifier": "Stable Diffusion web UI",
                "ControlNet 0": "Module: CLIP-ViT-H (IPAdapter), Model: ip-adapter-plus_sdxl_vit-h [bc449f62], Weight: 0.35, Resize Mode: ResizeMode.INNER_FIT, Processor Res: 0.5, Threshold A: 0.5, Threshold B: 0.5, Guidance Start: 0.3, Guidance End: 0.7, Pixel Perfect: False, Control Mode: ControlMode.BALANCED, Hr Option: HiResFixOption.BOTH",
                "ControlNet 1": "Module: CLIP-ViT-H (IPAdapter), Model: ip-adapter-plus-face_sdxl_vit-h [368cf551], Weight: 1, Resize Mode: ResizeMode.INNER_FIT, Processor Res: 0.5, Threshold A: 0.5, Threshold B: 0.5, Guidance Start: 0.1, Guidance End: 0.9, Pixel Perfect: False, Control Mode: ControlMode.BALANCED, Hr Option: HiResFixOption.BOTH",
                "prompt": "A vibrant cyberpunk illustration, comic-book/anime hybrid, bold colors, defined line art, high-contrast neon lighting.\nA ((female)) Mothership RPG Scientist character, 22 years old.\nThe character is skilled in Field Medicine, Biology, and Xenobiology.\nThese skills are represented visually through specific details:\n- Field Medicine → medical patches and medkit\n- Biology → Petri dishes and scientific insignia\n- Xenobiology → alien specimen jar\n(Holding Sample Vial:1.8), (Distinctive Feature: mutated hand:1.6).\nThese must be clearly visible and easily identifiable.\nThe background is neon-lit maintenance hangar, detailed yet subtle, adding depth without distracting from the character,\nBust shot, centered composition, clean silhouette, no extra text or logos, ZIP2D,  CXL-Mech",
                "negativePrompt": "Compression artifacts, bad art, worst quality, low quality, plastic, fake, bad limbs, conjoined, featureless, bad features, incorrect objects, watermark, ((signature):1.25), logo, zip2d_neg",
                "width": 832,
                "height": 832,
                "hashes": {
                    "model": "6330883d2c"
                },
                "resources": [
                    {
                        "type": "model",
                        "name": "artium_v20",
                        "hash": "6330883d2c"
                    }
                ]
            },
            "gen_info_raw": "A vibrant cyberpunk illustration, comic-book/anime hybrid, bold colors, defined line art, high-contrast neon lighting.\nA ((female)) Mothership RPG Scientist character, 22 years old.\n\nThe character is skilled in Field Medicine, Biology, and Xenobiology.\nThese skills are represented visually through specific details:\n- Field Medicine → medical patches and medkit\n- Biology → Petri dishes and scientific insignia\n- Xenobiology → alien specimen jar\n\n(Holding Sample Vial:1.8), (Distinctive Feature: mutated hand:1.6).\nThese must be clearly visible and easily identifiable.\n\nThe background is neon-lit maintenance hangar, detailed yet subtle, adding depth without distracting from the character,\n\nBust shot, centered composition, clean silhouette, no extra text or logos, ZIP2D,  CXL-Mech\nNegative prompt: Compression artifacts, bad art, worst quality, low quality, plastic, fake, bad limbs, conjoined, featureless, bad features, incorrect objects, watermark, ((signature):1.25), logo, zip2d_neg\nSteps: 40, Sampler: DPM++ 2M, Schedule type: Karras, CFG scale: 7, Seed: 2660490907, Size: 832x832, Model hash: 6330883d2c, Model: artium_v20, Denoising strength: 0.3, RNG: CPU, ControlNet 0: \"Module: CLIP-ViT-H (IPAdapter), Model: ip-adapter-plus_sdxl_vit-h [bc449f62], Weight: 0.35, Resize Mode: ResizeMode.INNER_FIT, Processor Res: 0.5, Threshold A: 0.5, Threshold B: 0.5, Guidance Start: 0.3, Guidance End: 0.7, Pixel Perfect: False, Control Mode: ControlMode.BALANCED, Hr Option: HiResFixOption.BOTH\", ControlNet 1: \"Module: CLIP-ViT-H (IPAdapter), Model: ip-adapter-plus-face_sdxl_vit-h [368cf551], Weight: 1, Resize Mode: ResizeMode.INNER_FIT, Processor Res: 0.5, Threshold A: 0.5, Threshold B: 0.5, Guidance Start: 0.1, Guidance End: 0.9, Pixel Perfect: False, Control Mode: ControlMode.BALANCED, Hr Option: HiResFixOption.BOTH\", Hires CFG Scale: 7, Hires upscale: 2, Hires steps: 15, Hires upscaler: ESRGAN_4x, TI hashes: \"ZIP2D: 353cf9be0675, CXL-Mech: 000b204acc87, ZIP2D: 353cf9be0675, CXL-Mech: 000b204acc87, CXL-Mech: 000b204acc87, CXL-Mech: 000b204acc87, CXL-Mech: 000b204acc87, CXL-Mech: 000b204acc87, CXL-Mech: 000b204acc87, CXL-Mech: 000b204acc87, CXL-Mech: 000b204acc87, CXL-Mech: 000b204acc87, CXL-Mech: 000b204acc87, CXL-Mech: 000b204acc87, CXL-Mech: 000b204acc87, CXL-Mech: 000b204acc87, CXL-Mech: 000b204acc87, CXL-Mech: 000b204acc87, zip2d_neg: a764ec702efd, zip2d_neg: a764ec702efd, CXL-Mech: 000b204acc87, CXL-Mech: 000b204acc87, zip2d_neg: a764ec702efd, zip2d_neg: a764ec702efd\", Pad conds: True, Version: f1.0.0v2-v1.10.1RC-latest-2454-g9086b215, Source Identifier: Stable Diffusion web UI"
        },
        {
            "type": "file",
            "id": 842,
            "date": "2025-09-10 09:23:22",
            "created_date": "2025-09-10 09:23:22",
            "size": "2.85 MB",
            "is_under_scanned_path": true,
            "bytes": 2988109,
            "name": "00003-859730610.png",
            "fullpath": "/Users/pixelkaos/Library/Application Support/StabilityMatrix/Packages/Stable Diffusion WebUI reForge/outputs/txt2img-images/2025-09-10/00003-859730610.png",
            "gen_info_obj": {
                "steps": 40,
                "sampler": "DPM++ 2M",
                "Schedule type": "Karras",
                "cfgScale": 7,
                "seed": 859730610,
                "size": "832x832",
                "Model hash": "6330883d2c",
                "Model": "artium_v20",
                "Denoising strength": 0.3,
                "RNG": "CPU",
                "Hires prompt": "A vibrant cyberpunk illustration, comic-book/anime hybrid, bold colors, defined line art, high-contrast neon lighting.nA ((male)) Mothership RPG Scientist character, 42 years old.nnThe character is skilled in Field Medicine, Biology, and Xenobiology.nThese skills are represented visually through specific details:n- Field Medicine → medical patches and medkitn- Biology → Petri dishes and scientific insignian- Xenobiology → alien specimen jarnn(Holding Sample Vial:1.8), (Distinctive Feature: mutated hand:1.6).nThese must be clearly visible and easily identifiable.nnThe background is starship command deck with holographic displays, detailed yet subtle, adding depth without distracting from the character,nnBust shot, centered composition, clean silhouette, no extra text or logos, ZIP2D,  CXL-Mech",
                "Hires CFG Scale": 7,
                "Hires upscale": 2,
                "Hires steps": 15,
                "Hires upscaler": "ESRGAN_4x",
                "TI hashes": "ZIP2D: 353cf9be0675, CXL-Mech: 000b204acc87, ZIP2D: 353cf9be0675, CXL-Mech: 000b204acc87, CXL-Mech: 000b204acc87, CXL-Mech: 000b204acc87, CXL-Mech: 000b204acc87, CXL-Mech: 000b204acc87, CXL-Mech: 000b204acc87, CXL-Mech: 000b204acc87, CXL-Mech: 000b204acc87, CXL-Mech: 000b204acc87, CXL-Mech: 000b204acc87, CXL-Mech: 000b204acc87, CXL-Mech: 000b204acc87, CXL-Mech: 000b204acc87, CXL-Mech: 000b204acc87, CXL-Mech: 000b204acc87, zip2d_neg: a764ec702efd, zip2d_neg: a764ec702efd, CXL-Mech: 000b204acc87, CXL-Mech: 000b204acc87, zip2d_neg: a764ec702efd, zip2d_neg: a764ec702efd",
                "Pad conds": "True",
                "Version": "f1.0.0v2-v1.10.1RC-latest-2454-g9086b215",
                "Source Identifier": "Stable Diffusion web UI",
                "ControlNet 0": "Module: CLIP-ViT-H (IPAdapter), Model: ip-adapter-plus_sdxl_vit-h [bc449f62], Weight: 0.35, Resize Mode: ResizeMode.INNER_FIT, Processor Res: 0.5, Threshold A: 0.5, Threshold B: 0.5, Guidance Start: 0.3, Guidance End: 0.7, Pixel Perfect: False, Control Mode: ControlMode.BALANCED, Hr Option: HiResFixOption.BOTH",
                "ControlNet 1": "Module: CLIP-ViT-H (IPAdapter), Model: ip-adapter-plus-face_sdxl_vit-h [368cf551], Weight: 1, Resize Mode: ResizeMode.INNER_FIT, Processor Res: 0.5, Threshold A: 0.5, Threshold B: 0.5, Guidance Start: 0.1, Guidance End: 0.9, Pixel Perfect: False, Control Mode: ControlMode.BALANCED, Hr Option: HiResFixOption.BOTH",
                "prompt": "A vibrant cyberpunk illustration, comic-book/anime hybrid, bold colors, defined line art, high-contrast neon lighting.\nA ((male)) Mothership RPG Scientist character, 36 years old.\nThe character is skilled in Field Medicine, Biology, and Xenobiology.\nThese skills are represented visually through specific details:\n- Field Medicine → medical patches and medkit\n- Biology → Petri dishes and scientific insignia\n- Xenobiology → alien specimen jar\n(Holding Sample Vial:1.8), (Distinctive Feature: mutated hand:1.6).\nThese must be clearly visible and easily identifiable.\nThe background is industrial ship bay with mist, detailed yet subtle, adding depth without distracting from the character,\nBust shot, centered composition, clean silhouette, no extra text or logos, ZIP2D,  CXL-Mech",
                "negativePrompt": "Compression artifacts, bad art, worst quality, low quality, plastic, fake, bad limbs, conjoined, featureless, bad features, incorrect objects, watermark, ((signature):1.25), logo, zip2d_neg",
                "width": 832,
                "height": 832,
                "hashes": {
                    "model": "6330883d2c"
                },
                "resources": [
                    {
                        "type": "model",
                        "name": "artium_v20",
                        "hash": "6330883d2c"
                    }
                ]
            },
            "gen_info_raw": "A vibrant cyberpunk illustration, comic-book/anime hybrid, bold colors, defined line art, high-contrast neon lighting.\nA ((male)) Mothership RPG Scientist character, 36 years old.\n\nThe character is skilled in Field Medicine, Biology, and Xenobiology.\nThese skills are represented visually through specific details:\n- Field Medicine → medical patches and medkit\n- Biology → Petri dishes and scientific insignia\n- Xenobiology → alien specimen jar\n\n(Holding Sample Vial:1.8), (Distinctive Feature: mutated hand:1.6).\nThese must be clearly visible and easily identifiable.\n\nThe background is industrial ship bay with mist, detailed yet subtle, adding depth without distracting from the character,\n\nBust shot, centered composition, clean silhouette, no extra text or logos, ZIP2D,  CXL-Mech\nNegative prompt: Compression artifacts, bad art, worst quality, low quality, plastic, fake, bad limbs, conjoined, featureless, bad features, incorrect objects, watermark, ((signature):1.25), logo, zip2d_neg\nSteps: 40, Sampler: DPM++ 2M, Schedule type: Karras, CFG scale: 7, Seed: 859730610, Size: 832x832, Model hash: 6330883d2c, Model: artium_v20, Denoising strength: 0.3, RNG: CPU, ControlNet 0: \"Module: CLIP-ViT-H (IPAdapter), Model: ip-adapter-plus_sdxl_vit-h [bc449f62], Weight: 0.35, Resize Mode: ResizeMode.INNER_FIT, Processor Res: 0.5, Threshold A: 0.5, Threshold B: 0.5, Guidance Start: 0.3, Guidance End: 0.7, Pixel Perfect: False, Control Mode: ControlMode.BALANCED, Hr Option: HiResFixOption.BOTH\", ControlNet 1: \"Module: CLIP-ViT-H (IPAdapter), Model: ip-adapter-plus-face_sdxl_vit-h [368cf551], Weight: 1, Resize Mode: ResizeMode.INNER_FIT, Processor Res: 0.5, Threshold A: 0.5, Threshold B: 0.5, Guidance Start: 0.1, Guidance End: 0.9, Pixel Perfect: False, Control Mode: ControlMode.BALANCED, Hr Option: HiResFixOption.BOTH\", Hires prompt: \"A vibrant cyberpunk illustration, comic-book/anime hybrid, bold colors, defined line art, high-contrast neon lighting.\\nA ((male)) Mothership RPG Scientist character, 42 years old.\\n\\nThe character is skilled in Field Medicine, Biology, and Xenobiology.\\nThese skills are represented visually through specific details:\\n- Field Medicine → medical patches and medkit\\n- Biology → Petri dishes and scientific insignia\\n- Xenobiology → alien specimen jar\\n\\n(Holding Sample Vial:1.8), (Distinctive Feature: mutated hand:1.6).\\nThese must be clearly visible and easily identifiable.\\n\\nThe background is starship command deck with holographic displays, detailed yet subtle, adding depth without distracting from the character,\\n\\nBust shot, centered composition, clean silhouette, no extra text or logos, ZIP2D,  CXL-Mech\", Hires CFG Scale: 7, Hires upscale: 2, Hires steps: 15, Hires upscaler: ESRGAN_4x, TI hashes: \"ZIP2D: 353cf9be0675, CXL-Mech: 000b204acc87, ZIP2D: 353cf9be0675, CXL-Mech: 000b204acc87, CXL-Mech: 000b204acc87, CXL-Mech: 000b204acc87, CXL-Mech: 000b204acc87, CXL-Mech: 000b204acc87, CXL-Mech: 000b204acc87, CXL-Mech: 000b204acc87, CXL-Mech: 000b204acc87, CXL-Mech: 000b204acc87, CXL-Mech: 000b204acc87, CXL-Mech: 000b204acc87, CXL-Mech: 000b204acc87, CXL-Mech: 000b204acc87, CXL-Mech: 000b204acc87, CXL-Mech: 000b204acc87, zip2d_neg: a764ec702efd, zip2d_neg: a764ec702efd, CXL-Mech: 000b204acc87, CXL-Mech: 000b204acc87, zip2d_neg: a764ec702efd, zip2d_neg: a764ec702efd\", Pad conds: True, Version: f1.0.0v2-v1.10.1RC-latest-2454-g9086b215, Source Identifier: Stable Diffusion web UI"
        },
        {
            "type": "file",
            "id": 841,
            "date": "2025-09-10 09:15:32",
            "created_date": "2025-09-10 09:15:32",
            "size": "2.69 MB",
            "is_under_scanned_path": true,
            "bytes": 2820256,
            "name": "00002-859730609.png",
            "fullpath": "/Users/pixelkaos/Library/Application Support/StabilityMatrix/Packages/Stable Diffusion WebUI reForge/outputs/txt2img-images/2025-09-10/00002-859730609.png",
            "gen_info_obj": {
                "steps": 40,
                "sampler": "DPM++ 2M",
                "Schedule type": "Karras",
                "cfgScale": 7,
                "seed": 859730609,
                "size": "832x832",
                "Model hash": "6330883d2c",
                "Model": "artium_v20",
                "Denoising strength": 0.3,
                "RNG": "CPU",
                "Hires CFG Scale": 7,
                "Hires upscale": 2,
                "Hires steps": 15,
                "Hires upscaler": "ESRGAN_4x",
                "TI hashes": "ZIP2D: 353cf9be0675, CXL-Mech: 000b204acc87, ZIP2D: 353cf9be0675, CXL-Mech: 000b204acc87, CXL-Mech: 000b204acc87, CXL-Mech: 000b204acc87, CXL-Mech: 000b204acc87, CXL-Mech: 000b204acc87, CXL-Mech: 000b204acc87, CXL-Mech: 000b204acc87, CXL-Mech: 000b204acc87, CXL-Mech: 000b204acc87, CXL-Mech: 000b204acc87, CXL-Mech: 000b204acc87, CXL-Mech: 000b204acc87, CXL-Mech: 000b204acc87, CXL-Mech: 000b204acc87, CXL-Mech: 000b204acc87, zip2d_neg: a764ec702efd, zip2d_neg: a764ec702efd, CXL-Mech: 000b204acc87, CXL-Mech: 000b204acc87, zip2d_neg: a764ec702efd, zip2d_neg: a764ec702efd",
                "Pad conds": "True",
                "Version": "f1.0.0v2-v1.10.1RC-latest-2454-g9086b215",
                "Source Identifier": "Stable Diffusion web UI",
                "ControlNet 0": "Module: CLIP-ViT-H (IPAdapter), Model: ip-adapter-plus_sdxl_vit-h [bc449f62], Weight: 0.35, Resize Mode: ResizeMode.INNER_FIT, Processor Res: 0.5, Threshold A: 0.5, Threshold B: 0.5, Guidance Start: 0.3, Guidance End: 0.7, Pixel Perfect: False, Control Mode: ControlMode.BALANCED, Hr Option: HiResFixOption.BOTH",
                "ControlNet 1": "Module: CLIP-ViT-H (IPAdapter), Model: ip-adapter-plus-face_sdxl_vit-h [368cf551], Weight: 1, Resize Mode: ResizeMode.INNER_FIT, Processor Res: 0.5, Threshold A: 0.5, Threshold B: 0.5, Guidance Start: 0.1, Guidance End: 0.9, Pixel Perfect: False, Control Mode: ControlMode.BALANCED, Hr Option: HiResFixOption.BOTH",
                "prompt": "A vibrant cyberpunk illustration, comic-book/anime hybrid, bold colors, defined line art, high-contrast neon lighting.\nA ((male)) Mothership RPG Scientist character, 42 years old.\nThe character is skilled in Field Medicine, Biology, and Xenobiology.\nThese skills are represented visually through specific details:\n- Field Medicine → medical patches and medkit\n- Biology → Petri dishes and scientific insignia\n- Xenobiology → alien specimen jar\n(Holding Sample Vial:1.8), (Distinctive Feature: mutated hand:1.6).\nThese must be clearly visible and easily identifiable.\nThe background is starship command deck with holographic displays, detailed yet subtle, adding depth without distracting from the character,\nBust shot, centered composition, clean silhouette, no extra text or logos, ZIP2D,  CXL-Mech",
                "negativePrompt": "Compression artifacts, bad art, worst quality, low quality, plastic, fake, bad limbs, conjoined, featureless, bad features, incorrect objects, watermark, ((signature):1.25), logo, zip2d_neg",
                "width": 832,
                "height": 832,
                "hashes": {
                    "model": "6330883d2c"
                },
                "resources": [
                    {
                        "type": "model",
                        "name": "artium_v20",
                        "hash": "6330883d2c"
                    }
                ]
            },
            "gen_info_raw": "A vibrant cyberpunk illustration, comic-book/anime hybrid, bold colors, defined line art, high-contrast neon lighting.\nA ((male)) Mothership RPG Scientist character, 42 years old.\n\nThe character is skilled in Field Medicine, Biology, and Xenobiology.\nThese skills are represented visually through specific details:\n- Field Medicine → medical patches and medkit\n- Biology → Petri dishes and scientific insignia\n- Xenobiology → alien specimen jar\n\n(Holding Sample Vial:1.8), (Distinctive Feature: mutated hand:1.6).\nThese must be clearly visible and easily identifiable.\n\nThe background is starship command deck with holographic displays, detailed yet subtle, adding depth without distracting from the character,\n\nBust shot, centered composition, clean silhouette, no extra text or logos, ZIP2D,  CXL-Mech\nNegative prompt: Compression artifacts, bad art, worst quality, low quality, plastic, fake, bad limbs, conjoined, featureless, bad features, incorrect objects, watermark, ((signature):1.25), logo, zip2d_neg\nSteps: 40, Sampler: DPM++ 2M, Schedule type: Karras, CFG scale: 7, Seed: 859730609, Size: 832x832, Model hash: 6330883d2c, Model: artium_v20, Denoising strength: 0.3, RNG: CPU, ControlNet 0: \"Module: CLIP-ViT-H (IPAdapter), Model: ip-adapter-plus_sdxl_vit-h [bc449f62], Weight: 0.35, Resize Mode: ResizeMode.INNER_FIT, Processor Res: 0.5, Threshold A: 0.5, Threshold B: 0.5, Guidance Start: 0.3, Guidance End: 0.7, Pixel Perfect: False, Control Mode: ControlMode.BALANCED, Hr Option: HiResFixOption.BOTH\", ControlNet 1: \"Module: CLIP-ViT-H (IPAdapter), Model: ip-adapter-plus-face_sdxl_vit-h [368cf551], Weight: 1, Resize Mode: ResizeMode.INNER_FIT, Processor Res: 0.5, Threshold A: 0.5, Threshold B: 0.5, Guidance Start: 0.1, Guidance End: 0.9, Pixel Perfect: False, Control Mode: ControlMode.BALANCED, Hr Option: HiResFixOption.BOTH\", Hires CFG Scale: 7, Hires upscale: 2, Hires steps: 15, Hires upscaler: ESRGAN_4x, TI hashes: \"ZIP2D: 353cf9be0675, CXL-Mech: 000b204acc87, ZIP2D: 353cf9be0675, CXL-Mech: 000b204acc87, CXL-Mech: 000b204acc87, CXL-Mech: 000b204acc87, CXL-Mech: 000b204acc87, CXL-Mech: 000b204acc87, CXL-Mech: 000b204acc87, CXL-Mech: 000b204acc87, CXL-Mech: 000b204acc87, CXL-Mech: 000b204acc87, CXL-Mech: 000b204acc87, CXL-Mech: 000b204acc87, CXL-Mech: 000b204acc87, CXL-Mech: 000b204acc87, CXL-Mech: 000b204acc87, CXL-Mech: 000b204acc87, zip2d_neg: a764ec702efd, zip2d_neg: a764ec702efd, CXL-Mech: 000b204acc87, CXL-Mech: 000b204acc87, zip2d_neg: a764ec702efd, zip2d_neg: a764ec702efd\", Pad conds: True, Version: f1.0.0v2-v1.10.1RC-latest-2454-g9086b215, Source Identifier: Stable Diffusion web UI"
        },
        {
            "type": "file",
            "id": 105,
            "date": "2025-09-09 23:46:09",
            "created_date": "2025-09-09 23:46:09",
            "size": "2.75 MB",
            "is_under_scanned_path": true,
            "bytes": 2885042,
            "name": "00148-3084941891.png",
            "fullpath": "/Users/pixelkaos/Library/Application Support/StabilityMatrix/Packages/Stable Diffusion WebUI reForge/outputs/txt2img-images/2025-09-09/00148-3084941891.png",
            "gen_info_obj": {
                "steps": 40,
                "sampler": "DPM++ 2M",
                "Schedule type": "Karras",
                "cfgScale": 7,
                "seed": 3084941891,
                "size": "832x832",
                "Model hash": "6330883d2c",
                "Model": "artium_v20",
                "Denoising strength": 0.3,
                "RNG": "CPU",
                "Hires prompt": "A vibrant cyberpunk illustration, comic-book/anime hybrid, bold colors, defined line art, high-contrast neon lighting.nA ((female)) Mothership RPG Scientist character, 42 years old.nnThe character is skilled in Field Medicine, Biology, and Xenobiology.nThese skills are represented visually through specific details:n- Field Medicine → medical patches and medkitn- Biology → Petri dishes and scientific insignian- Xenobiology → alien specimen jarnn(Holding Custom Microscope:1.8), (Distinctive Feature: bulky scanning device:1.6).nThese must be clearly visible and easily identifiable.nnThe background is neon-lit maintenance hangar, detailed yet subtle, adding depth without distracting from the character,nnBust shot, centered composition, clean silhouette, no extra text or logos, ZIP2D,  CXL-Mech",
                "Hires CFG Scale": 7,
                "Hires upscale": 2,
                "Hires steps": 15,
                "Hires upscaler": "ESRGAN_4x",
                "TI hashes": "ZIP2D: 353cf9be0675, CXL-Mech: 000b204acc87, ZIP2D: 353cf9be0675, CXL-Mech: 000b204acc87, CXL-Mech: 000b204acc87, CXL-Mech: 000b204acc87, CXL-Mech: 000b204acc87, CXL-Mech: 000b204acc87, CXL-Mech: 000b204acc87, CXL-Mech: 000b204acc87, CXL-Mech: 000b204acc87, CXL-Mech: 000b204acc87, CXL-Mech: 000b204acc87, CXL-Mech: 000b204acc87, CXL-Mech: 000b204acc87, CXL-Mech: 000b204acc87, CXL-Mech: 000b204acc87, CXL-Mech: 000b204acc87, zip2d_neg: a764ec702efd, zip2d_neg: a764ec702efd, CXL-Mech: 000b204acc87, CXL-Mech: 000b204acc87, zip2d_neg: a764ec702efd, zip2d_neg: a764ec702efd",
                "Pad conds": "True",
                "Version": "f1.0.0v2-v1.10.1RC-latest-2454-g9086b215",
                "Source Identifier": "Stable Diffusion web UI",
                "ControlNet 0": "Module: CLIP-ViT-H (IPAdapter), Model: ip-adapter-plus_sdxl_vit-h [bc449f62], Weight: 0.35, Resize Mode: ResizeMode.INNER_FIT, Processor Res: 0.5, Threshold A: 0.5, Threshold B: 0.5, Guidance Start: 0.3, Guidance End: 0.7, Pixel Perfect: False, Control Mode: ControlMode.BALANCED, Hr Option: HiResFixOption.BOTH",
                "ControlNet 1": "Module: CLIP-ViT-H (IPAdapter), Model: ip-adapter-plus-face_sdxl_vit-h [368cf551], Weight: 1, Resize Mode: ResizeMode.INNER_FIT, Processor Res: 0.5, Threshold A: 0.5, Threshold B: 0.5, Guidance Start: 0.1, Guidance End: 0.9, Pixel Perfect: False, Control Mode: ControlMode.BALANCED, Hr Option: HiResFixOption.BOTH",
                "prompt": "A vibrant cyberpunk illustration, comic-book/anime hybrid, bold colors, defined line art, high-contrast neon lighting.\nA ((non-binary)) Mothership RPG Scientist character, 29 years old.\nThe character is skilled in Field Medicine, Biology, and Xenobiology.\nThese skills are represented visually through specific details:\n- Field Medicine → medical patches and medkit\n- Biology → Petri dishes and scientific insignia\n- Xenobiology → alien specimen jar\n(Holding Custom Microscope:1.8), (Distinctive Feature: bulky scanning device:1.6).\nThese must be clearly visible and easily identifiable.\nThe background is sci-fi corridor with glowing panels, detailed yet subtle, adding depth without distracting from the character,\nBust shot, centered composition, clean silhouette, no extra text or logos, ZIP2D,  CXL-Mech",
                "negativePrompt": "Compression artifacts, bad art, worst quality, low quality, plastic, fake, bad limbs, conjoined, featureless, bad features, incorrect objects, watermark, ((signature):1.25), logo, zip2d_neg",
                "width": 832,
                "height": 832,
                "hashes": {
                    "model": "6330883d2c"
                },
                "resources": [
                    {
                        "type": "model",
                        "name": "artium_v20",
                        "hash": "6330883d2c"
                    }
                ]
            },
            "gen_info_raw": "A vibrant cyberpunk illustration, comic-book/anime hybrid, bold colors, defined line art, high-contrast neon lighting.\nA ((non-binary)) Mothership RPG Scientist character, 29 years old.\n\nThe character is skilled in Field Medicine, Biology, and Xenobiology.\nThese skills are represented visually through specific details:\n- Field Medicine → medical patches and medkit\n- Biology → Petri dishes and scientific insignia\n- Xenobiology → alien specimen jar\n\n(Holding Custom Microscope:1.8), (Distinctive Feature: bulky scanning device:1.6).\nThese must be clearly visible and easily identifiable.\n\nThe background is sci-fi corridor with glowing panels, detailed yet subtle, adding depth without distracting from the character,\n\nBust shot, centered composition, clean silhouette, no extra text or logos, ZIP2D,  CXL-Mech\nNegative prompt: Compression artifacts, bad art, worst quality, low quality, plastic, fake, bad limbs, conjoined, featureless, bad features, incorrect objects, watermark, ((signature):1.25), logo, zip2d_neg\nSteps: 40, Sampler: DPM++ 2M, Schedule type: Karras, CFG scale: 7, Seed: 3084941891, Size: 832x832, Model hash: 6330883d2c, Model: artium_v20, Denoising strength: 0.3, RNG: CPU, ControlNet 0: \"Module: CLIP-ViT-H (IPAdapter), Model: ip-adapter-plus_sdxl_vit-h [bc449f62], Weight: 0.35, Resize Mode: ResizeMode.INNER_FIT, Processor Res: 0.5, Threshold A: 0.5, Threshold B: 0.5, Guidance Start: 0.3, Guidance End: 0.7, Pixel Perfect: False, Control Mode: ControlMode.BALANCED, Hr Option: HiResFixOption.BOTH\", ControlNet 1: \"Module: CLIP-ViT-H (IPAdapter), Model: ip-adapter-plus-face_sdxl_vit-h [368cf551], Weight: 1, Resize Mode: ResizeMode.INNER_FIT, Processor Res: 0.5, Threshold A: 0.5, Threshold B: 0.5, Guidance Start: 0.1, Guidance End: 0.9, Pixel Perfect: False, Control Mode: ControlMode.BALANCED, Hr Option: HiResFixOption.BOTH\", Hires prompt: \"A vibrant cyberpunk illustration, comic-book/anime hybrid, bold colors, defined line art, high-contrast neon lighting.\\nA ((female)) Mothership RPG Scientist character, 42 years old.\\n\\nThe character is skilled in Field Medicine, Biology, and Xenobiology.\\nThese skills are represented visually through specific details:\\n- Field Medicine → medical patches and medkit\\n- Biology → Petri dishes and scientific insignia\\n- Xenobiology → alien specimen jar\\n\\n(Holding Custom Microscope:1.8), (Distinctive Feature: bulky scanning device:1.6).\\nThese must be clearly visible and easily identifiable.\\n\\nThe background is neon-lit maintenance hangar, detailed yet subtle, adding depth without distracting from the character,\\n\\nBust shot, centered composition, clean silhouette, no extra text or logos, ZIP2D,  CXL-Mech\", Hires CFG Scale: 7, Hires upscale: 2, Hires steps: 15, Hires upscaler: ESRGAN_4x, TI hashes: \"ZIP2D: 353cf9be0675, CXL-Mech: 000b204acc87, ZIP2D: 353cf9be0675, CXL-Mech: 000b204acc87, CXL-Mech: 000b204acc87, CXL-Mech: 000b204acc87, CXL-Mech: 000b204acc87, CXL-Mech: 000b204acc87, CXL-Mech: 000b204acc87, CXL-Mech: 000b204acc87, CXL-Mech: 000b204acc87, CXL-Mech: 000b204acc87, CXL-Mech: 000b204acc87, CXL-Mech: 000b204acc87, CXL-Mech: 000b204acc87, CXL-Mech: 000b204acc87, CXL-Mech: 000b204acc87, CXL-Mech: 000b204acc87, zip2d_neg: a764ec702efd, zip2d_neg: a764ec702efd, CXL-Mech: 000b204acc87, CXL-Mech: 000b204acc87, zip2d_neg: a764ec702efd, zip2d_neg: a764ec702efd\", Pad conds: True, Version: f1.0.0v2-v1.10.1RC-latest-2454-g9086b215, Source Identifier: Stable Diffusion web UI"
        }
    ]
}