{
    "files": [
        {
            "type": "file",
            "id": 1025,
            "date": "2025-09-10 12:27:42",
            "created_date": "2025-09-10 12:27:42",
            "size": "2.73 MB",
            "is_under_scanned_path": true,
            "bytes": 2862829,
            "name": "00023-3031394851.png",
            "fullpath": "/Users/pixelkaos/Library/Application Support/StabilityMatrix/Packages/Stable Diffusion WebUI reForge/outputs/txt2img-images/2025-09-10/00023-3031394851.png",
            "gen_info_obj": {
                "steps": 40,
                "sampler": "DPM++ 2M",
                "Schedule type": "Karras",
                "cfgScale": 7,
                "seed": 3031394851,
                "size": "832x832",
                "Model hash": "6330883d2c",
                "Model": "artium_v20",
                "Denoising strength": 0.3,
                "RNG": "CPU",
                "Hires prompt": "A vibrant cyberpunk illustration, comic-book/anime hybrid, bold colors, high-contrast neon lighting.nA ((grizzly bear)) Mothership RPG Marine character, defined line art, 22 years old.nnThe character is skilled in Military Training, Firearms, and Command.nThese skills are represented visually through specific details:n- Military Training → unit patches and insignian- Firearms → visible rifle sling and ammo clipsn- Command → confident posture with subtle headset devicenn(Holding Old Dog Tags:1.8), (Distinctive Feature: cybernetic eye:1.6).nThese must be clearly visible and easily identifiable.nnThe background is neon-lit maintenance hangar, detailed yet subtle, adding depth without distracting from the character,nnBust shot, centered composition, clean silhouette, no extra text or logos, ZIP2D,  CXL-Mech",
                "Hires CFG Scale": 7,
                "Hires upscale": 2,
                "Hires steps": 15,
                "Hires upscaler": "ESRGAN_4x",
                "TI hashes": "ZIP2D: 353cf9be0675, CXL-Mech: 000b204acc87, ZIP2D: 353cf9be0675, CXL-Mech: 000b204acc87, CXL-Mech: 000b204acc87, CXL-Mech: 000b204acc87, CXL-Mech: 000b204acc87, CXL-Mech: 000b204acc87, CXL-Mech: 000b204acc87, CXL-Mech: 000b204acc87, CXL-Mech: 000b204acc87, CXL-Mech: 000b204acc87, CXL-Mech: 000b204acc87, CXL-Mech: 000b204acc87, CXL-Mech: 000b204acc87, CXL-Mech: 000b204acc87, CXL-Mech: 000b204acc87, CXL-Mech: 000b204acc87, zip2d_neg: a764ec702efd, zip2d_neg: a764ec702efd, CXL-Mech: 000b204acc87, CXL-Mech: 000b204acc87, zip2d_neg: a764ec702efd, zip2d_neg: a764ec702efd",
                "Pad conds": "True",
                "Version": "f1.0.0v2-v1.10.1RC-latest-2454-g9086b215",
                "Source Identifier": "Stable Diffusion web UI",
                "ControlNet 0": "Module: CLIP-ViT-H (IPAdapter), Model: ip-adapter-plus_sdxl_vit-h [bc449f62], Weight: 0.35, Resize Mode: ResizeMode.INNER_FIT, Processor Res: 0.5, Threshold A: 0.5, Threshold B: 0.5, Guidance Start: 0.3, Guidance End: 0.7, Pixel Perfect: False, Control Mode: ControlMode.BALANCED, Hr Option: HiResFixOption.BOTH",
                "ControlNet 1": "Module: CLIP-ViT-H (IPAdapter), Model: ip-adapter-plus-face_sdxl_vit-h [368cf551], Weight: 1, Resize Mode: ResizeMode.INNER_FIT, Processor Res: 0.5, Threshold A: 0.5, Threshold B: 0.5, Guidance Start: 0.1, Guidance End: 0.9, Pixel Perfect: False, Control Mode: ControlMode.BALANCED, Hr Option: HiResFixOption.BOTH",
                "prompt": "A vibrant cyberpunk illustration, comic-book/anime hybrid, bold colors, high-contrast neon lighting.\nA ((grizzly bear)) Mothership RPG Marine character, defined line art, 36 years old.\nThe character is skilled in Military Training, Firearms, and Command.\nThese skills are represented visually through specific details:\n- Military Training → unit patches and insignia\n- Firearms → visible rifle sling and ammo clips\n- Command → confident posture with subtle headset device\n(Holding Old Dog Tags:1.8), (Distinctive Feature: cybernetic eye:1.6).\nThese must be clearly visible and easily identifiable.\nThe background is sci-fi corridor with glowing panels, detailed yet subtle, adding depth without distracting from the character,\nBust shot, centered composition, clean silhouette, no extra text or logos, ZIP2D,  CXL-Mech",
                "negativePrompt": "Compression artifacts, bad art, worst quality, low quality, plastic, fake, bad limbs, conjoined, featureless, bad features, incorrect objects, watermark, ((signature):1.25), logo, zip2d_neg",
                "width": 832,
                "height": 832,
                "hashes": {
                    "model": "6330883d2c"
                },
                "resources": [
                    {
                        "type": "model",
                        "name": "artium_v20",
                        "hash": "6330883d2c"
                    }
                ]
            },
            "gen_info_raw": "A vibrant cyberpunk illustration, comic-book/anime hybrid, bold colors, high-contrast neon lighting.\nA ((grizzly bear)) Mothership RPG Marine character, defined line art, 36 years old.\n\nThe character is skilled in Military Training, Firearms, and Command.\nThese skills are represented visually through specific details:\n- Military Training → unit patches and insignia\n- Firearms → visible rifle sling and ammo clips\n- Command → confident posture with subtle headset device\n\n(Holding Old Dog Tags:1.8), (Distinctive Feature: cybernetic eye:1.6).\nThese must be clearly visible and easily identifiable.\n\nThe background is sci-fi corridor with glowing panels, detailed yet subtle, adding depth without distracting from the character,\n\nBust shot, centered composition, clean silhouette, no extra text or logos, ZIP2D,  CXL-Mech\nNegative prompt: Compression artifacts, bad art, worst quality, low quality, plastic, fake, bad limbs, conjoined, featureless, bad features, incorrect objects, watermark, ((signature):1.25), logo, zip2d_neg\nSteps: 40, Sampler: DPM++ 2M, Schedule type: Karras, CFG scale: 7, Seed: 3031394851, Size: 832x832, Model hash: 6330883d2c, Model: artium_v20, Denoising strength: 0.3, RNG: CPU, ControlNet 0: \"Module: CLIP-ViT-H (IPAdapter), Model: ip-adapter-plus_sdxl_vit-h [bc449f62], Weight: 0.35, Resize Mode: ResizeMode.INNER_FIT, Processor Res: 0.5, Threshold A: 0.5, Threshold B: 0.5, Guidance Start: 0.3, Guidance End: 0.7, Pixel Perfect: False, Control Mode: ControlMode.BALANCED, Hr Option: HiResFixOption.BOTH\", ControlNet 1: \"Module: CLIP-ViT-H (IPAdapter), Model: ip-adapter-plus-face_sdxl_vit-h [368cf551], Weight: 1, Resize Mode: ResizeMode.INNER_FIT, Processor Res: 0.5, Threshold A: 0.5, Threshold B: 0.5, Guidance Start: 0.1, Guidance End: 0.9, Pixel Perfect: False, Control Mode: ControlMode.BALANCED, Hr Option: HiResFixOption.BOTH\", Hires prompt: \"A vibrant cyberpunk illustration, comic-book/anime hybrid, bold colors, high-contrast neon lighting.\\nA ((grizzly bear)) Mothership RPG Marine character, defined line art, 22 years old.\\n\\nThe character is skilled in Military Training, Firearms, and Command.\\nThese skills are represented visually through specific details:\\n- Military Training → unit patches and insignia\\n- Firearms → visible rifle sling and ammo clips\\n- Command → confident posture with subtle headset device\\n\\n(Holding Old Dog Tags:1.8), (Distinctive Feature: cybernetic eye:1.6).\\nThese must be clearly visible and easily identifiable.\\n\\nThe background is neon-lit maintenance hangar, detailed yet subtle, adding depth without distracting from the character,\\n\\nBust shot, centered composition, clean silhouette, no extra text or logos, ZIP2D,  CXL-Mech\", Hires CFG Scale: 7, Hires upscale: 2, Hires steps: 15, Hires upscaler: ESRGAN_4x, TI hashes: \"ZIP2D: 353cf9be0675, CXL-Mech: 000b204acc87, ZIP2D: 353cf9be0675, CXL-Mech: 000b204acc87, CXL-Mech: 000b204acc87, CXL-Mech: 000b204acc87, CXL-Mech: 000b204acc87, CXL-Mech: 000b204acc87, CXL-Mech: 000b204acc87, CXL-Mech: 000b204acc87, CXL-Mech: 000b204acc87, CXL-Mech: 000b204acc87, CXL-Mech: 000b204acc87, CXL-Mech: 000b204acc87, CXL-Mech: 000b204acc87, CXL-Mech: 000b204acc87, CXL-Mech: 000b204acc87, CXL-Mech: 000b204acc87, zip2d_neg: a764ec702efd, zip2d_neg: a764ec702efd, CXL-Mech: 000b204acc87, CXL-Mech: 000b204acc87, zip2d_neg: a764ec702efd, zip2d_neg: a764ec702efd\", Pad conds: True, Version: f1.0.0v2-v1.10.1RC-latest-2454-g9086b215, Source Identifier: Stable Diffusion web UI"
        },
        {
            "type": "file",
            "id": 1026,
            "date": "2025-09-10 12:19:26",
            "created_date": "2025-09-10 12:19:26",
            "size": "2.95 MB",
            "is_under_scanned_path": true,
            "bytes": 3093932,
            "name": "00022-3031394850.png",
            "fullpath": "/Users/pixelkaos/Library/Application Support/StabilityMatrix/Packages/Stable Diffusion WebUI reForge/outputs/txt2img-images/2025-09-10/00022-3031394850.png",
            "gen_info_obj": {
                "steps": 40,
                "sampler": "DPM++ 2M",
                "Schedule type": "Karras",
                "cfgScale": 7,
                "seed": 3031394850,
                "size": "832x832",
                "Model hash": "6330883d2c",
                "Model": "artium_v20",
                "Denoising strength": 0.3,
                "RNG": "CPU",
                "Hires CFG Scale": 7,
                "Hires upscale": 2,
                "Hires steps": 15,
                "Hires upscaler": "ESRGAN_4x",
                "TI hashes": "ZIP2D: 353cf9be0675, CXL-Mech: 000b204acc87, ZIP2D: 353cf9be0675, CXL-Mech: 000b204acc87, CXL-Mech: 000b204acc87, CXL-Mech: 000b204acc87, CXL-Mech: 000b204acc87, CXL-Mech: 000b204acc87, CXL-Mech: 000b204acc87, CXL-Mech: 000b204acc87, CXL-Mech: 000b204acc87, CXL-Mech: 000b204acc87, CXL-Mech: 000b204acc87, CXL-Mech: 000b204acc87, CXL-Mech: 000b204acc87, CXL-Mech: 000b204acc87, CXL-Mech: 000b204acc87, CXL-Mech: 000b204acc87, zip2d_neg: a764ec702efd, zip2d_neg: a764ec702efd, CXL-Mech: 000b204acc87, CXL-Mech: 000b204acc87, zip2d_neg: a764ec702efd, zip2d_neg: a764ec702efd",
                "Pad conds": "True",
                "Version": "f1.0.0v2-v1.10.1RC-latest-2454-g9086b215",
                "Source Identifier": "Stable Diffusion web UI",
                "ControlNet 0": "Module: CLIP-ViT-H (IPAdapter), Model: ip-adapter-plus_sdxl_vit-h [bc449f62], Weight: 0.35, Resize Mode: ResizeMode.INNER_FIT, Processor Res: 0.5, Threshold A: 0.5, Threshold B: 0.5, Guidance Start: 0.3, Guidance End: 0.7, Pixel Perfect: False, Control Mode: ControlMode.BALANCED, Hr Option: HiResFixOption.BOTH",
                "ControlNet 1": "Module: CLIP-ViT-H (IPAdapter), Model: ip-adapter-plus-face_sdxl_vit-h [368cf551], Weight: 1, Resize Mode: ResizeMode.INNER_FIT, Processor Res: 0.5, Threshold A: 0.5, Threshold B: 0.5, Guidance Start: 0.1, Guidance End: 0.9, Pixel Perfect: False, Control Mode: ControlMode.BALANCED, Hr Option: HiResFixOption.BOTH",
                "prompt": "A vibrant cyberpunk illustration, comic-book/anime hybrid, bold colors, high-contrast neon lighting.\nA ((grizzly bear)) Mothership RPG Marine character, defined line art, 22 years old.\nThe character is skilled in Military Training, Firearms, and Command.\nThese skills are represented visually through specific details:\n- Military Training → unit patches and insignia\n- Firearms → visible rifle sling and ammo clips\n- Command → confident posture with subtle headset device\n(Holding Old Dog Tags:1.8), (Distinctive Feature: cybernetic eye:1.6).\nThese must be clearly visible and easily identifiable.\nThe background is neon-lit maintenance hangar, detailed yet subtle, adding depth without distracting from the character,\nBust shot, centered composition, clean silhouette, no extra text or logos, ZIP2D,  CXL-Mech",
                "negativePrompt": "Compression artifacts, bad art, worst quality, low quality, plastic, fake, bad limbs, conjoined, featureless, bad features, incorrect objects, watermark, ((signature):1.25), logo, zip2d_neg",
                "width": 832,
                "height": 832,
                "hashes": {
                    "model": "6330883d2c"
                },
                "resources": [
                    {
                        "type": "model",
                        "name": "artium_v20",
                        "hash": "6330883d2c"
                    }
                ]
            },
            "gen_info_raw": "A vibrant cyberpunk illustration, comic-book/anime hybrid, bold colors, high-contrast neon lighting.\nA ((grizzly bear)) Mothership RPG Marine character, defined line art, 22 years old.\n\nThe character is skilled in Military Training, Firearms, and Command.\nThese skills are represented visually through specific details:\n- Military Training → unit patches and insignia\n- Firearms → visible rifle sling and ammo clips\n- Command → confident posture with subtle headset device\n\n(Holding Old Dog Tags:1.8), (Distinctive Feature: cybernetic eye:1.6).\nThese must be clearly visible and easily identifiable.\n\nThe background is neon-lit maintenance hangar, detailed yet subtle, adding depth without distracting from the character,\n\nBust shot, centered composition, clean silhouette, no extra text or logos, ZIP2D,  CXL-Mech\nNegative prompt: Compression artifacts, bad art, worst quality, low quality, plastic, fake, bad limbs, conjoined, featureless, bad features, incorrect objects, watermark, ((signature):1.25), logo, zip2d_neg\nSteps: 40, Sampler: DPM++ 2M, Schedule type: Karras, CFG scale: 7, Seed: 3031394850, Size: 832x832, Model hash: 6330883d2c, Model: artium_v20, Denoising strength: 0.3, RNG: CPU, ControlNet 0: \"Module: CLIP-ViT-H (IPAdapter), Model: ip-adapter-plus_sdxl_vit-h [bc449f62], Weight: 0.35, Resize Mode: ResizeMode.INNER_FIT, Processor Res: 0.5, Threshold A: 0.5, Threshold B: 0.5, Guidance Start: 0.3, Guidance End: 0.7, Pixel Perfect: False, Control Mode: ControlMode.BALANCED, Hr Option: HiResFixOption.BOTH\", ControlNet 1: \"Module: CLIP-ViT-H (IPAdapter), Model: ip-adapter-plus-face_sdxl_vit-h [368cf551], Weight: 1, Resize Mode: ResizeMode.INNER_FIT, Processor Res: 0.5, Threshold A: 0.5, Threshold B: 0.5, Guidance Start: 0.1, Guidance End: 0.9, Pixel Perfect: False, Control Mode: ControlMode.BALANCED, Hr Option: HiResFixOption.BOTH\", Hires CFG Scale: 7, Hires upscale: 2, Hires steps: 15, Hires upscaler: ESRGAN_4x, TI hashes: \"ZIP2D: 353cf9be0675, CXL-Mech: 000b204acc87, ZIP2D: 353cf9be0675, CXL-Mech: 000b204acc87, CXL-Mech: 000b204acc87, CXL-Mech: 000b204acc87, CXL-Mech: 000b204acc87, CXL-Mech: 000b204acc87, CXL-Mech: 000b204acc87, CXL-Mech: 000b204acc87, CXL-Mech: 000b204acc87, CXL-Mech: 000b204acc87, CXL-Mech: 000b204acc87, CXL-Mech: 000b204acc87, CXL-Mech: 000b204acc87, CXL-Mech: 000b204acc87, CXL-Mech: 000b204acc87, CXL-Mech: 000b204acc87, zip2d_neg: a764ec702efd, zip2d_neg: a764ec702efd, CXL-Mech: 000b204acc87, CXL-Mech: 000b204acc87, zip2d_neg: a764ec702efd, zip2d_neg: a764ec702efd\", Pad conds: True, Version: f1.0.0v2-v1.10.1RC-latest-2454-g9086b215, Source Identifier: Stable Diffusion web UI"
        },
        {
            "type": "file",
            "id": 1027,
            "date": "2025-09-10 12:05:50",
            "created_date": "2025-09-10 12:05:50",
            "size": "2.65 MB",
            "is_under_scanned_path": true,
            "bytes": 2774103,
            "name": "00021-1107142260.png",
            "fullpath": "/Users/pixelkaos/Library/Application Support/StabilityMatrix/Packages/Stable Diffusion WebUI reForge/outputs/txt2img-images/2025-09-10/00021-1107142260.png",
            "gen_info_obj": {
                "steps": 40,
                "sampler": "DPM++ 2M",
                "Schedule type": "Karras",
                "cfgScale": 7,
                "seed": 1107142260,
                "size": "832x832",
                "Model hash": "6330883d2c",
                "Model": "artium_v20",
                "Denoising strength": 0.3,
                "RNG": "CPU",
                "Hires prompt": "A vibrant cyberpunk illustration, comic-book/anime hybrid, bold colors, high-contrast neon lighting.nA ((none human)) Mothership RPG Marine character, defined line art, 36 years old.nnThe character is skilled in Military Training, Firearms, and Command.nThese skills are represented visually through specific details:n- Military Training → unit patches and insignian- Firearms → visible rifle sling and ammo clipsn- Command → confident posture with subtle headset devicenn(Holding Old Dog Tags:1.8), (Distinctive Feature: cybernetic eye:1.6).nThese must be clearly visible and easily identifiable.nnThe background is futuristic laboratory filled with strange equipment, detailed yet subtle, adding depth without distracting from the character,nnBust shot, centered composition, clean silhouette, no extra text or logos, ZIP2D,  CXL-Mech",
                "Hires CFG Scale": 7,
                "Hires upscale": 2,
                "Hires steps": 15,
                "Hires upscaler": "ESRGAN_4x",
                "TI hashes": "ZIP2D: 353cf9be0675, CXL-Mech: 000b204acc87, ZIP2D: 353cf9be0675, CXL-Mech: 000b204acc87, CXL-Mech: 000b204acc87, CXL-Mech: 000b204acc87, CXL-Mech: 000b204acc87, CXL-Mech: 000b204acc87, CXL-Mech: 000b204acc87, CXL-Mech: 000b204acc87, CXL-Mech: 000b204acc87, CXL-Mech: 000b204acc87, CXL-Mech: 000b204acc87, CXL-Mech: 000b204acc87, CXL-Mech: 000b204acc87, CXL-Mech: 000b204acc87, CXL-Mech: 000b204acc87, CXL-Mech: 000b204acc87, zip2d_neg: a764ec702efd, zip2d_neg: a764ec702efd, CXL-Mech: 000b204acc87, CXL-Mech: 000b204acc87, zip2d_neg: a764ec702efd, zip2d_neg: a764ec702efd",
                "Pad conds": "True",
                "Version": "f1.0.0v2-v1.10.1RC-latest-2454-g9086b215",
                "Source Identifier": "Stable Diffusion web UI",
                "ControlNet 0": "Module: CLIP-ViT-H (IPAdapter), Model: ip-adapter-plus_sdxl_vit-h [bc449f62], Weight: 0.35, Resize Mode: ResizeMode.INNER_FIT, Processor Res: 0.5, Threshold A: 0.5, Threshold B: 0.5, Guidance Start: 0.3, Guidance End: 0.7, Pixel Perfect: False, Control Mode: ControlMode.BALANCED, Hr Option: HiResFixOption.BOTH",
                "ControlNet 1": "Module: CLIP-ViT-H (IPAdapter), Model: ip-adapter-plus-face_sdxl_vit-h [368cf551], Weight: 1, Resize Mode: ResizeMode.INNER_FIT, Processor Res: 0.5, Threshold A: 0.5, Threshold B: 0.5, Guidance Start: 0.1, Guidance End: 0.9, Pixel Perfect: False, Control Mode: ControlMode.BALANCED, Hr Option: HiResFixOption.BOTH",
                "prompt": "A vibrant cyberpunk illustration, comic-book/anime hybrid, bold colors, high-contrast neon lighting.\nA ((none human)) Mothership RPG Marine character, defined line art, 36 years old.\nThe character is skilled in Military Training, Firearms, and Command.\nThese skills are represented visually through specific details:\n- Military Training → unit patches and insignia\n- Firearms → visible rifle sling and ammo clips\n- Command → confident posture with subtle headset device\n(Holding Old Dog Tags:1.8), (Distinctive Feature: cybernetic eye:1.6).\nThese must be clearly visible and easily identifiable.\nThe background is industrial ship bay with mist, detailed yet subtle, adding depth without distracting from the character,\nBust shot, centered composition, clean silhouette, no extra text or logos, ZIP2D,  CXL-Mech",
                "negativePrompt": "Compression artifacts, bad art, worst quality, low quality, plastic, fake, bad limbs, conjoined, featureless, bad features, incorrect objects, watermark, ((signature):1.25), logo, zip2d_neg",
                "width": 832,
                "height": 832,
                "hashes": {
                    "model": "6330883d2c"
                },
                "resources": [
                    {
                        "type": "model",
                        "name": "artium_v20",
                        "hash": "6330883d2c"
                    }
                ]
            },
            "gen_info_raw": "A vibrant cyberpunk illustration, comic-book/anime hybrid, bold colors, high-contrast neon lighting.\nA ((none human)) Mothership RPG Marine character, defined line art, 36 years old.\n\nThe character is skilled in Military Training, Firearms, and Command.\nThese skills are represented visually through specific details:\n- Military Training → unit patches and insignia\n- Firearms → visible rifle sling and ammo clips\n- Command → confident posture with subtle headset device\n\n(Holding Old Dog Tags:1.8), (Distinctive Feature: cybernetic eye:1.6).\nThese must be clearly visible and easily identifiable.\n\nThe background is industrial ship bay with mist, detailed yet subtle, adding depth without distracting from the character,\n\nBust shot, centered composition, clean silhouette, no extra text or logos, ZIP2D,  CXL-Mech\nNegative prompt: Compression artifacts, bad art, worst quality, low quality, plastic, fake, bad limbs, conjoined, featureless, bad features, incorrect objects, watermark, ((signature):1.25), logo, zip2d_neg\nSteps: 40, Sampler: DPM++ 2M, Schedule type: Karras, CFG scale: 7, Seed: 1107142260, Size: 832x832, Model hash: 6330883d2c, Model: artium_v20, Denoising strength: 0.3, RNG: CPU, ControlNet 0: \"Module: CLIP-ViT-H (IPAdapter), Model: ip-adapter-plus_sdxl_vit-h [bc449f62], Weight: 0.35, Resize Mode: ResizeMode.INNER_FIT, Processor Res: 0.5, Threshold A: 0.5, Threshold B: 0.5, Guidance Start: 0.3, Guidance End: 0.7, Pixel Perfect: False, Control Mode: ControlMode.BALANCED, Hr Option: HiResFixOption.BOTH\", ControlNet 1: \"Module: CLIP-ViT-H (IPAdapter), Model: ip-adapter-plus-face_sdxl_vit-h [368cf551], Weight: 1, Resize Mode: ResizeMode.INNER_FIT, Processor Res: 0.5, Threshold A: 0.5, Threshold B: 0.5, Guidance Start: 0.1, Guidance End: 0.9, Pixel Perfect: False, Control Mode: ControlMode.BALANCED, Hr Option: HiResFixOption.BOTH\", Hires prompt: \"A vibrant cyberpunk illustration, comic-book/anime hybrid, bold colors, high-contrast neon lighting.\\nA ((none human)) Mothership RPG Marine character, defined line art, 36 years old.\\n\\nThe character is skilled in Military Training, Firearms, and Command.\\nThese skills are represented visually through specific details:\\n- Military Training → unit patches and insignia\\n- Firearms → visible rifle sling and ammo clips\\n- Command → confident posture with subtle headset device\\n\\n(Holding Old Dog Tags:1.8), (Distinctive Feature: cybernetic eye:1.6).\\nThese must be clearly visible and easily identifiable.\\n\\nThe background is futuristic laboratory filled with strange equipment, detailed yet subtle, adding depth without distracting from the character,\\n\\nBust shot, centered composition, clean silhouette, no extra text or logos, ZIP2D,  CXL-Mech\", Hires CFG Scale: 7, Hires upscale: 2, Hires steps: 15, Hires upscaler: ESRGAN_4x, TI hashes: \"ZIP2D: 353cf9be0675, CXL-Mech: 000b204acc87, ZIP2D: 353cf9be0675, CXL-Mech: 000b204acc87, CXL-Mech: 000b204acc87, CXL-Mech: 000b204acc87, CXL-Mech: 000b204acc87, CXL-Mech: 000b204acc87, CXL-Mech: 000b204acc87, CXL-Mech: 000b204acc87, CXL-Mech: 000b204acc87, CXL-Mech: 000b204acc87, CXL-Mech: 000b204acc87, CXL-Mech: 000b204acc87, CXL-Mech: 000b204acc87, CXL-Mech: 000b204acc87, CXL-Mech: 000b204acc87, CXL-Mech: 000b204acc87, zip2d_neg: a764ec702efd, zip2d_neg: a764ec702efd, CXL-Mech: 000b204acc87, CXL-Mech: 000b204acc87, zip2d_neg: a764ec702efd, zip2d_neg: a764ec702efd\", Pad conds: True, Version: f1.0.0v2-v1.10.1RC-latest-2454-g9086b215, Source Identifier: Stable Diffusion web UI"
        },
        {
            "type": "file",
            "id": 1028,
            "date": "2025-09-10 11:57:40",
            "created_date": "2025-09-10 11:57:40",
            "size": "2.83 MB",
            "is_under_scanned_path": true,
            "bytes": 2963952,
            "name": "00020-1107142259.png",
            "fullpath": "/Users/pixelkaos/Library/Application Support/StabilityMatrix/Packages/Stable Diffusion WebUI reForge/outputs/txt2img-images/2025-09-10/00020-1107142259.png",
            "gen_info_obj": {
                "steps": 40,
                "sampler": "DPM++ 2M",
                "Schedule type": "Karras",
                "cfgScale": 7,
                "seed": 1107142259,
                "size": "832x832",
                "Model hash": "6330883d2c",
                "Model": "artium_v20",
                "Denoising strength": 0.3,
                "RNG": "CPU",
                "Hires CFG Scale": 7,
                "Hires upscale": 2,
                "Hires steps": 15,
                "Hires upscaler": "ESRGAN_4x",
                "TI hashes": "ZIP2D: 353cf9be0675, CXL-Mech: 000b204acc87, ZIP2D: 353cf9be0675, CXL-Mech: 000b204acc87, CXL-Mech: 000b204acc87, CXL-Mech: 000b204acc87, CXL-Mech: 000b204acc87, CXL-Mech: 000b204acc87, CXL-Mech: 000b204acc87, CXL-Mech: 000b204acc87, CXL-Mech: 000b204acc87, CXL-Mech: 000b204acc87, CXL-Mech: 000b204acc87, CXL-Mech: 000b204acc87, CXL-Mech: 000b204acc87, CXL-Mech: 000b204acc87, CXL-Mech: 000b204acc87, CXL-Mech: 000b204acc87, zip2d_neg: a764ec702efd, zip2d_neg: a764ec702efd, CXL-Mech: 000b204acc87, CXL-Mech: 000b204acc87, zip2d_neg: a764ec702efd, zip2d_neg: a764ec702efd",
                "Pad conds": "True",
                "Version": "f1.0.0v2-v1.10.1RC-latest-2454-g9086b215",
                "Source Identifier": "Stable Diffusion web UI",
                "ControlNet 0": "Module: CLIP-ViT-H (IPAdapter), Model: ip-adapter-plus_sdxl_vit-h [bc449f62], Weight: 0.35, Resize Mode: ResizeMode.INNER_FIT, Processor Res: 0.5, Threshold A: 0.5, Threshold B: 0.5, Guidance Start: 0.3, Guidance End: 0.7, Pixel Perfect: False, Control Mode: ControlMode.BALANCED, Hr Option: HiResFixOption.BOTH",
                "ControlNet 1": "Module: CLIP-ViT-H (IPAdapter), Model: ip-adapter-plus-face_sdxl_vit-h [368cf551], Weight: 1, Resize Mode: ResizeMode.INNER_FIT, Processor Res: 0.5, Threshold A: 0.5, Threshold B: 0.5, Guidance Start: 0.1, Guidance End: 0.9, Pixel Perfect: False, Control Mode: ControlMode.BALANCED, Hr Option: HiResFixOption.BOTH",
                "prompt": "A vibrant cyberpunk illustration, comic-book/anime hybrid, bold colors, high-contrast neon lighting.\nA ((none human)) Mothership RPG Marine character, defined line art, 36 years old.\nThe character is skilled in Military Training, Firearms, and Command.\nThese skills are represented visually through specific details:\n- Military Training → unit patches and insignia\n- Firearms → visible rifle sling and ammo clips\n- Command → confident posture with subtle headset device\n(Holding Old Dog Tags:1.8), (Distinctive Feature: cybernetic eye:1.6).\nThese must be clearly visible and easily identifiable.\nThe background is futuristic laboratory filled with strange equipment, detailed yet subtle, adding depth without distracting from the character,\nBust shot, centered composition, clean silhouette, no extra text or logos, ZIP2D,  CXL-Mech",
                "negativePrompt": "Compression artifacts, bad art, worst quality, low quality, plastic, fake, bad limbs, conjoined, featureless, bad features, incorrect objects, watermark, ((signature):1.25), logo, zip2d_neg",
                "width": 832,
                "height": 832,
                "hashes": {
                    "model": "6330883d2c"
                },
                "resources": [
                    {
                        "type": "model",
                        "name": "artium_v20",
                        "hash": "6330883d2c"
                    }
                ]
            },
            "gen_info_raw": "A vibrant cyberpunk illustration, comic-book/anime hybrid, bold colors, high-contrast neon lighting.\nA ((none human)) Mothership RPG Marine character, defined line art, 36 years old.\n\nThe character is skilled in Military Training, Firearms, and Command.\nThese skills are represented visually through specific details:\n- Military Training → unit patches and insignia\n- Firearms → visible rifle sling and ammo clips\n- Command → confident posture with subtle headset device\n\n(Holding Old Dog Tags:1.8), (Distinctive Feature: cybernetic eye:1.6).\nThese must be clearly visible and easily identifiable.\n\nThe background is futuristic laboratory filled with strange equipment, detailed yet subtle, adding depth without distracting from the character,\n\nBust shot, centered composition, clean silhouette, no extra text or logos, ZIP2D,  CXL-Mech\nNegative prompt: Compression artifacts, bad art, worst quality, low quality, plastic, fake, bad limbs, conjoined, featureless, bad features, incorrect objects, watermark, ((signature):1.25), logo, zip2d_neg\nSteps: 40, Sampler: DPM++ 2M, Schedule type: Karras, CFG scale: 7, Seed: 1107142259, Size: 832x832, Model hash: 6330883d2c, Model: artium_v20, Denoising strength: 0.3, RNG: CPU, ControlNet 0: \"Module: CLIP-ViT-H (IPAdapter), Model: ip-adapter-plus_sdxl_vit-h [bc449f62], Weight: 0.35, Resize Mode: ResizeMode.INNER_FIT, Processor Res: 0.5, Threshold A: 0.5, Threshold B: 0.5, Guidance Start: 0.3, Guidance End: 0.7, Pixel Perfect: False, Control Mode: ControlMode.BALANCED, Hr Option: HiResFixOption.BOTH\", ControlNet 1: \"Module: CLIP-ViT-H (IPAdapter), Model: ip-adapter-plus-face_sdxl_vit-h [368cf551], Weight: 1, Resize Mode: ResizeMode.INNER_FIT, Processor Res: 0.5, Threshold A: 0.5, Threshold B: 0.5, Guidance Start: 0.1, Guidance End: 0.9, Pixel Perfect: False, Control Mode: ControlMode.BALANCED, Hr Option: HiResFixOption.BOTH\", Hires CFG Scale: 7, Hires upscale: 2, Hires steps: 15, Hires upscaler: ESRGAN_4x, TI hashes: \"ZIP2D: 353cf9be0675, CXL-Mech: 000b204acc87, ZIP2D: 353cf9be0675, CXL-Mech: 000b204acc87, CXL-Mech: 000b204acc87, CXL-Mech: 000b204acc87, CXL-Mech: 000b204acc87, CXL-Mech: 000b204acc87, CXL-Mech: 000b204acc87, CXL-Mech: 000b204acc87, CXL-Mech: 000b204acc87, CXL-Mech: 000b204acc87, CXL-Mech: 000b204acc87, CXL-Mech: 000b204acc87, CXL-Mech: 000b204acc87, CXL-Mech: 000b204acc87, CXL-Mech: 000b204acc87, CXL-Mech: 000b204acc87, zip2d_neg: a764ec702efd, zip2d_neg: a764ec702efd, CXL-Mech: 000b204acc87, CXL-Mech: 000b204acc87, zip2d_neg: a764ec702efd, zip2d_neg: a764ec702efd\", Pad conds: True, Version: f1.0.0v2-v1.10.1RC-latest-2454-g9086b215, Source Identifier: Stable Diffusion web UI"
        },
        {
            "type": "file",
            "id": 179,
            "date": "2025-09-09 17:41:04",
            "created_date": "2025-09-09 17:41:04",
            "size": "2.49 MB",
            "is_under_scanned_path": true,
            "bytes": 2612337,
            "name": "00108-465309964.png",
            "fullpath": "/Users/pixelkaos/Library/Application Support/StabilityMatrix/Packages/Stable Diffusion WebUI reForge/outputs/txt2img-images/2025-09-09/00108-465309964.png",
            "gen_info_obj": {
                "steps": 40,
                "sampler": "DPM++ 2M",
                "Schedule type": "Karras",
                "cfgScale": 7,
                "seed": 465309964,
                "size": "832x832",
                "Model hash": "6330883d2c",
                "Model": "artium_v20",
                "Denoising strength": 0.3,
                "RNG": "CPU",
                "Hires prompt": "A vibrant cyberpunk illustration, comic-book/anime hybrid, bold colors, defined line art, high-contrast neon lighting.nA male Mothership RPG Marine character, (age 42 years old:2.0).nnThe character is skilled in Military Training, Firearms, and Command.nThese skills are represented visually through specific details:n- Military Training → unit patches and insignian- Firearms → visible rifle sling and ammo clipsn- Command → confident posture with subtle headset devicenn(Holding Old Dog Tags:1.8), (Distinctive Feature: cybernetic eye:1.6).nThese must be clearly visible and easily identifiable.nnThe background is BACKGROUND, detailed yet subtle, adding depth without distracting from the character.nnBust shot, centered composition, clean silhouette, no extra text or logos,  CXL-Mech",
                "Hires CFG Scale": 7,
                "Hires upscale": 2,
                "Hires steps": 15,
                "Hires upscaler": "ESRGAN_4x",
                "TI hashes": "CXL-Mech: 000b204acc87, CXL-Mech: 000b204acc87, CXL-Mech: 000b204acc87, CXL-Mech: 000b204acc87, CXL-Mech: 000b204acc87, CXL-Mech: 000b204acc87, CXL-Mech: 000b204acc87, CXL-Mech: 000b204acc87, CXL-Mech: 000b204acc87, CXL-Mech: 000b204acc87, CXL-Mech: 000b204acc87, CXL-Mech: 000b204acc87, CXL-Mech: 000b204acc87, CXL-Mech: 000b204acc87, zip2d_neg: a764ec702efd, zip2d_neg: a764ec702efd, CXL-Mech: 000b204acc87, CXL-Mech: 000b204acc87, zip2d_neg: a764ec702efd, zip2d_neg: a764ec702efd",
                "Pad conds": "True",
                "Version": "f1.0.0v2-v1.10.1RC-latest-2454-g9086b215",
                "Source Identifier": "Stable Diffusion web UI",
                "ControlNet 0": "Module: CLIP-ViT-H (IPAdapter), Model: ip-adapter-plus_sdxl_vit-h [bc449f62], Weight: 0.35, Resize Mode: ResizeMode.INNER_FIT, Processor Res: 0.5, Threshold A: 0.5, Threshold B: 0.5, Guidance Start: 0.3, Guidance End: 0.7, Pixel Perfect: False, Control Mode: ControlMode.BALANCED, Hr Option: HiResFixOption.BOTH",
                "ControlNet 1": "Module: CLIP-ViT-H (IPAdapter), Model: ip-adapter-plus-face_sdxl_vit-h [368cf551], Weight: 1, Resize Mode: ResizeMode.INNER_FIT, Processor Res: 0.5, Threshold A: 0.5, Threshold B: 0.5, Guidance Start: 0.1, Guidance End: 0.9, Pixel Perfect: False, Control Mode: ControlMode.BALANCED, Hr Option: HiResFixOption.BOTH",
                "prompt": "A vibrant cyberpunk illustration, comic-book/anime hybrid, bold colors, defined line art, high-contrast neon lighting.\nA male Mothership RPG Marine character, (age 29 years old:2.0).\nThe character is skilled in Military Training, Firearms, and Command.\nThese skills are represented visually through specific details:\n- Military Training → unit patches and insignia\n- Firearms → visible rifle sling and ammo clips\n- Command → confident posture with subtle headset device\n(Holding Old Dog Tags:1.8), (Distinctive Feature: cybernetic eye:1.6).\nThese must be clearly visible and easily identifiable.\nThe background is BACKGROUND, detailed yet subtle, adding depth without distracting from the character.\nBust shot, centered composition, clean silhouette, no extra text or logos,  CXL-Mech",
                "negativePrompt": "Compression artifacts, bad art, worst quality, low quality, plastic, fake, bad limbs, conjoined, featureless, bad features, incorrect objects, watermark, ((signature):1.25), logo, zip2d_neg",
                "width": 832,
                "height": 832,
                "hashes": {
                    "model": "6330883d2c"
                },
                "resources": [
                    {
                        "type": "model",
                        "name": "artium_v20",
                        "hash": "6330883d2c"
                    }
                ]
            },
            "gen_info_raw": "A vibrant cyberpunk illustration, comic-book/anime hybrid, bold colors, defined line art, high-contrast neon lighting.\nA male Mothership RPG Marine character, (age 29 years old:2.0).\n\nThe character is skilled in Military Training, Firearms, and Command.\nThese skills are represented visually through specific details:\n- Military Training → unit patches and insignia\n- Firearms → visible rifle sling and ammo clips\n- Command → confident posture with subtle headset device\n\n(Holding Old Dog Tags:1.8), (Distinctive Feature: cybernetic eye:1.6).\nThese must be clearly visible and easily identifiable.\n\nThe background is BACKGROUND, detailed yet subtle, adding depth without distracting from the character.\n\nBust shot, centered composition, clean silhouette, no extra text or logos,  CXL-Mech\nNegative prompt: Compression artifacts, bad art, worst quality, low quality, plastic, fake, bad limbs, conjoined, featureless, bad features, incorrect objects, watermark, ((signature):1.25), logo, zip2d_neg\nSteps: 40, Sampler: DPM++ 2M, Schedule type: Karras, CFG scale: 7, Seed: 465309964, Size: 832x832, Model hash: 6330883d2c, Model: artium_v20, Denoising strength: 0.3, RNG: CPU, ControlNet 0: \"Module: CLIP-ViT-H (IPAdapter), Model: ip-adapter-plus_sdxl_vit-h [bc449f62], Weight: 0.35, Resize Mode: ResizeMode.INNER_FIT, Processor Res: 0.5, Threshold A: 0.5, Threshold B: 0.5, Guidance Start: 0.3, Guidance End: 0.7, Pixel Perfect: False, Control Mode: ControlMode.BALANCED, Hr Option: HiResFixOption.BOTH\", ControlNet 1: \"Module: CLIP-ViT-H (IPAdapter), Model: ip-adapter-plus-face_sdxl_vit-h [368cf551], Weight: 1, Resize Mode: ResizeMode.INNER_FIT, Processor Res: 0.5, Threshold A: 0.5, Threshold B: 0.5, Guidance Start: 0.1, Guidance End: 0.9, Pixel Perfect: False, Control Mode: ControlMode.BALANCED, Hr Option: HiResFixOption.BOTH\", Hires prompt: \"A vibrant cyberpunk illustration, comic-book/anime hybrid, bold colors, defined line art, high-contrast neon lighting.\\nA male Mothership RPG Marine character, (age 42 years old:2.0).\\n\\nThe character is skilled in Military Training, Firearms, and Command.\\nThese skills are represented visually through specific details:\\n- Military Training → unit patches and insignia\\n- Firearms → visible rifle sling and ammo clips\\n- Command → confident posture with subtle headset device\\n\\n(Holding Old Dog Tags:1.8), (Distinctive Feature: cybernetic eye:1.6).\\nThese must be clearly visible and easily identifiable.\\n\\nThe background is BACKGROUND, detailed yet subtle, adding depth without distracting from the character.\\n\\nBust shot, centered composition, clean silhouette, no extra text or logos,  CXL-Mech\", Hires CFG Scale: 7, Hires upscale: 2, Hires steps: 15, Hires upscaler: ESRGAN_4x, TI hashes: \"CXL-Mech: 000b204acc87, CXL-Mech: 000b204acc87, CXL-Mech: 000b204acc87, CXL-Mech: 000b204acc87, CXL-Mech: 000b204acc87, CXL-Mech: 000b204acc87, CXL-Mech: 000b204acc87, CXL-Mech: 000b204acc87, CXL-Mech: 000b204acc87, CXL-Mech: 000b204acc87, CXL-Mech: 000b204acc87, CXL-Mech: 000b204acc87, CXL-Mech: 000b204acc87, CXL-Mech: 000b204acc87, zip2d_neg: a764ec702efd, zip2d_neg: a764ec702efd, CXL-Mech: 000b204acc87, CXL-Mech: 000b204acc87, zip2d_neg: a764ec702efd, zip2d_neg: a764ec702efd\", Pad conds: True, Version: f1.0.0v2-v1.10.1RC-latest-2454-g9086b215, Source Identifier: Stable Diffusion web UI"
        },
        {
            "type": "file",
            "id": 124,
            "date": "2025-09-09 17:33:24",
            "created_date": "2025-09-09 17:33:24",
            "size": "2.78 MB",
            "is_under_scanned_path": true,
            "bytes": 2916834,
            "name": "00107-465309963.png",
            "fullpath": "/Users/pixelkaos/Library/Application Support/StabilityMatrix/Packages/Stable Diffusion WebUI reForge/outputs/txt2img-images/2025-09-09/00107-465309963.png",
            "gen_info_obj": {
                "steps": 40,
                "sampler": "DPM++ 2M",
                "Schedule type": "Karras",
                "cfgScale": 7,
                "seed": 465309963,
                "size": "832x832",
                "Model hash": "6330883d2c",
                "Model": "artium_v20",
                "Denoising strength": 0.3,
                "RNG": "CPU",
                "Hires prompt": "A vibrant cyberpunk illustration, comic-book/anime hybrid, bold colors, defined line art, high-contrast neon lighting.nA male Mothership RPG Marine character, (age 42 years old:2.0).nnThe character is skilled in Military Training, Firearms, and Command.nThese skills are represented visually through specific details:n- Military Training → unit patches and insignian- Firearms → visible rifle sling and ammo clipsn- Command → confident posture with subtle headset devicenn(Holding Old Dog Tags:1.8), (Distinctive Feature: cybernetic eye:1.6).nThese must be clearly visible and easily identifiable.nnThe background is BACKGROUND, detailed yet subtle, adding depth without distracting from the character.nnBust shot, centered composition, clean silhouette, no extra text or logos,  CXL-Mech",
                "Hires CFG Scale": 7,
                "Hires upscale": 2,
                "Hires steps": 15,
                "Hires upscaler": "ESRGAN_4x",
                "TI hashes": "CXL-Mech: 000b204acc87, CXL-Mech: 000b204acc87, CXL-Mech: 000b204acc87, CXL-Mech: 000b204acc87, CXL-Mech: 000b204acc87, CXL-Mech: 000b204acc87, CXL-Mech: 000b204acc87, CXL-Mech: 000b204acc87, CXL-Mech: 000b204acc87, CXL-Mech: 000b204acc87, CXL-Mech: 000b204acc87, CXL-Mech: 000b204acc87, CXL-Mech: 000b204acc87, CXL-Mech: 000b204acc87, zip2d_neg: a764ec702efd, zip2d_neg: a764ec702efd, CXL-Mech: 000b204acc87, CXL-Mech: 000b204acc87, zip2d_neg: a764ec702efd, zip2d_neg: a764ec702efd",
                "Pad conds": "True",
                "Version": "f1.0.0v2-v1.10.1RC-latest-2454-g9086b215",
                "Source Identifier": "Stable Diffusion web UI",
                "ControlNet 0": "Module: CLIP-ViT-H (IPAdapter), Model: ip-adapter-plus_sdxl_vit-h [bc449f62], Weight: 0.35, Resize Mode: ResizeMode.INNER_FIT, Processor Res: 0.5, Threshold A: 0.5, Threshold B: 0.5, Guidance Start: 0.3, Guidance End: 0.7, Pixel Perfect: False, Control Mode: ControlMode.BALANCED, Hr Option: HiResFixOption.BOTH",
                "ControlNet 1": "Module: CLIP-ViT-H (IPAdapter), Model: ip-adapter-plus-face_sdxl_vit-h [368cf551], Weight: 1, Resize Mode: ResizeMode.INNER_FIT, Processor Res: 0.5, Threshold A: 0.5, Threshold B: 0.5, Guidance Start: 0.1, Guidance End: 0.9, Pixel Perfect: False, Control Mode: ControlMode.BALANCED, Hr Option: HiResFixOption.BOTH",
                "prompt": "A vibrant cyberpunk illustration, comic-book/anime hybrid, bold colors, defined line art, high-contrast neon lighting.\nA male Mothership RPG Marine character, (age 29 years old:2.0).\nThe character is skilled in Military Training, Firearms, and Command.\nThese skills are represented visually through specific details:\n- Military Training → unit patches and insignia\n- Firearms → visible rifle sling and ammo clips\n- Command → confident posture with subtle headset device\n(Holding Old Dog Tags:1.8), (Distinctive Feature: cybernetic eye:1.6).\nThese must be clearly visible and easily identifiable.\nThe background is BACKGROUND, detailed yet subtle, adding depth without distracting from the character.\nBust shot, centered composition, clean silhouette, no extra text or logos,  CXL-Mech",
                "negativePrompt": "Compression artifacts, bad art, worst quality, low quality, plastic, fake, bad limbs, conjoined, featureless, bad features, incorrect objects, watermark, ((signature):1.25), logo, zip2d_neg",
                "width": 832,
                "height": 832,
                "hashes": {
                    "model": "6330883d2c"
                },
                "resources": [
                    {
                        "type": "model",
                        "name": "artium_v20",
                        "hash": "6330883d2c"
                    }
                ]
            },
            "gen_info_raw": "A vibrant cyberpunk illustration, comic-book/anime hybrid, bold colors, defined line art, high-contrast neon lighting.\nA male Mothership RPG Marine character, (age 29 years old:2.0).\n\nThe character is skilled in Military Training, Firearms, and Command.\nThese skills are represented visually through specific details:\n- Military Training → unit patches and insignia\n- Firearms → visible rifle sling and ammo clips\n- Command → confident posture with subtle headset device\n\n(Holding Old Dog Tags:1.8), (Distinctive Feature: cybernetic eye:1.6).\nThese must be clearly visible and easily identifiable.\n\nThe background is BACKGROUND, detailed yet subtle, adding depth without distracting from the character.\n\nBust shot, centered composition, clean silhouette, no extra text or logos,  CXL-Mech\nNegative prompt: Compression artifacts, bad art, worst quality, low quality, plastic, fake, bad limbs, conjoined, featureless, bad features, incorrect objects, watermark, ((signature):1.25), logo, zip2d_neg\nSteps: 40, Sampler: DPM++ 2M, Schedule type: Karras, CFG scale: 7, Seed: 465309963, Size: 832x832, Model hash: 6330883d2c, Model: artium_v20, Denoising strength: 0.3, RNG: CPU, ControlNet 0: \"Module: CLIP-ViT-H (IPAdapter), Model: ip-adapter-plus_sdxl_vit-h [bc449f62], Weight: 0.35, Resize Mode: ResizeMode.INNER_FIT, Processor Res: 0.5, Threshold A: 0.5, Threshold B: 0.5, Guidance Start: 0.3, Guidance End: 0.7, Pixel Perfect: False, Control Mode: ControlMode.BALANCED, Hr Option: HiResFixOption.BOTH\", ControlNet 1: \"Module: CLIP-ViT-H (IPAdapter), Model: ip-adapter-plus-face_sdxl_vit-h [368cf551], Weight: 1, Resize Mode: ResizeMode.INNER_FIT, Processor Res: 0.5, Threshold A: 0.5, Threshold B: 0.5, Guidance Start: 0.1, Guidance End: 0.9, Pixel Perfect: False, Control Mode: ControlMode.BALANCED, Hr Option: HiResFixOption.BOTH\", Hires prompt: \"A vibrant cyberpunk illustration, comic-book/anime hybrid, bold colors, defined line art, high-contrast neon lighting.\\nA male Mothership RPG Marine character, (age 42 years old:2.0).\\n\\nThe character is skilled in Military Training, Firearms, and Command.\\nThese skills are represented visually through specific details:\\n- Military Training → unit patches and insignia\\n- Firearms → visible rifle sling and ammo clips\\n- Command → confident posture with subtle headset device\\n\\n(Holding Old Dog Tags:1.8), (Distinctive Feature: cybernetic eye:1.6).\\nThese must be clearly visible and easily identifiable.\\n\\nThe background is BACKGROUND, detailed yet subtle, adding depth without distracting from the character.\\n\\nBust shot, centered composition, clean silhouette, no extra text or logos,  CXL-Mech\", Hires CFG Scale: 7, Hires upscale: 2, Hires steps: 15, Hires upscaler: ESRGAN_4x, TI hashes: \"CXL-Mech: 000b204acc87, CXL-Mech: 000b204acc87, CXL-Mech: 000b204acc87, CXL-Mech: 000b204acc87, CXL-Mech: 000b204acc87, CXL-Mech: 000b204acc87, CXL-Mech: 000b204acc87, CXL-Mech: 000b204acc87, CXL-Mech: 000b204acc87, CXL-Mech: 000b204acc87, CXL-Mech: 000b204acc87, CXL-Mech: 000b204acc87, CXL-Mech: 000b204acc87, CXL-Mech: 000b204acc87, zip2d_neg: a764ec702efd, zip2d_neg: a764ec702efd, CXL-Mech: 000b204acc87, CXL-Mech: 000b204acc87, zip2d_neg: a764ec702efd, zip2d_neg: a764ec702efd\", Pad conds: True, Version: f1.0.0v2-v1.10.1RC-latest-2454-g9086b215, Source Identifier: Stable Diffusion web UI"
        },
        {
            "type": "file",
            "id": 169,
            "date": "2025-09-09 16:10:27",
            "created_date": "2025-09-09 16:10:27",
            "size": "908.49 KB",
            "is_under_scanned_path": true,
            "bytes": 930295,
            "name": "00096-1740094495.png",
            "fullpath": "/Users/pixelkaos/Library/Application Support/StabilityMatrix/Packages/Stable Diffusion WebUI reForge/outputs/txt2img-images/2025-09-09/00096-1740094495.png",
            "gen_info_obj": {
                "steps": 40,
                "sampler": "DPM++ 2M",
                "Schedule type": "Karras",
                "cfgScale": 7,
                "seed": 1740094495,
                "size": "832x832",
                "Model hash": "6330883d2c",
                "Model": "artium_v20",
                "RNG": "CPU",
                "TI hashes": "CXL-Mech: 000b204acc87, CXL-Mech: 000b204acc87, CXL-Mech: 000b204acc87, CXL-Mech: 000b204acc87, zip2d_neg: a764ec702efd, zip2d_neg: a764ec702efd",
                "Pad conds": "True",
                "Version": "f1.0.0v2-v1.10.1RC-latest-2454-g9086b215",
                "Source Identifier": "Stable Diffusion web UI",
                "ControlNet 0": "Module: CLIP-ViT-H (IPAdapter), Model: ip-adapter-plus_sdxl_vit-h [bc449f62], Weight: 0.35, Resize Mode: ResizeMode.INNER_FIT, Processor Res: 0.5, Threshold A: 0.5, Threshold B: 0.5, Guidance Start: 0.3, Guidance End: 0.7, Pixel Perfect: False, Control Mode: ControlMode.BALANCED, Hr Option: HiResFixOption.BOTH",
                "ControlNet 1": "Module: CLIP-ViT-H (IPAdapter), Model: ip-adapter-plus-face_sdxl_vit-h [368cf551], Weight: 0.9, Resize Mode: ResizeMode.INNER_FIT, Processor Res: 0.5, Threshold A: 0.5, Threshold B: 0.5, Guidance Start: 0.1, Guidance End: 0.8, Pixel Perfect: False, Control Mode: ControlMode.BALANCED, Hr Option: HiResFixOption.BOTH",
                "prompt": "A vibrant cyberpunk illustration, comic-book/anime hybrid, bold colors, defined line art, high-contrast neon lighting.\nA non-binary Mothership RPG Marine character, (age 42:2.0).\nThe character is skilled in Military Training, Firearms, and Command.\nThese skills are represented visually through specific details:\n- Military Training → unit patches and insignia\n- Firearms → visible rifle sling and ammo clips\n- Command → confident posture with subtle headset device\n(Holding Rusty Combat Knife:1.8), (Distinctive Feature: scarred half of his face:1.6).\nThese must be clearly visible and easily identifiable.\nThe background is sci-fi corridor with glowing panels, detailed yet subtle, adding depth without distracting from the character.\nBust shot, centered composition, clean silhouette, no extra text or logos,  CXL-Mech",
                "negativePrompt": "Compression artifacts, bad art, worst quality, low quality, plastic, fake, bad limbs, conjoined, featureless, bad features, incorrect objects, watermark, ((signature):1.25), logo, zip2d_neg",
                "width": 832,
                "height": 832,
                "hashes": {
                    "model": "6330883d2c"
                },
                "resources": [
                    {
                        "type": "model",
                        "name": "artium_v20",
                        "hash": "6330883d2c"
                    }
                ]
            },
            "gen_info_raw": "A vibrant cyberpunk illustration, comic-book/anime hybrid, bold colors, defined line art, high-contrast neon lighting.\nA non-binary Mothership RPG Marine character, (age 42:2.0).\n\nThe character is skilled in Military Training, Firearms, and Command.\nThese skills are represented visually through specific details:\n- Military Training → unit patches and insignia\n- Firearms → visible rifle sling and ammo clips\n- Command → confident posture with subtle headset device\n\n(Holding Rusty Combat Knife:1.8), (Distinctive Feature: scarred half of his face:1.6).\nThese must be clearly visible and easily identifiable.\n\nThe background is sci-fi corridor with glowing panels, detailed yet subtle, adding depth without distracting from the character.\n\nBust shot, centered composition, clean silhouette, no extra text or logos,  CXL-Mech\nNegative prompt: Compression artifacts, bad art, worst quality, low quality, plastic, fake, bad limbs, conjoined, featureless, bad features, incorrect objects, watermark, ((signature):1.25), logo, zip2d_neg\nSteps: 40, Sampler: DPM++ 2M, Schedule type: Karras, CFG scale: 7, Seed: 1740094495, Size: 832x832, Model hash: 6330883d2c, Model: artium_v20, RNG: CPU, ControlNet 0: \"Module: CLIP-ViT-H (IPAdapter), Model: ip-adapter-plus_sdxl_vit-h [bc449f62], Weight: 0.35, Resize Mode: ResizeMode.INNER_FIT, Processor Res: 0.5, Threshold A: 0.5, Threshold B: 0.5, Guidance Start: 0.3, Guidance End: 0.7, Pixel Perfect: False, Control Mode: ControlMode.BALANCED, Hr Option: HiResFixOption.BOTH\", ControlNet 1: \"Module: CLIP-ViT-H (IPAdapter), Model: ip-adapter-plus-face_sdxl_vit-h [368cf551], Weight: 0.9, Resize Mode: ResizeMode.INNER_FIT, Processor Res: 0.5, Threshold A: 0.5, Threshold B: 0.5, Guidance Start: 0.1, Guidance End: 0.8, Pixel Perfect: False, Control Mode: ControlMode.BALANCED, Hr Option: HiResFixOption.BOTH\", TI hashes: \"CXL-Mech: 000b204acc87, CXL-Mech: 000b204acc87, CXL-Mech: 000b204acc87, CXL-Mech: 000b204acc87, zip2d_neg: a764ec702efd, zip2d_neg: a764ec702efd\", Pad conds: True, Version: f1.0.0v2-v1.10.1RC-latest-2454-g9086b215, Source Identifier: Stable Diffusion web UI"
        },
        {
            "type": "file",
            "id": 159,
            "date": "2025-09-09 16:05:06",
            "created_date": "2025-09-09 16:05:06",
            "size": "895.55 KB",
            "is_under_scanned_path": true,
            "bytes": 917039,
            "name": "00094-167829247.png",
            "fullpath": "/Users/pixelkaos/Library/Application Support/StabilityMatrix/Packages/Stable Diffusion WebUI reForge/outputs/txt2img-images/2025-09-09/00094-167829247.png",
            "gen_info_obj": {
                "steps": 40,
                "sampler": "DPM++ 2M",
                "Schedule type": "Karras",
                "cfgScale": 7,
                "seed": 167829247,
                "size": "832x832",
                "Model hash": "6330883d2c",
                "Model": "artium_v20",
                "RNG": "CPU",
                "TI hashes": "CXL-Mech: 000b204acc87, CXL-Mech: 000b204acc87, CXL-Mech: 000b204acc87, CXL-Mech: 000b204acc87, zip2d_neg: a764ec702efd, zip2d_neg: a764ec702efd",
                "Pad conds": "True",
                "Version": "f1.0.0v2-v1.10.1RC-latest-2454-g9086b215",
                "Source Identifier": "Stable Diffusion web UI",
                "ControlNet 0": "Module: CLIP-ViT-H (IPAdapter), Model: ip-adapter-plus_sdxl_vit-h [bc449f62], Weight: 0.35, Resize Mode: ResizeMode.INNER_FIT, Processor Res: 0.5, Threshold A: 0.5, Threshold B: 0.5, Guidance Start: 0.3, Guidance End: 0.7, Pixel Perfect: False, Control Mode: ControlMode.BALANCED, Hr Option: HiResFixOption.BOTH",
                "ControlNet 1": "Module: CLIP-ViT-H (IPAdapter), Model: ip-adapter-plus-face_sdxl_vit-h [368cf551], Weight: 0.9, Resize Mode: ResizeMode.INNER_FIT, Processor Res: 0.5, Threshold A: 0.5, Threshold B: 0.5, Guidance Start: 0.1, Guidance End: 0.8, Pixel Perfect: False, Control Mode: ControlMode.BALANCED, Hr Option: HiResFixOption.BOTH",
                "prompt": "A vibrant cyberpunk illustration, comic-book/anime hybrid, bold colors, defined line art, high-contrast neon lighting.\nA male Mothership RPG Marine character, age 29.\nThe character is skilled in Military Training, Firearms, and Command.\nThese skills are represented visually through specific details:\n- Military Training → unit patches and insignia\n- Firearms → visible rifle sling and ammo clips\n- Command → confident posture with subtle headset device\n(Holding Rusty Combat Knife:1.8), (Distinctive Feature: scarred half of his face:1.6).\nThese must be clearly visible and easily identifiable.\nThe background is neon-lit maintenance hangar, detailed yet subtle, adding depth without distracting from the character.\nBust shot, centered composition, clean silhouette, no extra text or logos,  CXL-Mech",
                "negativePrompt": "Compression artifacts, bad art, worst quality, low quality, plastic, fake, bad limbs, conjoined, featureless, bad features, incorrect objects, watermark, ((signature):1.25), logo, zip2d_neg",
                "width": 832,
                "height": 832,
                "hashes": {
                    "model": "6330883d2c"
                },
                "resources": [
                    {
                        "type": "model",
                        "name": "artium_v20",
                        "hash": "6330883d2c"
                    }
                ]
            },
            "gen_info_raw": "A vibrant cyberpunk illustration, comic-book/anime hybrid, bold colors, defined line art, high-contrast neon lighting.\nA male Mothership RPG Marine character, age 29.\n\nThe character is skilled in Military Training, Firearms, and Command.\nThese skills are represented visually through specific details:\n- Military Training → unit patches and insignia\n- Firearms → visible rifle sling and ammo clips\n- Command → confident posture with subtle headset device\n\n(Holding Rusty Combat Knife:1.8), (Distinctive Feature: scarred half of his face:1.6).\nThese must be clearly visible and easily identifiable.\n\nThe background is neon-lit maintenance hangar, detailed yet subtle, adding depth without distracting from the character.\n\nBust shot, centered composition, clean silhouette, no extra text or logos,  CXL-Mech\nNegative prompt: Compression artifacts, bad art, worst quality, low quality, plastic, fake, bad limbs, conjoined, featureless, bad features, incorrect objects, watermark, ((signature):1.25), logo, zip2d_neg\nSteps: 40, Sampler: DPM++ 2M, Schedule type: Karras, CFG scale: 7, Seed: 167829247, Size: 832x832, Model hash: 6330883d2c, Model: artium_v20, RNG: CPU, ControlNet 0: \"Module: CLIP-ViT-H (IPAdapter), Model: ip-adapter-plus_sdxl_vit-h [bc449f62], Weight: 0.35, Resize Mode: ResizeMode.INNER_FIT, Processor Res: 0.5, Threshold A: 0.5, Threshold B: 0.5, Guidance Start: 0.3, Guidance End: 0.7, Pixel Perfect: False, Control Mode: ControlMode.BALANCED, Hr Option: HiResFixOption.BOTH\", ControlNet 1: \"Module: CLIP-ViT-H (IPAdapter), Model: ip-adapter-plus-face_sdxl_vit-h [368cf551], Weight: 0.9, Resize Mode: ResizeMode.INNER_FIT, Processor Res: 0.5, Threshold A: 0.5, Threshold B: 0.5, Guidance Start: 0.1, Guidance End: 0.8, Pixel Perfect: False, Control Mode: ControlMode.BALANCED, Hr Option: HiResFixOption.BOTH\", TI hashes: \"CXL-Mech: 000b204acc87, CXL-Mech: 000b204acc87, CXL-Mech: 000b204acc87, CXL-Mech: 000b204acc87, zip2d_neg: a764ec702efd, zip2d_neg: a764ec702efd\", Pad conds: True, Version: f1.0.0v2-v1.10.1RC-latest-2454-g9086b215, Source Identifier: Stable Diffusion web UI"
        },
        {
            "type": "file",
            "id": 225,
            "date": "2025-09-08 22:50:27",
            "created_date": "2025-09-08 22:50:27",
            "size": "822.53 KB",
            "is_under_scanned_path": true,
            "bytes": 842269,
            "name": "00002-821498321779274.png",
            "fullpath": "/Users/pixelkaos/Library/Application Support/StabilityMatrix/Packages/Stable Diffusion WebUI reForge/outputs/txt2img-images/2025-09-08/00002-821498321779274.png",
            "gen_info_obj": {
                "steps": 30,
                "sampler": "DPM++ 2M",
                "Schedule type": "Karras",
                "cfgScale": 7,
                "seed": 821498321779274,
                "size": "832x832",
                "Model hash": "6330883d2c",
                "Model": "artium_v20",
                "Pad conds": "True",
                "Version": "f1.0.0v2-v1.10.1RC-latest-2454-g9086b215",
                "Source Identifier": "Stable Diffusion web UI",
                "ControlNet 0": "Module: CLIP-ViT-H (IPAdapter), Model: ip-adapter-plus-face_sdxl_vit-h [368cf551], Weight: 1, Resize Mode: ResizeMode.INNER_FIT, Processor Res: 0.5, Threshold A: 0.5, Threshold B: 0.5, Guidance Start: 0, Guidance End: 1, Pixel Perfect: False, Control Mode: ControlMode.BALANCED, Hr Option: HiResFixOption.BOTH",
                "prompt": "a Marine, FOCUS SKILs (Military Training, Firearms, Command), Convey these skills through wardrobe, pose, and small gear details.\nThey are holding a Necklace of Shell Casings.\nSpecial feature: a cybernetic eye. Keep it readable at portrait scale.\nArt Direction (locked): Bold colors, defined line art, high contrast, dramatic neon lighting. Framing: Bust shot, centered composition, neutral/dark gradient background. Clarity: Clean silhouette",
                "negativePrompt": "Compression artifacts, bad art, worst quality, low quality, plastic, fake, bad limbs, conjoined, featureless, bad features, incorrect objects, watermark, ((signature):1.25), logo",
                "width": 832,
                "height": 832,
                "hashes": {
                    "model": "6330883d2c"
                },
                "resources": [
                    {
                        "type": "model",
                        "name": "artium_v20",
                        "hash": "6330883d2c"
                    }
                ]
            },
            "gen_info_raw": "a Marine, FOCUS SKILs (Military Training, Firearms, Command), Convey these skills through wardrobe, pose, and small gear details.\nThey are holding a Necklace of Shell Casings.\nSpecial feature: a cybernetic eye. Keep it readable at portrait scale.\nArt Direction (locked): Bold colors, defined line art, high contrast, dramatic neon lighting. Framing: Bust shot, centered composition, neutral/dark gradient background. Clarity: Clean silhouette\nNegative prompt: Compression artifacts, bad art, worst quality, low quality, plastic, fake, bad limbs, conjoined, featureless, bad features, incorrect objects, watermark, ((signature):1.25), logo\nSteps: 30, Sampler: DPM++ 2M, Schedule type: Karras, CFG scale: 7, Seed: 821498321779274, Size: 832x832, Model hash: 6330883d2c, Model: artium_v20, ControlNet 0: \"Module: CLIP-ViT-H (IPAdapter), Model: ip-adapter-plus-face_sdxl_vit-h [368cf551], Weight: 1, Resize Mode: ResizeMode.INNER_FIT, Processor Res: 0.5, Threshold A: 0.5, Threshold B: 0.5, Guidance Start: 0, Guidance End: 1, Pixel Perfect: False, Control Mode: ControlMode.BALANCED, Hr Option: HiResFixOption.BOTH\", Pad conds: True, Version: f1.0.0v2-v1.10.1RC-latest-2454-g9086b215, Source Identifier: Stable Diffusion web UI"
        }
    ]
}