{
    "files": [
        {
            "type": "file",
            "id": 1019,
            "date": "2025-09-10 10:45:23",
            "created_date": "2025-09-10 10:45:23",
            "size": "2.64 MB",
            "is_under_scanned_path": true,
            "bytes": 2773009,
            "name": "00013-44347459.png",
            "fullpath": "/Users/pixelkaos/Library/Application Support/StabilityMatrix/Packages/Stable Diffusion WebUI reForge/outputs/txt2img-images/2025-09-10/00013-44347459.png",
            "gen_info_obj": {
                "steps": 40,
                "sampler": "DPM++ 2M",
                "Schedule type": "Karras",
                "cfgScale": 7,
                "seed": 44347459,
                "size": "832x832",
                "Model hash": "6330883d2c",
                "Model": "artium_v20",
                "Denoising strength": 0.3,
                "RNG": "CPU",
                "Hires prompt": "A vibrant cyberpunk illustration, comic-book/anime hybrid, bold colors, defined line art, high-contrast neon lighting.nA ((male)) Mothership RPG Android character, modern model, brand new.nnhe character is skilled in Robotics, Computers, and Cybernetics.nThese skills are represented visually through specific details:n- Robotics → servo tool belt and mechanical armsn- Computers → holographic UI projectionsn- Cybernetics → cranial ports and visible implantsnn(Holding Data Crystal:1.8), (Distinctive Feature: sleek metallic skull plate:1.6).nThese must be clearly visible and easily identifiable.nnThe background is sci-fi corridor with glowing panels, detailed yet subtle, adding depth without distracting from the character,nnBust shot, centered composition, clean silhouette, no extra text or logos, ZIP2D,  CXL-Mech",
                "Hires CFG Scale": 7,
                "Hires upscale": 2,
                "Hires steps": 15,
                "Hires upscaler": "ESRGAN_4x",
                "TI hashes": "ZIP2D: 353cf9be0675, CXL-Mech: 000b204acc87, ZIP2D: 353cf9be0675, CXL-Mech: 000b204acc87, CXL-Mech: 000b204acc87, CXL-Mech: 000b204acc87, CXL-Mech: 000b204acc87, CXL-Mech: 000b204acc87, CXL-Mech: 000b204acc87, CXL-Mech: 000b204acc87, CXL-Mech: 000b204acc87, CXL-Mech: 000b204acc87, CXL-Mech: 000b204acc87, CXL-Mech: 000b204acc87, CXL-Mech: 000b204acc87, CXL-Mech: 000b204acc87, CXL-Mech: 000b204acc87, CXL-Mech: 000b204acc87, zip2d_neg: a764ec702efd, zip2d_neg: a764ec702efd, CXL-Mech: 000b204acc87, CXL-Mech: 000b204acc87, zip2d_neg: a764ec702efd, zip2d_neg: a764ec702efd",
                "Pad conds": "True",
                "Version": "f1.0.0v2-v1.10.1RC-latest-2454-g9086b215",
                "Source Identifier": "Stable Diffusion web UI",
                "ControlNet 0": "Module: CLIP-ViT-H (IPAdapter), Model: ip-adapter-plus_sdxl_vit-h [bc449f62], Weight: 0.35, Resize Mode: ResizeMode.INNER_FIT, Processor Res: 0.5, Threshold A: 0.5, Threshold B: 0.5, Guidance Start: 0.3, Guidance End: 0.7, Pixel Perfect: False, Control Mode: ControlMode.BALANCED, Hr Option: HiResFixOption.BOTH",
                "ControlNet 1": "Module: CLIP-ViT-H (IPAdapter), Model: ip-adapter-plus-face_sdxl_vit-h [368cf551], Weight: 1, Resize Mode: ResizeMode.INNER_FIT, Processor Res: 0.5, Threshold A: 0.5, Threshold B: 0.5, Guidance Start: 0.1, Guidance End: 0.9, Pixel Perfect: False, Control Mode: ControlMode.BALANCED, Hr Option: HiResFixOption.BOTH",
                "prompt": "A vibrant cyberpunk illustration, comic-book/anime hybrid, bold colors, defined line art, high-contrast neon lighting.\nA ((male)) Mothership RPG Android character, modern model, brand new.\nhe character is skilled in Robotics, Computers, and Cybernetics.\nThese skills are represented visually through specific details:\n- Robotics → servo tool belt and mechanical arms\n- Computers → holographic UI projections\n- Cybernetics → cranial ports and visible implants\n(Holding Data Crystal:1.8), (Distinctive Feature: sleek metallic skull plate:1.6).\nThese must be clearly visible and easily identifiable.\nThe background is neon-lit maintenance hangar, detailed yet subtle, adding depth without distracting from the character,\nBust shot, centered composition, clean silhouette, no extra text or logos, ZIP2D,  CXL-Mech",
                "negativePrompt": "Compression artifacts, bad art, worst quality, low quality, plastic, fake, bad limbs, conjoined, featureless, bad features, incorrect objects, watermark, ((signature):1.25), logo, zip2d_neg",
                "width": 832,
                "height": 832,
                "hashes": {
                    "model": "6330883d2c"
                },
                "resources": [
                    {
                        "type": "model",
                        "name": "artium_v20",
                        "hash": "6330883d2c"
                    }
                ]
            },
            "gen_info_raw": "A vibrant cyberpunk illustration, comic-book/anime hybrid, bold colors, defined line art, high-contrast neon lighting.\nA ((male)) Mothership RPG Android character, modern model, brand new.\n\nhe character is skilled in Robotics, Computers, and Cybernetics.\nThese skills are represented visually through specific details:\n- Robotics → servo tool belt and mechanical arms\n- Computers → holographic UI projections\n- Cybernetics → cranial ports and visible implants\n\n(Holding Data Crystal:1.8), (Distinctive Feature: sleek metallic skull plate:1.6).\nThese must be clearly visible and easily identifiable.\n\nThe background is neon-lit maintenance hangar, detailed yet subtle, adding depth without distracting from the character,\n\nBust shot, centered composition, clean silhouette, no extra text or logos, ZIP2D,  CXL-Mech\nNegative prompt: Compression artifacts, bad art, worst quality, low quality, plastic, fake, bad limbs, conjoined, featureless, bad features, incorrect objects, watermark, ((signature):1.25), logo, zip2d_neg\nSteps: 40, Sampler: DPM++ 2M, Schedule type: Karras, CFG scale: 7, Seed: 44347459, Size: 832x832, Model hash: 6330883d2c, Model: artium_v20, Denoising strength: 0.3, RNG: CPU, ControlNet 0: \"Module: CLIP-ViT-H (IPAdapter), Model: ip-adapter-plus_sdxl_vit-h [bc449f62], Weight: 0.35, Resize Mode: ResizeMode.INNER_FIT, Processor Res: 0.5, Threshold A: 0.5, Threshold B: 0.5, Guidance Start: 0.3, Guidance End: 0.7, Pixel Perfect: False, Control Mode: ControlMode.BALANCED, Hr Option: HiResFixOption.BOTH\", ControlNet 1: \"Module: CLIP-ViT-H (IPAdapter), Model: ip-adapter-plus-face_sdxl_vit-h [368cf551], Weight: 1, Resize Mode: ResizeMode.INNER_FIT, Processor Res: 0.5, Threshold A: 0.5, Threshold B: 0.5, Guidance Start: 0.1, Guidance End: 0.9, Pixel Perfect: False, Control Mode: ControlMode.BALANCED, Hr Option: HiResFixOption.BOTH\", Hires prompt: \"A vibrant cyberpunk illustration, comic-book/anime hybrid, bold colors, defined line art, high-contrast neon lighting.\\nA ((male)) Mothership RPG Android character, modern model, brand new.\\n\\nhe character is skilled in Robotics, Computers, and Cybernetics.\\nThese skills are represented visually through specific details:\\n- Robotics → servo tool belt and mechanical arms\\n- Computers → holographic UI projections\\n- Cybernetics → cranial ports and visible implants\\n\\n(Holding Data Crystal:1.8), (Distinctive Feature: sleek metallic skull plate:1.6).\\nThese must be clearly visible and easily identifiable.\\n\\nThe background is sci-fi corridor with glowing panels, detailed yet subtle, adding depth without distracting from the character,\\n\\nBust shot, centered composition, clean silhouette, no extra text or logos, ZIP2D,  CXL-Mech\", Hires CFG Scale: 7, Hires upscale: 2, Hires steps: 15, Hires upscaler: ESRGAN_4x, TI hashes: \"ZIP2D: 353cf9be0675, CXL-Mech: 000b204acc87, ZIP2D: 353cf9be0675, CXL-Mech: 000b204acc87, CXL-Mech: 000b204acc87, CXL-Mech: 000b204acc87, CXL-Mech: 000b204acc87, CXL-Mech: 000b204acc87, CXL-Mech: 000b204acc87, CXL-Mech: 000b204acc87, CXL-Mech: 000b204acc87, CXL-Mech: 000b204acc87, CXL-Mech: 000b204acc87, CXL-Mech: 000b204acc87, CXL-Mech: 000b204acc87, CXL-Mech: 000b204acc87, CXL-Mech: 000b204acc87, CXL-Mech: 000b204acc87, zip2d_neg: a764ec702efd, zip2d_neg: a764ec702efd, CXL-Mech: 000b204acc87, CXL-Mech: 000b204acc87, zip2d_neg: a764ec702efd, zip2d_neg: a764ec702efd\", Pad conds: True, Version: f1.0.0v2-v1.10.1RC-latest-2454-g9086b215, Source Identifier: Stable Diffusion web UI"
        },
        {
            "type": "file",
            "id": 845,
            "date": "2025-09-10 10:19:45",
            "created_date": "2025-09-10 10:19:45",
            "size": "2.88 MB",
            "is_under_scanned_path": true,
            "bytes": 3016980,
            "name": "00010-991220130.png",
            "fullpath": "/Users/pixelkaos/Library/Application Support/StabilityMatrix/Packages/Stable Diffusion WebUI reForge/outputs/txt2img-images/2025-09-10/00010-991220130.png",
            "gen_info_obj": {
                "steps": 40,
                "sampler": "DPM++ 2M",
                "Schedule type": "Karras",
                "cfgScale": 7,
                "seed": 991220130,
                "size": "832x832",
                "Model hash": "6330883d2c",
                "Model": "artium_v20",
                "Denoising strength": 0.3,
                "RNG": "CPU",
                "Hires prompt": "A vibrant cyberpunk illustration, comic-book/anime hybrid, bold colors, defined line art, high-contrast neon lighting.nA ((robot like, non human)) Mothership RPG Android character, retro model, signs of wear.nnhe character is skilled in Robotics, Computers, and Cybernetics.nThese skills are represented visually through specific details:n- Robotics → servo tool belt and mechanical armsn- Computers → holographic UI projectionsn- Cybernetics → cranial ports and visible implantsnn(Holding Encrypted ID Chip:1.8), (Distinctive Feature: holographic eye:1.6).nThese must be clearly visible and easily identifiable.nnThe background is neon-lit maintenance hangar, detailed yet subtle, adding depth without distracting from the character,nnBust shot, centered composition, clean silhouette, no extra text or logos, ZIP2D,  CXL-Mech",
                "Hires CFG Scale": 7,
                "Hires upscale": 2,
                "Hires steps": 15,
                "Hires upscaler": "ESRGAN_4x",
                "TI hashes": "ZIP2D: 353cf9be0675, CXL-Mech: 000b204acc87, ZIP2D: 353cf9be0675, CXL-Mech: 000b204acc87, CXL-Mech: 000b204acc87, CXL-Mech: 000b204acc87, CXL-Mech: 000b204acc87, CXL-Mech: 000b204acc87, CXL-Mech: 000b204acc87, CXL-Mech: 000b204acc87, CXL-Mech: 000b204acc87, CXL-Mech: 000b204acc87, CXL-Mech: 000b204acc87, CXL-Mech: 000b204acc87, CXL-Mech: 000b204acc87, CXL-Mech: 000b204acc87, CXL-Mech: 000b204acc87, CXL-Mech: 000b204acc87, zip2d_neg: a764ec702efd, zip2d_neg: a764ec702efd, CXL-Mech: 000b204acc87, CXL-Mech: 000b204acc87, zip2d_neg: a764ec702efd, zip2d_neg: a764ec702efd",
                "Pad conds": "True",
                "Version": "f1.0.0v2-v1.10.1RC-latest-2454-g9086b215",
                "Source Identifier": "Stable Diffusion web UI",
                "ControlNet 0": "Module: CLIP-ViT-H (IPAdapter), Model: ip-adapter-plus_sdxl_vit-h [bc449f62], Weight: 0.35, Resize Mode: ResizeMode.INNER_FIT, Processor Res: 0.5, Threshold A: 0.5, Threshold B: 0.5, Guidance Start: 0.3, Guidance End: 0.7, Pixel Perfect: False, Control Mode: ControlMode.BALANCED, Hr Option: HiResFixOption.BOTH",
                "ControlNet 1": "Module: CLIP-ViT-H (IPAdapter), Model: ip-adapter-plus-face_sdxl_vit-h [368cf551], Weight: 1, Resize Mode: ResizeMode.INNER_FIT, Processor Res: 0.5, Threshold A: 0.5, Threshold B: 0.5, Guidance Start: 0.1, Guidance End: 0.9, Pixel Perfect: False, Control Mode: ControlMode.BALANCED, Hr Option: HiResFixOption.BOTH",
                "prompt": "A vibrant cyberpunk illustration, comic-book/anime hybrid, bold colors, defined line art, high-contrast neon lighting.\nA ((robot like, non human)) Mothership RPG Android character, retro model, signs of wear.\nhe character is skilled in Robotics, Computers, and Cybernetics.\nThese skills are represented visually through specific details:\n- Robotics → servo tool belt and mechanical arms\n- Computers → holographic UI projections\n- Cybernetics → cranial ports and visible implants\n(Holding Encrypted ID Chip:1.8), (Distinctive Feature: holographic eye:1.6).\nThese must be clearly visible and easily identifiable.\nThe background is futuristic laboratory filled with strange equipment, detailed yet subtle, adding depth without distracting from the character,\nBust shot, centered composition, clean silhouette, no extra text or logos, ZIP2D,  CXL-Mech",
                "negativePrompt": "Compression artifacts, bad art, worst quality, low quality, plastic, fake, bad limbs, conjoined, featureless, bad features, incorrect objects, watermark, ((signature):1.25), logo, zip2d_neg",
                "width": 832,
                "height": 832,
                "hashes": {
                    "model": "6330883d2c"
                },
                "resources": [
                    {
                        "type": "model",
                        "name": "artium_v20",
                        "hash": "6330883d2c"
                    }
                ]
            },
            "gen_info_raw": "A vibrant cyberpunk illustration, comic-book/anime hybrid, bold colors, defined line art, high-contrast neon lighting.\nA ((robot like, non human)) Mothership RPG Android character, retro model, signs of wear.\n\nhe character is skilled in Robotics, Computers, and Cybernetics.\nThese skills are represented visually through specific details:\n- Robotics → servo tool belt and mechanical arms\n- Computers → holographic UI projections\n- Cybernetics → cranial ports and visible implants\n\n(Holding Encrypted ID Chip:1.8), (Distinctive Feature: holographic eye:1.6).\nThese must be clearly visible and easily identifiable.\n\nThe background is futuristic laboratory filled with strange equipment, detailed yet subtle, adding depth without distracting from the character,\n\nBust shot, centered composition, clean silhouette, no extra text or logos, ZIP2D,  CXL-Mech\nNegative prompt: Compression artifacts, bad art, worst quality, low quality, plastic, fake, bad limbs, conjoined, featureless, bad features, incorrect objects, watermark, ((signature):1.25), logo, zip2d_neg\nSteps: 40, Sampler: DPM++ 2M, Schedule type: Karras, CFG scale: 7, Seed: 991220130, Size: 832x832, Model hash: 6330883d2c, Model: artium_v20, Denoising strength: 0.3, RNG: CPU, ControlNet 0: \"Module: CLIP-ViT-H (IPAdapter), Model: ip-adapter-plus_sdxl_vit-h [bc449f62], Weight: 0.35, Resize Mode: ResizeMode.INNER_FIT, Processor Res: 0.5, Threshold A: 0.5, Threshold B: 0.5, Guidance Start: 0.3, Guidance End: 0.7, Pixel Perfect: False, Control Mode: ControlMode.BALANCED, Hr Option: HiResFixOption.BOTH\", ControlNet 1: \"Module: CLIP-ViT-H (IPAdapter), Model: ip-adapter-plus-face_sdxl_vit-h [368cf551], Weight: 1, Resize Mode: ResizeMode.INNER_FIT, Processor Res: 0.5, Threshold A: 0.5, Threshold B: 0.5, Guidance Start: 0.1, Guidance End: 0.9, Pixel Perfect: False, Control Mode: ControlMode.BALANCED, Hr Option: HiResFixOption.BOTH\", Hires prompt: \"A vibrant cyberpunk illustration, comic-book/anime hybrid, bold colors, defined line art, high-contrast neon lighting.\\nA ((robot like, non human)) Mothership RPG Android character, retro model, signs of wear.\\n\\nhe character is skilled in Robotics, Computers, and Cybernetics.\\nThese skills are represented visually through specific details:\\n- Robotics → servo tool belt and mechanical arms\\n- Computers → holographic UI projections\\n- Cybernetics → cranial ports and visible implants\\n\\n(Holding Encrypted ID Chip:1.8), (Distinctive Feature: holographic eye:1.6).\\nThese must be clearly visible and easily identifiable.\\n\\nThe background is neon-lit maintenance hangar, detailed yet subtle, adding depth without distracting from the character,\\n\\nBust shot, centered composition, clean silhouette, no extra text or logos, ZIP2D,  CXL-Mech\", Hires CFG Scale: 7, Hires upscale: 2, Hires steps: 15, Hires upscaler: ESRGAN_4x, TI hashes: \"ZIP2D: 353cf9be0675, CXL-Mech: 000b204acc87, ZIP2D: 353cf9be0675, CXL-Mech: 000b204acc87, CXL-Mech: 000b204acc87, CXL-Mech: 000b204acc87, CXL-Mech: 000b204acc87, CXL-Mech: 000b204acc87, CXL-Mech: 000b204acc87, CXL-Mech: 000b204acc87, CXL-Mech: 000b204acc87, CXL-Mech: 000b204acc87, CXL-Mech: 000b204acc87, CXL-Mech: 000b204acc87, CXL-Mech: 000b204acc87, CXL-Mech: 000b204acc87, CXL-Mech: 000b204acc87, CXL-Mech: 000b204acc87, zip2d_neg: a764ec702efd, zip2d_neg: a764ec702efd, CXL-Mech: 000b204acc87, CXL-Mech: 000b204acc87, zip2d_neg: a764ec702efd, zip2d_neg: a764ec702efd\", Pad conds: True, Version: f1.0.0v2-v1.10.1RC-latest-2454-g9086b215, Source Identifier: Stable Diffusion web UI"
        },
        {
            "type": "file",
            "id": 840,
            "date": "2025-09-10 10:12:02",
            "created_date": "2025-09-10 10:12:02",
            "size": "2.92 MB",
            "is_under_scanned_path": true,
            "bytes": 3066921,
            "name": "00009-991220129.png",
            "fullpath": "/Users/pixelkaos/Library/Application Support/StabilityMatrix/Packages/Stable Diffusion WebUI reForge/outputs/txt2img-images/2025-09-10/00009-991220129.png",
            "gen_info_obj": {
                "steps": 40,
                "sampler": "DPM++ 2M",
                "Schedule type": "Karras",
                "cfgScale": 7,
                "seed": 991220129,
                "size": "832x832",
                "Model hash": "6330883d2c",
                "Model": "artium_v20",
                "Denoising strength": 0.3,
                "RNG": "CPU",
                "Hires prompt": "A vibrant cyberpunk illustration, comic-book/anime hybrid, bold colors, defined line art, high-contrast neon lighting.nA ((robot like, non human)) Mothership RPG Android character, retro model, signs of wear.nnhe character is skilled in Robotics, Computers, and Cybernetics.nThese skills are represented visually through specific details:n- Robotics → servo tool belt and mechanical armsn- Computers → holographic UI projectionsn- Cybernetics → cranial ports and visible implantsnn(Holding Encrypted ID Chip:1.8), (Distinctive Feature: holographic eye:1.6).nThese must be clearly visible and easily identifiable.nnThe background is neon-lit maintenance hangar, detailed yet subtle, adding depth without distracting from the character,nnBust shot, centered composition, clean silhouette, no extra text or logos, ZIP2D,  CXL-Mech",
                "Hires CFG Scale": 7,
                "Hires upscale": 2,
                "Hires steps": 15,
                "Hires upscaler": "ESRGAN_4x",
                "TI hashes": "ZIP2D: 353cf9be0675, CXL-Mech: 000b204acc87, ZIP2D: 353cf9be0675, CXL-Mech: 000b204acc87, CXL-Mech: 000b204acc87, CXL-Mech: 000b204acc87, CXL-Mech: 000b204acc87, CXL-Mech: 000b204acc87, CXL-Mech: 000b204acc87, CXL-Mech: 000b204acc87, CXL-Mech: 000b204acc87, CXL-Mech: 000b204acc87, CXL-Mech: 000b204acc87, CXL-Mech: 000b204acc87, CXL-Mech: 000b204acc87, CXL-Mech: 000b204acc87, CXL-Mech: 000b204acc87, CXL-Mech: 000b204acc87, zip2d_neg: a764ec702efd, zip2d_neg: a764ec702efd, CXL-Mech: 000b204acc87, CXL-Mech: 000b204acc87, zip2d_neg: a764ec702efd, zip2d_neg: a764ec702efd",
                "Pad conds": "True",
                "Version": "f1.0.0v2-v1.10.1RC-latest-2454-g9086b215",
                "Source Identifier": "Stable Diffusion web UI",
                "ControlNet 0": "Module: CLIP-ViT-H (IPAdapter), Model: ip-adapter-plus_sdxl_vit-h [bc449f62], Weight: 0.35, Resize Mode: ResizeMode.INNER_FIT, Processor Res: 0.5, Threshold A: 0.5, Threshold B: 0.5, Guidance Start: 0.3, Guidance End: 0.7, Pixel Perfect: False, Control Mode: ControlMode.BALANCED, Hr Option: HiResFixOption.BOTH",
                "ControlNet 1": "Module: CLIP-ViT-H (IPAdapter), Model: ip-adapter-plus-face_sdxl_vit-h [368cf551], Weight: 1, Resize Mode: ResizeMode.INNER_FIT, Processor Res: 0.5, Threshold A: 0.5, Threshold B: 0.5, Guidance Start: 0.1, Guidance End: 0.9, Pixel Perfect: False, Control Mode: ControlMode.BALANCED, Hr Option: HiResFixOption.BOTH",
                "prompt": "A vibrant cyberpunk illustration, comic-book/anime hybrid, bold colors, defined line art, high-contrast neon lighting.\nA ((robot like, non human)) Mothership RPG Android character, retro model, signs of wear.\nhe character is skilled in Robotics, Computers, and Cybernetics.\nThese skills are represented visually through specific details:\n- Robotics → servo tool belt and mechanical arms\n- Computers → holographic UI projections\n- Cybernetics → cranial ports and visible implants\n(Holding Encrypted ID Chip:1.8), (Distinctive Feature: holographic eye:1.6).\nThese must be clearly visible and easily identifiable.\nThe background is industrial ship bay with mist, detailed yet subtle, adding depth without distracting from the character,\nBust shot, centered composition, clean silhouette, no extra text or logos, ZIP2D,  CXL-Mech",
                "negativePrompt": "Compression artifacts, bad art, worst quality, low quality, plastic, fake, bad limbs, conjoined, featureless, bad features, incorrect objects, watermark, ((signature):1.25), logo, zip2d_neg",
                "width": 832,
                "height": 832,
                "hashes": {
                    "model": "6330883d2c"
                },
                "resources": [
                    {
                        "type": "model",
                        "name": "artium_v20",
                        "hash": "6330883d2c"
                    }
                ]
            },
            "gen_info_raw": "A vibrant cyberpunk illustration, comic-book/anime hybrid, bold colors, defined line art, high-contrast neon lighting.\nA ((robot like, non human)) Mothership RPG Android character, retro model, signs of wear.\n\nhe character is skilled in Robotics, Computers, and Cybernetics.\nThese skills are represented visually through specific details:\n- Robotics → servo tool belt and mechanical arms\n- Computers → holographic UI projections\n- Cybernetics → cranial ports and visible implants\n\n(Holding Encrypted ID Chip:1.8), (Distinctive Feature: holographic eye:1.6).\nThese must be clearly visible and easily identifiable.\n\nThe background is industrial ship bay with mist, detailed yet subtle, adding depth without distracting from the character,\n\nBust shot, centered composition, clean silhouette, no extra text or logos, ZIP2D,  CXL-Mech\nNegative prompt: Compression artifacts, bad art, worst quality, low quality, plastic, fake, bad limbs, conjoined, featureless, bad features, incorrect objects, watermark, ((signature):1.25), logo, zip2d_neg\nSteps: 40, Sampler: DPM++ 2M, Schedule type: Karras, CFG scale: 7, Seed: 991220129, Size: 832x832, Model hash: 6330883d2c, Model: artium_v20, Denoising strength: 0.3, RNG: CPU, ControlNet 0: \"Module: CLIP-ViT-H (IPAdapter), Model: ip-adapter-plus_sdxl_vit-h [bc449f62], Weight: 0.35, Resize Mode: ResizeMode.INNER_FIT, Processor Res: 0.5, Threshold A: 0.5, Threshold B: 0.5, Guidance Start: 0.3, Guidance End: 0.7, Pixel Perfect: False, Control Mode: ControlMode.BALANCED, Hr Option: HiResFixOption.BOTH\", ControlNet 1: \"Module: CLIP-ViT-H (IPAdapter), Model: ip-adapter-plus-face_sdxl_vit-h [368cf551], Weight: 1, Resize Mode: ResizeMode.INNER_FIT, Processor Res: 0.5, Threshold A: 0.5, Threshold B: 0.5, Guidance Start: 0.1, Guidance End: 0.9, Pixel Perfect: False, Control Mode: ControlMode.BALANCED, Hr Option: HiResFixOption.BOTH\", Hires prompt: \"A vibrant cyberpunk illustration, comic-book/anime hybrid, bold colors, defined line art, high-contrast neon lighting.\\nA ((robot like, non human)) Mothership RPG Android character, retro model, signs of wear.\\n\\nhe character is skilled in Robotics, Computers, and Cybernetics.\\nThese skills are represented visually through specific details:\\n- Robotics → servo tool belt and mechanical arms\\n- Computers → holographic UI projections\\n- Cybernetics → cranial ports and visible implants\\n\\n(Holding Encrypted ID Chip:1.8), (Distinctive Feature: holographic eye:1.6).\\nThese must be clearly visible and easily identifiable.\\n\\nThe background is neon-lit maintenance hangar, detailed yet subtle, adding depth without distracting from the character,\\n\\nBust shot, centered composition, clean silhouette, no extra text or logos, ZIP2D,  CXL-Mech\", Hires CFG Scale: 7, Hires upscale: 2, Hires steps: 15, Hires upscaler: ESRGAN_4x, TI hashes: \"ZIP2D: 353cf9be0675, CXL-Mech: 000b204acc87, ZIP2D: 353cf9be0675, CXL-Mech: 000b204acc87, CXL-Mech: 000b204acc87, CXL-Mech: 000b204acc87, CXL-Mech: 000b204acc87, CXL-Mech: 000b204acc87, CXL-Mech: 000b204acc87, CXL-Mech: 000b204acc87, CXL-Mech: 000b204acc87, CXL-Mech: 000b204acc87, CXL-Mech: 000b204acc87, CXL-Mech: 000b204acc87, CXL-Mech: 000b204acc87, CXL-Mech: 000b204acc87, CXL-Mech: 000b204acc87, CXL-Mech: 000b204acc87, zip2d_neg: a764ec702efd, zip2d_neg: a764ec702efd, CXL-Mech: 000b204acc87, CXL-Mech: 000b204acc87, zip2d_neg: a764ec702efd, zip2d_neg: a764ec702efd\", Pad conds: True, Version: f1.0.0v2-v1.10.1RC-latest-2454-g9086b215, Source Identifier: Stable Diffusion web UI"
        },
        {
            "type": "file",
            "id": 136,
            "date": "2025-09-09 21:15:07",
            "created_date": "2025-09-09 21:15:07",
            "size": "2.85 MB",
            "is_under_scanned_path": true,
            "bytes": 2988124,
            "name": "00130-114750731.png",
            "fullpath": "/Users/pixelkaos/Library/Application Support/StabilityMatrix/Packages/Stable Diffusion WebUI reForge/outputs/txt2img-images/2025-09-09/00130-114750731.png",
            "gen_info_obj": {
                "steps": 40,
                "sampler": "DPM++ 2M",
                "Schedule type": "Karras",
                "cfgScale": 7,
                "seed": 114750731,
                "size": "832x832",
                "Model hash": "6330883d2c",
                "Model": "artium_v20",
                "Denoising strength": 0.3,
                "RNG": "CPU",
                "Hires CFG Scale": 7,
                "Hires upscale": 2,
                "Hires steps": 15,
                "Hires upscaler": "ESRGAN_4x",
                "TI hashes": "CXL-Mech: 000b204acc87, CXL-Mech: 000b204acc87, CXL-Mech: 000b204acc87, CXL-Mech: 000b204acc87, CXL-Mech: 000b204acc87, CXL-Mech: 000b204acc87, CXL-Mech: 000b204acc87, CXL-Mech: 000b204acc87, CXL-Mech: 000b204acc87, CXL-Mech: 000b204acc87, CXL-Mech: 000b204acc87, CXL-Mech: 000b204acc87, CXL-Mech: 000b204acc87, CXL-Mech: 000b204acc87, zip2d_neg: a764ec702efd, zip2d_neg: a764ec702efd, CXL-Mech: 000b204acc87, CXL-Mech: 000b204acc87, zip2d_neg: a764ec702efd, zip2d_neg: a764ec702efd",
                "Pad conds": "True",
                "Version": "f1.0.0v2-v1.10.1RC-latest-2454-g9086b215",
                "Source Identifier": "Stable Diffusion web UI",
                "ControlNet 0": "Module: CLIP-ViT-H (IPAdapter), Model: ip-adapter-plus_sdxl_vit-h [bc449f62], Weight: 0.35, Resize Mode: ResizeMode.INNER_FIT, Processor Res: 0.5, Threshold A: 0.5, Threshold B: 0.5, Guidance Start: 0.3, Guidance End: 0.7, Pixel Perfect: False, Control Mode: ControlMode.BALANCED, Hr Option: HiResFixOption.BOTH",
                "ControlNet 1": "Module: CLIP-ViT-H (IPAdapter), Model: ip-adapter-plus-face_sdxl_vit-h [368cf551], Weight: 1, Resize Mode: ResizeMode.INNER_FIT, Processor Res: 0.5, Threshold A: 0.5, Threshold B: 0.5, Guidance Start: 0.1, Guidance End: 0.9, Pixel Perfect: False, Control Mode: ControlMode.BALANCED, Hr Option: HiResFixOption.BOTH",
                "prompt": "A vibrant cyberpunk illustration, comic-book/anime hybrid, bold colors, defined line art, high-contrast neon lighting.\nA ((male)) Mothership RPG Android character, (hyper modern, new model:2.0).\nThe character is skilled in Robotics, Computers, and Cybernetics.\nThese skills are represented visually through specific details:\n- Robotics → servo tool belt and mechanical arms\n- Computers → holographic UI projections\n- Cybernetics → cranial ports and visible implants\n(Holding Synthetic Flower:1.8), (Distinctive Feature: visible servo joints:1.6).\nThese must be clearly visible and easily identifiable.\nThe background is BACKGROUND, detailed yet subtle, adding depth without distracting from the character.\nBust shot, centered composition, clean silhouette, no extra text or logos,  ZIP2D",
                "negativePrompt": "Compression artifacts, bad art, worst quality, low quality, plastic, fake, bad limbs, conjoined, featureless, bad features, incorrect objects, watermark, ((signature):1.25), logo, zip2d_neg",
                "width": 832,
                "height": 832,
                "hashes": {
                    "model": "6330883d2c"
                },
                "resources": [
                    {
                        "type": "model",
                        "name": "artium_v20",
                        "hash": "6330883d2c"
                    }
                ]
            },
            "gen_info_raw": "A vibrant cyberpunk illustration, comic-book/anime hybrid, bold colors, defined line art, high-contrast neon lighting.\nA ((male)) Mothership RPG Android character, (hyper modern, new model:2.0).\n\nThe character is skilled in Robotics, Computers, and Cybernetics.\nThese skills are represented visually through specific details:\n- Robotics → servo tool belt and mechanical arms\n- Computers → holographic UI projections\n- Cybernetics → cranial ports and visible implants\n\n(Holding Synthetic Flower:1.8), (Distinctive Feature: visible servo joints:1.6).\nThese must be clearly visible and easily identifiable.\n\nThe background is BACKGROUND, detailed yet subtle, adding depth without distracting from the character.\n\nBust shot, centered composition, clean silhouette, no extra text or logos,  ZIP2D\nNegative prompt: Compression artifacts, bad art, worst quality, low quality, plastic, fake, bad limbs, conjoined, featureless, bad features, incorrect objects, watermark, ((signature):1.25), logo, zip2d_neg\nSteps: 40, Sampler: DPM++ 2M, Schedule type: Karras, CFG scale: 7, Seed: 114750731, Size: 832x832, Model hash: 6330883d2c, Model: artium_v20, Denoising strength: 0.3, RNG: CPU, ControlNet 0: \"Module: CLIP-ViT-H (IPAdapter), Model: ip-adapter-plus_sdxl_vit-h [bc449f62], Weight: 0.35, Resize Mode: ResizeMode.INNER_FIT, Processor Res: 0.5, Threshold A: 0.5, Threshold B: 0.5, Guidance Start: 0.3, Guidance End: 0.7, Pixel Perfect: False, Control Mode: ControlMode.BALANCED, Hr Option: HiResFixOption.BOTH\", ControlNet 1: \"Module: CLIP-ViT-H (IPAdapter), Model: ip-adapter-plus-face_sdxl_vit-h [368cf551], Weight: 1, Resize Mode: ResizeMode.INNER_FIT, Processor Res: 0.5, Threshold A: 0.5, Threshold B: 0.5, Guidance Start: 0.1, Guidance End: 0.9, Pixel Perfect: False, Control Mode: ControlMode.BALANCED, Hr Option: HiResFixOption.BOTH\", Hires CFG Scale: 7, Hires upscale: 2, Hires steps: 15, Hires upscaler: ESRGAN_4x, TI hashes: \"CXL-Mech: 000b204acc87, CXL-Mech: 000b204acc87, CXL-Mech: 000b204acc87, CXL-Mech: 000b204acc87, CXL-Mech: 000b204acc87, CXL-Mech: 000b204acc87, CXL-Mech: 000b204acc87, CXL-Mech: 000b204acc87, CXL-Mech: 000b204acc87, CXL-Mech: 000b204acc87, CXL-Mech: 000b204acc87, CXL-Mech: 000b204acc87, CXL-Mech: 000b204acc87, CXL-Mech: 000b204acc87, zip2d_neg: a764ec702efd, zip2d_neg: a764ec702efd, CXL-Mech: 000b204acc87, CXL-Mech: 000b204acc87, zip2d_neg: a764ec702efd, zip2d_neg: a764ec702efd\", Pad conds: True, Version: f1.0.0v2-v1.10.1RC-latest-2454-g9086b215, Source Identifier: Stable Diffusion web UI"
        },
        {
            "type": "file",
            "id": 199,
            "date": "2025-09-09 21:07:30",
            "created_date": "2025-09-09 21:07:30",
            "size": "2.92 MB",
            "is_under_scanned_path": true,
            "bytes": 3060509,
            "name": "00129-114750730.png",
            "fullpath": "/Users/pixelkaos/Library/Application Support/StabilityMatrix/Packages/Stable Diffusion WebUI reForge/outputs/txt2img-images/2025-09-09/00129-114750730.png",
            "gen_info_obj": {
                "steps": 40,
                "sampler": "DPM++ 2M",
                "Schedule type": "Karras",
                "cfgScale": 7,
                "seed": 114750730,
                "size": "832x832",
                "Model hash": "6330883d2c",
                "Model": "artium_v20",
                "Denoising strength": 0.3,
                "RNG": "CPU",
                "Hires CFG Scale": 7,
                "Hires upscale": 2,
                "Hires steps": 15,
                "Hires upscaler": "ESRGAN_4x",
                "TI hashes": "ZIP2D: 353cf9be0675, ZIP2D: 353cf9be0675, CXL-Mech: 000b204acc87, CXL-Mech: 000b204acc87, CXL-Mech: 000b204acc87, CXL-Mech: 000b204acc87, CXL-Mech: 000b204acc87, CXL-Mech: 000b204acc87, CXL-Mech: 000b204acc87, CXL-Mech: 000b204acc87, CXL-Mech: 000b204acc87, CXL-Mech: 000b204acc87, CXL-Mech: 000b204acc87, CXL-Mech: 000b204acc87, CXL-Mech: 000b204acc87, CXL-Mech: 000b204acc87, zip2d_neg: a764ec702efd, zip2d_neg: a764ec702efd, CXL-Mech: 000b204acc87, CXL-Mech: 000b204acc87, zip2d_neg: a764ec702efd, zip2d_neg: a764ec702efd",
                "Pad conds": "True",
                "Version": "f1.0.0v2-v1.10.1RC-latest-2454-g9086b215",
                "Source Identifier": "Stable Diffusion web UI",
                "ControlNet 0": "Module: CLIP-ViT-H (IPAdapter), Model: ip-adapter-plus_sdxl_vit-h [bc449f62], Weight: 0.35, Resize Mode: ResizeMode.INNER_FIT, Processor Res: 0.5, Threshold A: 0.5, Threshold B: 0.5, Guidance Start: 0.3, Guidance End: 0.7, Pixel Perfect: False, Control Mode: ControlMode.BALANCED, Hr Option: HiResFixOption.BOTH",
                "ControlNet 1": "Module: CLIP-ViT-H (IPAdapter), Model: ip-adapter-plus-face_sdxl_vit-h [368cf551], Weight: 1, Resize Mode: ResizeMode.INNER_FIT, Processor Res: 0.5, Threshold A: 0.5, Threshold B: 0.5, Guidance Start: 0.1, Guidance End: 0.9, Pixel Perfect: False, Control Mode: ControlMode.BALANCED, Hr Option: HiResFixOption.BOTH",
                "prompt": "A vibrant cyberpunk illustration, comic-book/anime hybrid, bold colors, defined line art, high-contrast neon lighting.\nA ((male)) Mothership RPG Android character, (hyper modern, new model:2.0).\nThe character is skilled in Robotics, Computers, and Cybernetics.\nThese skills are represented visually through specific details:\n- Robotics → servo tool belt and mechanical arms\n- Computers → holographic UI projections\n- Cybernetics → cranial ports and visible implants\n(Holding Synthetic Flower:1.8), (Distinctive Feature: visible servo joints:1.6).\nThese must be clearly visible and easily identifiable.\nThe background is BACKGROUND, detailed yet subtle, adding depth without distracting from the character.\nBust shot, centered composition, clean silhouette, no extra text or logos,  ZIP2D",
                "negativePrompt": "Compression artifacts, bad art, worst quality, low quality, plastic, fake, bad limbs, conjoined, featureless, bad features, incorrect objects, watermark, ((signature):1.25), logo, zip2d_neg",
                "width": 832,
                "height": 832,
                "hashes": {
                    "model": "6330883d2c"
                },
                "resources": [
                    {
                        "type": "model",
                        "name": "artium_v20",
                        "hash": "6330883d2c"
                    }
                ]
            },
            "gen_info_raw": "A vibrant cyberpunk illustration, comic-book/anime hybrid, bold colors, defined line art, high-contrast neon lighting.\nA ((male)) Mothership RPG Android character, (hyper modern, new model:2.0).\n\nThe character is skilled in Robotics, Computers, and Cybernetics.\nThese skills are represented visually through specific details:\n- Robotics → servo tool belt and mechanical arms\n- Computers → holographic UI projections\n- Cybernetics → cranial ports and visible implants\n\n(Holding Synthetic Flower:1.8), (Distinctive Feature: visible servo joints:1.6).\nThese must be clearly visible and easily identifiable.\n\nThe background is BACKGROUND, detailed yet subtle, adding depth without distracting from the character.\n\nBust shot, centered composition, clean silhouette, no extra text or logos,  ZIP2D\nNegative prompt: Compression artifacts, bad art, worst quality, low quality, plastic, fake, bad limbs, conjoined, featureless, bad features, incorrect objects, watermark, ((signature):1.25), logo, zip2d_neg\nSteps: 40, Sampler: DPM++ 2M, Schedule type: Karras, CFG scale: 7, Seed: 114750730, Size: 832x832, Model hash: 6330883d2c, Model: artium_v20, Denoising strength: 0.3, RNG: CPU, ControlNet 0: \"Module: CLIP-ViT-H (IPAdapter), Model: ip-adapter-plus_sdxl_vit-h [bc449f62], Weight: 0.35, Resize Mode: ResizeMode.INNER_FIT, Processor Res: 0.5, Threshold A: 0.5, Threshold B: 0.5, Guidance Start: 0.3, Guidance End: 0.7, Pixel Perfect: False, Control Mode: ControlMode.BALANCED, Hr Option: HiResFixOption.BOTH\", ControlNet 1: \"Module: CLIP-ViT-H (IPAdapter), Model: ip-adapter-plus-face_sdxl_vit-h [368cf551], Weight: 1, Resize Mode: ResizeMode.INNER_FIT, Processor Res: 0.5, Threshold A: 0.5, Threshold B: 0.5, Guidance Start: 0.1, Guidance End: 0.9, Pixel Perfect: False, Control Mode: ControlMode.BALANCED, Hr Option: HiResFixOption.BOTH\", Hires CFG Scale: 7, Hires upscale: 2, Hires steps: 15, Hires upscaler: ESRGAN_4x, TI hashes: \"ZIP2D: 353cf9be0675, ZIP2D: 353cf9be0675, CXL-Mech: 000b204acc87, CXL-Mech: 000b204acc87, CXL-Mech: 000b204acc87, CXL-Mech: 000b204acc87, CXL-Mech: 000b204acc87, CXL-Mech: 000b204acc87, CXL-Mech: 000b204acc87, CXL-Mech: 000b204acc87, CXL-Mech: 000b204acc87, CXL-Mech: 000b204acc87, CXL-Mech: 000b204acc87, CXL-Mech: 000b204acc87, CXL-Mech: 000b204acc87, CXL-Mech: 000b204acc87, zip2d_neg: a764ec702efd, zip2d_neg: a764ec702efd, CXL-Mech: 000b204acc87, CXL-Mech: 000b204acc87, zip2d_neg: a764ec702efd, zip2d_neg: a764ec702efd\", Pad conds: True, Version: f1.0.0v2-v1.10.1RC-latest-2454-g9086b215, Source Identifier: Stable Diffusion web UI"
        },
        {
            "type": "file",
            "id": 188,
            "date": "2025-09-09 20:20:31",
            "created_date": "2025-09-09 20:20:31",
            "size": "3.10 MB",
            "is_under_scanned_path": true,
            "bytes": 3248541,
            "name": "00126-1697253923.png",
            "fullpath": "/Users/pixelkaos/Library/Application Support/StabilityMatrix/Packages/Stable Diffusion WebUI reForge/outputs/txt2img-images/2025-09-09/00126-1697253923.png",
            "gen_info_obj": {
                "steps": 40,
                "sampler": "DPM++ 2M",
                "Schedule type": "Karras",
                "cfgScale": 7,
                "seed": 1697253923,
                "size": "832x832",
                "Model hash": "6330883d2c",
                "Model": "artium_v20",
                "Denoising strength": 0.3,
                "RNG": "CPU",
                "Hires CFG Scale": 7,
                "Hires upscale": 2,
                "Hires steps": 15,
                "Hires upscaler": "ESRGAN_4x",
                "TI hashes": "CXL-Mech: 000b204acc87, CXL-Mech: 000b204acc87, CXL-Mech: 000b204acc87, CXL-Mech: 000b204acc87, CXL-Mech: 000b204acc87, CXL-Mech: 000b204acc87, CXL-Mech: 000b204acc87, CXL-Mech: 000b204acc87, CXL-Mech: 000b204acc87, CXL-Mech: 000b204acc87, CXL-Mech: 000b204acc87, CXL-Mech: 000b204acc87, CXL-Mech: 000b204acc87, CXL-Mech: 000b204acc87, zip2d_neg: a764ec702efd, zip2d_neg: a764ec702efd, CXL-Mech: 000b204acc87, CXL-Mech: 000b204acc87, zip2d_neg: a764ec702efd, zip2d_neg: a764ec702efd",
                "Pad conds": "True",
                "Version": "f1.0.0v2-v1.10.1RC-latest-2454-g9086b215",
                "Source Identifier": "Stable Diffusion web UI",
                "ControlNet 0": "Module: CLIP-ViT-H (IPAdapter), Model: ip-adapter-plus_sdxl_vit-h [bc449f62], Weight: 0.35, Resize Mode: ResizeMode.INNER_FIT, Processor Res: 0.5, Threshold A: 0.5, Threshold B: 0.5, Guidance Start: 0.3, Guidance End: 0.7, Pixel Perfect: False, Control Mode: ControlMode.BALANCED, Hr Option: HiResFixOption.BOTH",
                "ControlNet 1": "Module: CLIP-ViT-H (IPAdapter), Model: ip-adapter-plus-face_sdxl_vit-h [368cf551], Weight: 1, Resize Mode: ResizeMode.INNER_FIT, Processor Res: 0.5, Threshold A: 0.5, Threshold B: 0.5, Guidance Start: 0.1, Guidance End: 0.9, Pixel Perfect: False, Control Mode: ControlMode.BALANCED, Hr Option: HiResFixOption.BOTH",
                "prompt": "A vibrant cyberpunk illustration, comic-book/anime hybrid, bold colors, defined line art, high-contrast neon lighting.\nA male Mothership RPG Android character, (retro model, signs of repair:2.0).\nThe character is skilled in Robotics, Computers, and Cybernetics.\nThese skills are represented visually through specific details:\n- Robotics → servo tool belt and mechanical arms\n- Computers → holographic UI projections\n- Cybernetics → cranial ports and visible implants\n(Holding Data Crystal:1.8), (Distinctive Feature: sleek metallic skull plate:1.6).\nThese must be clearly visible and easily identifiable.\nThe background is BACKGROUND, detailed yet subtle, adding depth without distracting from the character.\nBust shot, centered composition, clean silhouette, no extra text or logos,  CXL-Mech,  ZIP2D",
                "negativePrompt": "Compression artifacts, bad art, worst quality, low quality, plastic, fake, bad limbs, conjoined, featureless, bad features, incorrect objects, watermark, ((signature):1.25), logo, zip2d_neg",
                "width": 832,
                "height": 832,
                "hashes": {
                    "model": "6330883d2c"
                },
                "resources": [
                    {
                        "type": "model",
                        "name": "artium_v20",
                        "hash": "6330883d2c"
                    }
                ]
            },
            "gen_info_raw": "A vibrant cyberpunk illustration, comic-book/anime hybrid, bold colors, defined line art, high-contrast neon lighting.\nA male Mothership RPG Android character, (retro model, signs of repair:2.0).\n\nThe character is skilled in Robotics, Computers, and Cybernetics.\nThese skills are represented visually through specific details:\n- Robotics → servo tool belt and mechanical arms\n- Computers → holographic UI projections\n- Cybernetics → cranial ports and visible implants\n\n(Holding Data Crystal:1.8), (Distinctive Feature: sleek metallic skull plate:1.6).\nThese must be clearly visible and easily identifiable.\n\nThe background is BACKGROUND, detailed yet subtle, adding depth without distracting from the character.\n\nBust shot, centered composition, clean silhouette, no extra text or logos,  CXL-Mech,  ZIP2D\nNegative prompt: Compression artifacts, bad art, worst quality, low quality, plastic, fake, bad limbs, conjoined, featureless, bad features, incorrect objects, watermark, ((signature):1.25), logo, zip2d_neg\nSteps: 40, Sampler: DPM++ 2M, Schedule type: Karras, CFG scale: 7, Seed: 1697253923, Size: 832x832, Model hash: 6330883d2c, Model: artium_v20, Denoising strength: 0.3, RNG: CPU, ControlNet 0: \"Module: CLIP-ViT-H (IPAdapter), Model: ip-adapter-plus_sdxl_vit-h [bc449f62], Weight: 0.35, Resize Mode: ResizeMode.INNER_FIT, Processor Res: 0.5, Threshold A: 0.5, Threshold B: 0.5, Guidance Start: 0.3, Guidance End: 0.7, Pixel Perfect: False, Control Mode: ControlMode.BALANCED, Hr Option: HiResFixOption.BOTH\", ControlNet 1: \"Module: CLIP-ViT-H (IPAdapter), Model: ip-adapter-plus-face_sdxl_vit-h [368cf551], Weight: 1, Resize Mode: ResizeMode.INNER_FIT, Processor Res: 0.5, Threshold A: 0.5, Threshold B: 0.5, Guidance Start: 0.1, Guidance End: 0.9, Pixel Perfect: False, Control Mode: ControlMode.BALANCED, Hr Option: HiResFixOption.BOTH\", Hires CFG Scale: 7, Hires upscale: 2, Hires steps: 15, Hires upscaler: ESRGAN_4x, TI hashes: \"CXL-Mech: 000b204acc87, CXL-Mech: 000b204acc87, CXL-Mech: 000b204acc87, CXL-Mech: 000b204acc87, CXL-Mech: 000b204acc87, CXL-Mech: 000b204acc87, CXL-Mech: 000b204acc87, CXL-Mech: 000b204acc87, CXL-Mech: 000b204acc87, CXL-Mech: 000b204acc87, CXL-Mech: 000b204acc87, CXL-Mech: 000b204acc87, CXL-Mech: 000b204acc87, CXL-Mech: 000b204acc87, zip2d_neg: a764ec702efd, zip2d_neg: a764ec702efd, CXL-Mech: 000b204acc87, CXL-Mech: 000b204acc87, zip2d_neg: a764ec702efd, zip2d_neg: a764ec702efd\", Pad conds: True, Version: f1.0.0v2-v1.10.1RC-latest-2454-g9086b215, Source Identifier: Stable Diffusion web UI"
        },
        {
            "type": "file",
            "id": 150,
            "date": "2025-09-09 20:13:00",
            "created_date": "2025-09-09 20:13:00",
            "size": "2.97 MB",
            "is_under_scanned_path": true,
            "bytes": 3118795,
            "name": "00125-1697253922.png",
            "fullpath": "/Users/pixelkaos/Library/Application Support/StabilityMatrix/Packages/Stable Diffusion WebUI reForge/outputs/txt2img-images/2025-09-09/00125-1697253922.png",
            "gen_info_obj": {
                "steps": 40,
                "sampler": "DPM++ 2M",
                "Schedule type": "Karras",
                "cfgScale": 7,
                "seed": 1697253922,
                "size": "832x832",
                "Model hash": "6330883d2c",
                "Model": "artium_v20",
                "Denoising strength": 0.3,
                "RNG": "CPU",
                "Hires CFG Scale": 7,
                "Hires upscale": 2,
                "Hires steps": 15,
                "Hires upscaler": "ESRGAN_4x",
                "TI hashes": "CXL-Mech: 000b204acc87, ZIP2D: 353cf9be0675, CXL-Mech: 000b204acc87, ZIP2D: 353cf9be0675, CXL-Mech: 000b204acc87, CXL-Mech: 000b204acc87, CXL-Mech: 000b204acc87, CXL-Mech: 000b204acc87, CXL-Mech: 000b204acc87, CXL-Mech: 000b204acc87, CXL-Mech: 000b204acc87, CXL-Mech: 000b204acc87, CXL-Mech: 000b204acc87, CXL-Mech: 000b204acc87, CXL-Mech: 000b204acc87, CXL-Mech: 000b204acc87, CXL-Mech: 000b204acc87, CXL-Mech: 000b204acc87, zip2d_neg: a764ec702efd, zip2d_neg: a764ec702efd, CXL-Mech: 000b204acc87, CXL-Mech: 000b204acc87, zip2d_neg: a764ec702efd, zip2d_neg: a764ec702efd",
                "Pad conds": "True",
                "Version": "f1.0.0v2-v1.10.1RC-latest-2454-g9086b215",
                "Source Identifier": "Stable Diffusion web UI",
                "ControlNet 0": "Module: CLIP-ViT-H (IPAdapter), Model: ip-adapter-plus_sdxl_vit-h [bc449f62], Weight: 0.35, Resize Mode: ResizeMode.INNER_FIT, Processor Res: 0.5, Threshold A: 0.5, Threshold B: 0.5, Guidance Start: 0.3, Guidance End: 0.7, Pixel Perfect: False, Control Mode: ControlMode.BALANCED, Hr Option: HiResFixOption.BOTH",
                "ControlNet 1": "Module: CLIP-ViT-H (IPAdapter), Model: ip-adapter-plus-face_sdxl_vit-h [368cf551], Weight: 1, Resize Mode: ResizeMode.INNER_FIT, Processor Res: 0.5, Threshold A: 0.5, Threshold B: 0.5, Guidance Start: 0.1, Guidance End: 0.9, Pixel Perfect: False, Control Mode: ControlMode.BALANCED, Hr Option: HiResFixOption.BOTH",
                "prompt": "A vibrant cyberpunk illustration, comic-book/anime hybrid, bold colors, defined line art, high-contrast neon lighting.\nA male Mothership RPG Android character, (retro model, signs of repair:2.0).\nThe character is skilled in Robotics, Computers, and Cybernetics.\nThese skills are represented visually through specific details:\n- Robotics → servo tool belt and mechanical arms\n- Computers → holographic UI projections\n- Cybernetics → cranial ports and visible implants\n(Holding Data Crystal:1.8), (Distinctive Feature: sleek metallic skull plate:1.6).\nThese must be clearly visible and easily identifiable.\nThe background is BACKGROUND, detailed yet subtle, adding depth without distracting from the character.\nBust shot, centered composition, clean silhouette, no extra text or logos,  CXL-Mech,  ZIP2D",
                "negativePrompt": "Compression artifacts, bad art, worst quality, low quality, plastic, fake, bad limbs, conjoined, featureless, bad features, incorrect objects, watermark, ((signature):1.25), logo, zip2d_neg",
                "width": 832,
                "height": 832,
                "hashes": {
                    "model": "6330883d2c"
                },
                "resources": [
                    {
                        "type": "model",
                        "name": "artium_v20",
                        "hash": "6330883d2c"
                    }
                ]
            },
            "gen_info_raw": "A vibrant cyberpunk illustration, comic-book/anime hybrid, bold colors, defined line art, high-contrast neon lighting.\nA male Mothership RPG Android character, (retro model, signs of repair:2.0).\n\nThe character is skilled in Robotics, Computers, and Cybernetics.\nThese skills are represented visually through specific details:\n- Robotics → servo tool belt and mechanical arms\n- Computers → holographic UI projections\n- Cybernetics → cranial ports and visible implants\n\n(Holding Data Crystal:1.8), (Distinctive Feature: sleek metallic skull plate:1.6).\nThese must be clearly visible and easily identifiable.\n\nThe background is BACKGROUND, detailed yet subtle, adding depth without distracting from the character.\n\nBust shot, centered composition, clean silhouette, no extra text or logos,  CXL-Mech,  ZIP2D\nNegative prompt: Compression artifacts, bad art, worst quality, low quality, plastic, fake, bad limbs, conjoined, featureless, bad features, incorrect objects, watermark, ((signature):1.25), logo, zip2d_neg\nSteps: 40, Sampler: DPM++ 2M, Schedule type: Karras, CFG scale: 7, Seed: 1697253922, Size: 832x832, Model hash: 6330883d2c, Model: artium_v20, Denoising strength: 0.3, RNG: CPU, ControlNet 0: \"Module: CLIP-ViT-H (IPAdapter), Model: ip-adapter-plus_sdxl_vit-h [bc449f62], Weight: 0.35, Resize Mode: ResizeMode.INNER_FIT, Processor Res: 0.5, Threshold A: 0.5, Threshold B: 0.5, Guidance Start: 0.3, Guidance End: 0.7, Pixel Perfect: False, Control Mode: ControlMode.BALANCED, Hr Option: HiResFixOption.BOTH\", ControlNet 1: \"Module: CLIP-ViT-H (IPAdapter), Model: ip-adapter-plus-face_sdxl_vit-h [368cf551], Weight: 1, Resize Mode: ResizeMode.INNER_FIT, Processor Res: 0.5, Threshold A: 0.5, Threshold B: 0.5, Guidance Start: 0.1, Guidance End: 0.9, Pixel Perfect: False, Control Mode: ControlMode.BALANCED, Hr Option: HiResFixOption.BOTH\", Hires CFG Scale: 7, Hires upscale: 2, Hires steps: 15, Hires upscaler: ESRGAN_4x, TI hashes: \"CXL-Mech: 000b204acc87, ZIP2D: 353cf9be0675, CXL-Mech: 000b204acc87, ZIP2D: 353cf9be0675, CXL-Mech: 000b204acc87, CXL-Mech: 000b204acc87, CXL-Mech: 000b204acc87, CXL-Mech: 000b204acc87, CXL-Mech: 000b204acc87, CXL-Mech: 000b204acc87, CXL-Mech: 000b204acc87, CXL-Mech: 000b204acc87, CXL-Mech: 000b204acc87, CXL-Mech: 000b204acc87, CXL-Mech: 000b204acc87, CXL-Mech: 000b204acc87, CXL-Mech: 000b204acc87, CXL-Mech: 000b204acc87, zip2d_neg: a764ec702efd, zip2d_neg: a764ec702efd, CXL-Mech: 000b204acc87, CXL-Mech: 000b204acc87, zip2d_neg: a764ec702efd, zip2d_neg: a764ec702efd\", Pad conds: True, Version: f1.0.0v2-v1.10.1RC-latest-2454-g9086b215, Source Identifier: Stable Diffusion web UI"
        },
        {
            "type": "file",
            "id": 57,
            "date": "2025-09-09 19:25:54",
            "created_date": "2025-09-09 19:25:54",
            "size": "2.77 MB",
            "is_under_scanned_path": true,
            "bytes": 2905446,
            "name": "00119-3714319404.png",
            "fullpath": "/Users/pixelkaos/Library/Application Support/StabilityMatrix/Packages/Stable Diffusion WebUI reForge/outputs/txt2img-images/2025-09-09/00119-3714319404.png",
            "gen_info_obj": {
                "steps": 40,
                "sampler": "DPM++ 2M",
                "Schedule type": "Karras",
                "cfgScale": 7,
                "seed": 3714319404,
                "size": "832x832",
                "Model hash": "6330883d2c",
                "Model": "artium_v20",
                "Denoising strength": 0.3,
                "RNG": "CPU",
                "Hires CFG Scale": 7,
                "Hires upscale": 2,
                "Hires steps": 15,
                "Hires upscaler": "ESRGAN_4x",
                "TI hashes": "CXL-Mech: 000b204acc87, ZIP2D: 353cf9be0675, CXL-Mech: 000b204acc87, ZIP2D: 353cf9be0675, CXL-Mech: 000b204acc87, CXL-Mech: 000b204acc87, CXL-Mech: 000b204acc87, CXL-Mech: 000b204acc87, CXL-Mech: 000b204acc87, CXL-Mech: 000b204acc87, CXL-Mech: 000b204acc87, CXL-Mech: 000b204acc87, CXL-Mech: 000b204acc87, CXL-Mech: 000b204acc87, CXL-Mech: 000b204acc87, CXL-Mech: 000b204acc87, CXL-Mech: 000b204acc87, CXL-Mech: 000b204acc87, zip2d_neg: a764ec702efd, zip2d_neg: a764ec702efd, CXL-Mech: 000b204acc87, CXL-Mech: 000b204acc87, zip2d_neg: a764ec702efd, zip2d_neg: a764ec702efd",
                "Pad conds": "True",
                "Version": "f1.0.0v2-v1.10.1RC-latest-2454-g9086b215",
                "Source Identifier": "Stable Diffusion web UI",
                "ControlNet 0": "Module: CLIP-ViT-H (IPAdapter), Model: ip-adapter-plus_sdxl_vit-h [bc449f62], Weight: 0.35, Resize Mode: ResizeMode.INNER_FIT, Processor Res: 0.5, Threshold A: 0.5, Threshold B: 0.5, Guidance Start: 0.3, Guidance End: 0.7, Pixel Perfect: False, Control Mode: ControlMode.BALANCED, Hr Option: HiResFixOption.BOTH",
                "ControlNet 1": "Module: CLIP-ViT-H (IPAdapter), Model: ip-adapter-plus-face_sdxl_vit-h [368cf551], Weight: 1, Resize Mode: ResizeMode.INNER_FIT, Processor Res: 0.5, Threshold A: 0.5, Threshold B: 0.5, Guidance Start: 0.1, Guidance End: 0.9, Pixel Perfect: False, Control Mode: ControlMode.BALANCED, Hr Option: HiResFixOption.BOTH",
                "prompt": "A vibrant cyberpunk illustration, comic-book/anime hybrid, bold colors, defined line art, high-contrast neon lighting.\nA Mothership RPG Android character, (brand new, hyper modern:2.0).\nThe character is skilled in Robotics, Computers, and Cybernetics.\nThese skills are represented visually through specific details:\n- Robotics → servo tool belt and mechanical arms\n- Computers → holographic UI projections\n- Cybernetics → cranial ports and visible implants\n(Holding Encrypted ID Chip:1.8), (Distinctive Feature: holographic eye:1.6).\nThese must be clearly visible and easily identifiable.\nThe background is BACKGROUND, detailed yet subtle, adding depth without distracting from the character.\nBust shot, centered composition, clean silhouette, no extra text or logos,  CXL-Mech,  ZIP2D",
                "negativePrompt": "Compression artifacts, bad art, worst quality, low quality, plastic, fake, bad limbs, conjoined, featureless, bad features, incorrect objects, watermark, ((signature):1.25), logo, zip2d_neg",
                "width": 832,
                "height": 832,
                "hashes": {
                    "model": "6330883d2c"
                },
                "resources": [
                    {
                        "type": "model",
                        "name": "artium_v20",
                        "hash": "6330883d2c"
                    }
                ]
            },
            "gen_info_raw": "A vibrant cyberpunk illustration, comic-book/anime hybrid, bold colors, defined line art, high-contrast neon lighting.\nA Mothership RPG Android character, (brand new, hyper modern:2.0).\n\nThe character is skilled in Robotics, Computers, and Cybernetics.\nThese skills are represented visually through specific details:\n- Robotics → servo tool belt and mechanical arms\n- Computers → holographic UI projections\n- Cybernetics → cranial ports and visible implants\n\n(Holding Encrypted ID Chip:1.8), (Distinctive Feature: holographic eye:1.6).\nThese must be clearly visible and easily identifiable.\n\nThe background is BACKGROUND, detailed yet subtle, adding depth without distracting from the character.\n\nBust shot, centered composition, clean silhouette, no extra text or logos,  CXL-Mech,  ZIP2D\nNegative prompt: Compression artifacts, bad art, worst quality, low quality, plastic, fake, bad limbs, conjoined, featureless, bad features, incorrect objects, watermark, ((signature):1.25), logo, zip2d_neg\nSteps: 40, Sampler: DPM++ 2M, Schedule type: Karras, CFG scale: 7, Seed: 3714319404, Size: 832x832, Model hash: 6330883d2c, Model: artium_v20, Denoising strength: 0.3, RNG: CPU, ControlNet 0: \"Module: CLIP-ViT-H (IPAdapter), Model: ip-adapter-plus_sdxl_vit-h [bc449f62], Weight: 0.35, Resize Mode: ResizeMode.INNER_FIT, Processor Res: 0.5, Threshold A: 0.5, Threshold B: 0.5, Guidance Start: 0.3, Guidance End: 0.7, Pixel Perfect: False, Control Mode: ControlMode.BALANCED, Hr Option: HiResFixOption.BOTH\", ControlNet 1: \"Module: CLIP-ViT-H (IPAdapter), Model: ip-adapter-plus-face_sdxl_vit-h [368cf551], Weight: 1, Resize Mode: ResizeMode.INNER_FIT, Processor Res: 0.5, Threshold A: 0.5, Threshold B: 0.5, Guidance Start: 0.1, Guidance End: 0.9, Pixel Perfect: False, Control Mode: ControlMode.BALANCED, Hr Option: HiResFixOption.BOTH\", Hires CFG Scale: 7, Hires upscale: 2, Hires steps: 15, Hires upscaler: ESRGAN_4x, TI hashes: \"CXL-Mech: 000b204acc87, ZIP2D: 353cf9be0675, CXL-Mech: 000b204acc87, ZIP2D: 353cf9be0675, CXL-Mech: 000b204acc87, CXL-Mech: 000b204acc87, CXL-Mech: 000b204acc87, CXL-Mech: 000b204acc87, CXL-Mech: 000b204acc87, CXL-Mech: 000b204acc87, CXL-Mech: 000b204acc87, CXL-Mech: 000b204acc87, CXL-Mech: 000b204acc87, CXL-Mech: 000b204acc87, CXL-Mech: 000b204acc87, CXL-Mech: 000b204acc87, CXL-Mech: 000b204acc87, CXL-Mech: 000b204acc87, zip2d_neg: a764ec702efd, zip2d_neg: a764ec702efd, CXL-Mech: 000b204acc87, CXL-Mech: 000b204acc87, zip2d_neg: a764ec702efd, zip2d_neg: a764ec702efd\", Pad conds: True, Version: f1.0.0v2-v1.10.1RC-latest-2454-g9086b215, Source Identifier: Stable Diffusion web UI"
        }
    ]
}