{
    "files": [
        {
            "type": "file",
            "id": 1037,
            "date": "2025-09-10 13:13:10",
            "created_date": "2025-09-10 13:13:10",
            "size": "2.89 MB",
            "is_under_scanned_path": true,
            "bytes": 3032311,
            "name": "00028-3728786089.png",
            "fullpath": "/Users/pixelkaos/Library/Application Support/StabilityMatrix/Packages/Stable Diffusion WebUI reForge/outputs/txt2img-images/2025-09-10/00028-3728786089.png",
            "gen_info_obj": {
                "steps": 40,
                "sampler": "DPM++ 2M",
                "Schedule type": "Karras",
                "cfgScale": 7,
                "seed": 3728786089,
                "size": "832x832",
                "Model hash": "6330883d2c",
                "Model": "artium_v20",
                "Denoising strength": 0.3,
                "RNG": "CPU",
                "Hires CFG Scale": 7,
                "Hires upscale": 2,
                "Hires steps": 15,
                "Hires upscaler": "ESRGAN_4x",
                "TI hashes": "ZIP2D: 353cf9be0675, CXL-Mech: 000b204acc87, ZIP2D: 353cf9be0675, CXL-Mech: 000b204acc87, CXL-Mech: 000b204acc87, CXL-Mech: 000b204acc87, CXL-Mech: 000b204acc87, CXL-Mech: 000b204acc87, CXL-Mech: 000b204acc87, CXL-Mech: 000b204acc87, CXL-Mech: 000b204acc87, CXL-Mech: 000b204acc87, CXL-Mech: 000b204acc87, CXL-Mech: 000b204acc87, CXL-Mech: 000b204acc87, CXL-Mech: 000b204acc87, CXL-Mech: 000b204acc87, CXL-Mech: 000b204acc87, zip2d_neg: a764ec702efd, zip2d_neg: a764ec702efd, CXL-Mech: 000b204acc87, CXL-Mech: 000b204acc87, zip2d_neg: a764ec702efd, zip2d_neg: a764ec702efd",
                "Pad conds": "True",
                "Version": "f1.0.0v2-v1.10.1RC-latest-2454-g9086b215",
                "Source Identifier": "Stable Diffusion web UI",
                "ControlNet 0": "Module: CLIP-ViT-H (IPAdapter), Model: ip-adapter-plus_sdxl_vit-h [bc449f62], Weight: 0.35, Resize Mode: ResizeMode.INNER_FIT, Processor Res: 0.5, Threshold A: 0.5, Threshold B: 0.5, Guidance Start: 0.3, Guidance End: 0.7, Pixel Perfect: False, Control Mode: ControlMode.BALANCED, Hr Option: HiResFixOption.BOTH",
                "ControlNet 1": "Module: CLIP-ViT-H (IPAdapter), Model: ip-adapter-plus-face_sdxl_vit-h [368cf551], Weight: 1, Resize Mode: ResizeMode.INNER_FIT, Processor Res: 0.5, Threshold A: 0.5, Threshold B: 0.5, Guidance Start: 0.1, Guidance End: 0.9, Pixel Perfect: False, Control Mode: ControlMode.BALANCED, Hr Option: HiResFixOption.BOTH",
                "prompt": "A vibrant cyberpunk illustration, comic-book/anime hybrid, bold colors, high-contrast neon lighting.\nA ((panda bear)) Mothership RPG Teamster character, defined line art, 42 years old.\nThe character is skilled in Industrial Equipment, Heavy Machinery, and Piloting.\nThese skills are represented visually through specific details:\n- Industrial Equipment → oil-stained gloves\n- Heavy Machinery → loader exo-frame parts\n- Piloting → flight harness and console wristband\n(wearing Safety Helmet:1.8), (Distinctive Feature: welding visor:1.6).\nThese must be clearly visible and easily identifiable.\nThe background is starship command deck with holographic displays, detailed yet subtle, adding depth without distracting from the character,\nBust shot, centered composition, clean silhouette, no extra text or logos, ZIP2D,  CXL-Mech",
                "negativePrompt": "Compression artifacts, bad art, worst quality, low quality, plastic, fake, bad limbs, conjoined, featureless, bad features, incorrect objects, watermark, ((signature):1.25), logo, zip2d_neg",
                "width": 832,
                "height": 832,
                "hashes": {
                    "model": "6330883d2c"
                },
                "resources": [
                    {
                        "type": "model",
                        "name": "artium_v20",
                        "hash": "6330883d2c"
                    }
                ]
            },
            "gen_info_raw": "A vibrant cyberpunk illustration, comic-book/anime hybrid, bold colors, high-contrast neon lighting.\nA ((panda bear)) Mothership RPG Teamster character, defined line art, 42 years old.\n\nThe character is skilled in Industrial Equipment, Heavy Machinery, and Piloting.\nThese skills are represented visually through specific details:\n- Industrial Equipment → oil-stained gloves\n- Heavy Machinery → loader exo-frame parts\n- Piloting → flight harness and console wristband\n\n(wearing Safety Helmet:1.8), (Distinctive Feature: welding visor:1.6).\nThese must be clearly visible and easily identifiable.\n\nThe background is starship command deck with holographic displays, detailed yet subtle, adding depth without distracting from the character,\n\nBust shot, centered composition, clean silhouette, no extra text or logos, ZIP2D,  CXL-Mech\nNegative prompt: Compression artifacts, bad art, worst quality, low quality, plastic, fake, bad limbs, conjoined, featureless, bad features, incorrect objects, watermark, ((signature):1.25), logo, zip2d_neg\nSteps: 40, Sampler: DPM++ 2M, Schedule type: Karras, CFG scale: 7, Seed: 3728786089, Size: 832x832, Model hash: 6330883d2c, Model: artium_v20, Denoising strength: 0.3, RNG: CPU, ControlNet 0: \"Module: CLIP-ViT-H (IPAdapter), Model: ip-adapter-plus_sdxl_vit-h [bc449f62], Weight: 0.35, Resize Mode: ResizeMode.INNER_FIT, Processor Res: 0.5, Threshold A: 0.5, Threshold B: 0.5, Guidance Start: 0.3, Guidance End: 0.7, Pixel Perfect: False, Control Mode: ControlMode.BALANCED, Hr Option: HiResFixOption.BOTH\", ControlNet 1: \"Module: CLIP-ViT-H (IPAdapter), Model: ip-adapter-plus-face_sdxl_vit-h [368cf551], Weight: 1, Resize Mode: ResizeMode.INNER_FIT, Processor Res: 0.5, Threshold A: 0.5, Threshold B: 0.5, Guidance Start: 0.1, Guidance End: 0.9, Pixel Perfect: False, Control Mode: ControlMode.BALANCED, Hr Option: HiResFixOption.BOTH\", Hires CFG Scale: 7, Hires upscale: 2, Hires steps: 15, Hires upscaler: ESRGAN_4x, TI hashes: \"ZIP2D: 353cf9be0675, CXL-Mech: 000b204acc87, ZIP2D: 353cf9be0675, CXL-Mech: 000b204acc87, CXL-Mech: 000b204acc87, CXL-Mech: 000b204acc87, CXL-Mech: 000b204acc87, CXL-Mech: 000b204acc87, CXL-Mech: 000b204acc87, CXL-Mech: 000b204acc87, CXL-Mech: 000b204acc87, CXL-Mech: 000b204acc87, CXL-Mech: 000b204acc87, CXL-Mech: 000b204acc87, CXL-Mech: 000b204acc87, CXL-Mech: 000b204acc87, CXL-Mech: 000b204acc87, CXL-Mech: 000b204acc87, zip2d_neg: a764ec702efd, zip2d_neg: a764ec702efd, CXL-Mech: 000b204acc87, CXL-Mech: 000b204acc87, zip2d_neg: a764ec702efd, zip2d_neg: a764ec702efd\", Pad conds: True, Version: f1.0.0v2-v1.10.1RC-latest-2454-g9086b215, Source Identifier: Stable Diffusion web UI"
        },
        {
            "type": "file",
            "id": 1035,
            "date": "2025-09-10 13:03:41",
            "created_date": "2025-09-10 13:03:41",
            "size": "2.85 MB",
            "is_under_scanned_path": true,
            "bytes": 2988578,
            "name": "00027-364986528.png",
            "fullpath": "/Users/pixelkaos/Library/Application Support/StabilityMatrix/Packages/Stable Diffusion WebUI reForge/outputs/txt2img-images/2025-09-10/00027-364986528.png",
            "gen_info_obj": {
                "steps": 40,
                "sampler": "DPM++ 2M",
                "Schedule type": "Karras",
                "cfgScale": 7,
                "seed": 364986528,
                "size": "832x832",
                "Model hash": "6330883d2c",
                "Model": "artium_v20",
                "Denoising strength": 0.3,
                "RNG": "CPU",
                "Hires prompt": "A vibrant cyberpunk illustration, comic-book/anime hybrid, bold colors, high-contrast neon lighting.nA ((Cat, Feline)) Mothership RPG Teamster character, defined line art, 22 years old.nnThe character is skilled in Industrial Equipment, Heavy Machinery, and Piloting.nThese skills are represented visually through specific details:n- Industrial Equipment → oil-stained glovesn- Heavy Machinery → loader exo-frame partsn- Piloting → flight harness and console wristbandnn(Holding Patchwork Toolbelt:1.8), (Distinctive Feature: grease-stained overalls:1.6).nThese must be clearly visible and easily identifiable.nnThe background is starship command deck with holographic displays, detailed yet subtle, adding depth without distracting from the character,nnBust shot, centered composition, clean silhouette, no extra text or logos, ZIP2D,  CXL-Mech",
                "Hires CFG Scale": 7,
                "Hires upscale": 2,
                "Hires steps": 15,
                "Hires upscaler": "ESRGAN_4x",
                "TI hashes": "ZIP2D: 353cf9be0675, CXL-Mech: 000b204acc87, ZIP2D: 353cf9be0675, CXL-Mech: 000b204acc87, CXL-Mech: 000b204acc87, CXL-Mech: 000b204acc87, CXL-Mech: 000b204acc87, CXL-Mech: 000b204acc87, CXL-Mech: 000b204acc87, CXL-Mech: 000b204acc87, CXL-Mech: 000b204acc87, CXL-Mech: 000b204acc87, CXL-Mech: 000b204acc87, CXL-Mech: 000b204acc87, CXL-Mech: 000b204acc87, CXL-Mech: 000b204acc87, CXL-Mech: 000b204acc87, CXL-Mech: 000b204acc87, zip2d_neg: a764ec702efd, zip2d_neg: a764ec702efd, CXL-Mech: 000b204acc87, CXL-Mech: 000b204acc87, zip2d_neg: a764ec702efd, zip2d_neg: a764ec702efd",
                "Pad conds": "True",
                "Version": "f1.0.0v2-v1.10.1RC-latest-2454-g9086b215",
                "Source Identifier": "Stable Diffusion web UI",
                "ControlNet 0": "Module: CLIP-ViT-H (IPAdapter), Model: ip-adapter-plus_sdxl_vit-h [bc449f62], Weight: 0.35, Resize Mode: ResizeMode.INNER_FIT, Processor Res: 0.5, Threshold A: 0.5, Threshold B: 0.5, Guidance Start: 0.3, Guidance End: 0.7, Pixel Perfect: False, Control Mode: ControlMode.BALANCED, Hr Option: HiResFixOption.BOTH",
                "ControlNet 1": "Module: CLIP-ViT-H (IPAdapter), Model: ip-adapter-plus-face_sdxl_vit-h [368cf551], Weight: 1, Resize Mode: ResizeMode.INNER_FIT, Processor Res: 0.5, Threshold A: 0.5, Threshold B: 0.5, Guidance Start: 0.1, Guidance End: 0.9, Pixel Perfect: False, Control Mode: ControlMode.BALANCED, Hr Option: HiResFixOption.BOTH",
                "prompt": "A vibrant cyberpunk illustration, comic-book/anime hybrid, bold colors, high-contrast neon lighting.\nA ((Cat, Feline)) Mothership RPG Teamster character, defined line art, 22 years old.\nThe character is skilled in Industrial Equipment, Heavy Machinery, and Piloting.\nThese skills are represented visually through specific details:\n- Industrial Equipment → oil-stained gloves\n- Heavy Machinery → loader exo-frame parts\n- Piloting → flight harness and console wristband\n(Holding Patchwork Toolbelt:1.8), (Distinctive Feature: grease-stained overalls:1.6).\nThese must be clearly visible and easily identifiable.\nThe background is neon-lit maintenance hangar, detailed yet subtle, adding depth without distracting from the character,\nBust shot, centered composition, clean silhouette, no extra text or logos, ZIP2D,  CXL-Mech",
                "negativePrompt": "Compression artifacts, bad art, worst quality, low quality, plastic, fake, bad limbs, conjoined, featureless, bad features, incorrect objects, watermark, ((signature):1.25), logo, zip2d_neg",
                "width": 832,
                "height": 832,
                "hashes": {
                    "model": "6330883d2c"
                },
                "resources": [
                    {
                        "type": "model",
                        "name": "artium_v20",
                        "hash": "6330883d2c"
                    }
                ]
            },
            "gen_info_raw": "A vibrant cyberpunk illustration, comic-book/anime hybrid, bold colors, high-contrast neon lighting.\nA ((Cat, Feline)) Mothership RPG Teamster character, defined line art, 22 years old.\n\nThe character is skilled in Industrial Equipment, Heavy Machinery, and Piloting.\nThese skills are represented visually through specific details:\n- Industrial Equipment → oil-stained gloves\n- Heavy Machinery → loader exo-frame parts\n- Piloting → flight harness and console wristband\n\n(Holding Patchwork Toolbelt:1.8), (Distinctive Feature: grease-stained overalls:1.6).\nThese must be clearly visible and easily identifiable.\n\nThe background is neon-lit maintenance hangar, detailed yet subtle, adding depth without distracting from the character,\n\nBust shot, centered composition, clean silhouette, no extra text or logos, ZIP2D,  CXL-Mech\nNegative prompt: Compression artifacts, bad art, worst quality, low quality, plastic, fake, bad limbs, conjoined, featureless, bad features, incorrect objects, watermark, ((signature):1.25), logo, zip2d_neg\nSteps: 40, Sampler: DPM++ 2M, Schedule type: Karras, CFG scale: 7, Seed: 364986528, Size: 832x832, Model hash: 6330883d2c, Model: artium_v20, Denoising strength: 0.3, RNG: CPU, ControlNet 0: \"Module: CLIP-ViT-H (IPAdapter), Model: ip-adapter-plus_sdxl_vit-h [bc449f62], Weight: 0.35, Resize Mode: ResizeMode.INNER_FIT, Processor Res: 0.5, Threshold A: 0.5, Threshold B: 0.5, Guidance Start: 0.3, Guidance End: 0.7, Pixel Perfect: False, Control Mode: ControlMode.BALANCED, Hr Option: HiResFixOption.BOTH\", ControlNet 1: \"Module: CLIP-ViT-H (IPAdapter), Model: ip-adapter-plus-face_sdxl_vit-h [368cf551], Weight: 1, Resize Mode: ResizeMode.INNER_FIT, Processor Res: 0.5, Threshold A: 0.5, Threshold B: 0.5, Guidance Start: 0.1, Guidance End: 0.9, Pixel Perfect: False, Control Mode: ControlMode.BALANCED, Hr Option: HiResFixOption.BOTH\", Hires prompt: \"A vibrant cyberpunk illustration, comic-book/anime hybrid, bold colors, high-contrast neon lighting.\\nA ((Cat, Feline)) Mothership RPG Teamster character, defined line art, 22 years old.\\n\\nThe character is skilled in Industrial Equipment, Heavy Machinery, and Piloting.\\nThese skills are represented visually through specific details:\\n- Industrial Equipment → oil-stained gloves\\n- Heavy Machinery → loader exo-frame parts\\n- Piloting → flight harness and console wristband\\n\\n(Holding Patchwork Toolbelt:1.8), (Distinctive Feature: grease-stained overalls:1.6).\\nThese must be clearly visible and easily identifiable.\\n\\nThe background is starship command deck with holographic displays, detailed yet subtle, adding depth without distracting from the character,\\n\\nBust shot, centered composition, clean silhouette, no extra text or logos, ZIP2D,  CXL-Mech\", Hires CFG Scale: 7, Hires upscale: 2, Hires steps: 15, Hires upscaler: ESRGAN_4x, TI hashes: \"ZIP2D: 353cf9be0675, CXL-Mech: 000b204acc87, ZIP2D: 353cf9be0675, CXL-Mech: 000b204acc87, CXL-Mech: 000b204acc87, CXL-Mech: 000b204acc87, CXL-Mech: 000b204acc87, CXL-Mech: 000b204acc87, CXL-Mech: 000b204acc87, CXL-Mech: 000b204acc87, CXL-Mech: 000b204acc87, CXL-Mech: 000b204acc87, CXL-Mech: 000b204acc87, CXL-Mech: 000b204acc87, CXL-Mech: 000b204acc87, CXL-Mech: 000b204acc87, CXL-Mech: 000b204acc87, CXL-Mech: 000b204acc87, zip2d_neg: a764ec702efd, zip2d_neg: a764ec702efd, CXL-Mech: 000b204acc87, CXL-Mech: 000b204acc87, zip2d_neg: a764ec702efd, zip2d_neg: a764ec702efd\", Pad conds: True, Version: f1.0.0v2-v1.10.1RC-latest-2454-g9086b215, Source Identifier: Stable Diffusion web UI"
        },
        {
            "type": "file",
            "id": 1036,
            "date": "2025-09-10 12:55:31",
            "created_date": "2025-09-10 12:55:31",
            "size": "2.89 MB",
            "is_under_scanned_path": true,
            "bytes": 3031274,
            "name": "00026-364986527.png",
            "fullpath": "/Users/pixelkaos/Library/Application Support/StabilityMatrix/Packages/Stable Diffusion WebUI reForge/outputs/txt2img-images/2025-09-10/00026-364986527.png",
            "gen_info_obj": {
                "steps": 40,
                "sampler": "DPM++ 2M",
                "Schedule type": "Karras",
                "cfgScale": 7,
                "seed": 364986527,
                "size": "832x832",
                "Model hash": "6330883d2c",
                "Model": "artium_v20",
                "Denoising strength": 0.3,
                "RNG": "CPU",
                "Hires CFG Scale": 7,
                "Hires upscale": 2,
                "Hires steps": 15,
                "Hires upscaler": "ESRGAN_4x",
                "TI hashes": "ZIP2D: 353cf9be0675, CXL-Mech: 000b204acc87, ZIP2D: 353cf9be0675, CXL-Mech: 000b204acc87, CXL-Mech: 000b204acc87, CXL-Mech: 000b204acc87, CXL-Mech: 000b204acc87, CXL-Mech: 000b204acc87, CXL-Mech: 000b204acc87, CXL-Mech: 000b204acc87, CXL-Mech: 000b204acc87, CXL-Mech: 000b204acc87, CXL-Mech: 000b204acc87, CXL-Mech: 000b204acc87, CXL-Mech: 000b204acc87, CXL-Mech: 000b204acc87, CXL-Mech: 000b204acc87, CXL-Mech: 000b204acc87, zip2d_neg: a764ec702efd, zip2d_neg: a764ec702efd, CXL-Mech: 000b204acc87, CXL-Mech: 000b204acc87, zip2d_neg: a764ec702efd, zip2d_neg: a764ec702efd",
                "Pad conds": "True",
                "Version": "f1.0.0v2-v1.10.1RC-latest-2454-g9086b215",
                "Source Identifier": "Stable Diffusion web UI",
                "ControlNet 0": "Module: CLIP-ViT-H (IPAdapter), Model: ip-adapter-plus_sdxl_vit-h [bc449f62], Weight: 0.35, Resize Mode: ResizeMode.INNER_FIT, Processor Res: 0.5, Threshold A: 0.5, Threshold B: 0.5, Guidance Start: 0.3, Guidance End: 0.7, Pixel Perfect: False, Control Mode: ControlMode.BALANCED, Hr Option: HiResFixOption.BOTH",
                "ControlNet 1": "Module: CLIP-ViT-H (IPAdapter), Model: ip-adapter-plus-face_sdxl_vit-h [368cf551], Weight: 1, Resize Mode: ResizeMode.INNER_FIT, Processor Res: 0.5, Threshold A: 0.5, Threshold B: 0.5, Guidance Start: 0.1, Guidance End: 0.9, Pixel Perfect: False, Control Mode: ControlMode.BALANCED, Hr Option: HiResFixOption.BOTH",
                "prompt": "A vibrant cyberpunk illustration, comic-book/anime hybrid, bold colors, high-contrast neon lighting.\nA ((Cat, Feline)) Mothership RPG Teamster character, defined line art, 22 years old.\nThe character is skilled in Industrial Equipment, Heavy Machinery, and Piloting.\nThese skills are represented visually through specific details:\n- Industrial Equipment → oil-stained gloves\n- Heavy Machinery → loader exo-frame parts\n- Piloting → flight harness and console wristband\n(Holding Patchwork Toolbelt:1.8), (Distinctive Feature: grease-stained overalls:1.6).\nThese must be clearly visible and easily identifiable.\nThe background is starship command deck with holographic displays, detailed yet subtle, adding depth without distracting from the character,\nBust shot, centered composition, clean silhouette, no extra text or logos, ZIP2D,  CXL-Mech",
                "negativePrompt": "Compression artifacts, bad art, worst quality, low quality, plastic, fake, bad limbs, conjoined, featureless, bad features, incorrect objects, watermark, ((signature):1.25), logo, zip2d_neg",
                "width": 832,
                "height": 832,
                "hashes": {
                    "model": "6330883d2c"
                },
                "resources": [
                    {
                        "type": "model",
                        "name": "artium_v20",
                        "hash": "6330883d2c"
                    }
                ]
            },
            "gen_info_raw": "A vibrant cyberpunk illustration, comic-book/anime hybrid, bold colors, high-contrast neon lighting.\nA ((Cat, Feline)) Mothership RPG Teamster character, defined line art, 22 years old.\n\nThe character is skilled in Industrial Equipment, Heavy Machinery, and Piloting.\nThese skills are represented visually through specific details:\n- Industrial Equipment → oil-stained gloves\n- Heavy Machinery → loader exo-frame parts\n- Piloting → flight harness and console wristband\n\n(Holding Patchwork Toolbelt:1.8), (Distinctive Feature: grease-stained overalls:1.6).\nThese must be clearly visible and easily identifiable.\n\nThe background is starship command deck with holographic displays, detailed yet subtle, adding depth without distracting from the character,\n\nBust shot, centered composition, clean silhouette, no extra text or logos, ZIP2D,  CXL-Mech\nNegative prompt: Compression artifacts, bad art, worst quality, low quality, plastic, fake, bad limbs, conjoined, featureless, bad features, incorrect objects, watermark, ((signature):1.25), logo, zip2d_neg\nSteps: 40, Sampler: DPM++ 2M, Schedule type: Karras, CFG scale: 7, Seed: 364986527, Size: 832x832, Model hash: 6330883d2c, Model: artium_v20, Denoising strength: 0.3, RNG: CPU, ControlNet 0: \"Module: CLIP-ViT-H (IPAdapter), Model: ip-adapter-plus_sdxl_vit-h [bc449f62], Weight: 0.35, Resize Mode: ResizeMode.INNER_FIT, Processor Res: 0.5, Threshold A: 0.5, Threshold B: 0.5, Guidance Start: 0.3, Guidance End: 0.7, Pixel Perfect: False, Control Mode: ControlMode.BALANCED, Hr Option: HiResFixOption.BOTH\", ControlNet 1: \"Module: CLIP-ViT-H (IPAdapter), Model: ip-adapter-plus-face_sdxl_vit-h [368cf551], Weight: 1, Resize Mode: ResizeMode.INNER_FIT, Processor Res: 0.5, Threshold A: 0.5, Threshold B: 0.5, Guidance Start: 0.1, Guidance End: 0.9, Pixel Perfect: False, Control Mode: ControlMode.BALANCED, Hr Option: HiResFixOption.BOTH\", Hires CFG Scale: 7, Hires upscale: 2, Hires steps: 15, Hires upscaler: ESRGAN_4x, TI hashes: \"ZIP2D: 353cf9be0675, CXL-Mech: 000b204acc87, ZIP2D: 353cf9be0675, CXL-Mech: 000b204acc87, CXL-Mech: 000b204acc87, CXL-Mech: 000b204acc87, CXL-Mech: 000b204acc87, CXL-Mech: 000b204acc87, CXL-Mech: 000b204acc87, CXL-Mech: 000b204acc87, CXL-Mech: 000b204acc87, CXL-Mech: 000b204acc87, CXL-Mech: 000b204acc87, CXL-Mech: 000b204acc87, CXL-Mech: 000b204acc87, CXL-Mech: 000b204acc87, CXL-Mech: 000b204acc87, CXL-Mech: 000b204acc87, zip2d_neg: a764ec702efd, zip2d_neg: a764ec702efd, CXL-Mech: 000b204acc87, CXL-Mech: 000b204acc87, zip2d_neg: a764ec702efd, zip2d_neg: a764ec702efd\", Pad conds: True, Version: f1.0.0v2-v1.10.1RC-latest-2454-g9086b215, Source Identifier: Stable Diffusion web UI"
        },
        {
            "type": "file",
            "id": 151,
            "date": "2025-09-09 22:40:20",
            "created_date": "2025-09-09 22:40:20",
            "size": "2.97 MB",
            "is_under_scanned_path": true,
            "bytes": 3113361,
            "name": "00140-2417230464.png",
            "fullpath": "/Users/pixelkaos/Library/Application Support/StabilityMatrix/Packages/Stable Diffusion WebUI reForge/outputs/txt2img-images/2025-09-09/00140-2417230464.png",
            "gen_info_obj": {
                "steps": 40,
                "sampler": "DPM++ 2M",
                "Schedule type": "Karras",
                "cfgScale": 7,
                "seed": 2417230464,
                "size": "832x832",
                "Model hash": "6330883d2c",
                "Model": "artium_v20",
                "Denoising strength": 0.3,
                "RNG": "CPU",
                "Hires prompt": "A vibrant cyberpunk illustration, comic-book/anime hybrid, bold colors, defined line art, high-contrast neon lighting.nA ((male)) Mothership RPG Teamster character, 29 years old.nnThe character is skilled in Industrial Equipment, Heavy Machinery, and Piloting.nThese skills are represented visually through specific details:n- Industrial Equipment → oil-stained glovesn- Heavy Machinery → loader exo-frame partsn- Piloting → flight harness and console wristbandnn(Holding Old Work Glove:1.8), (Distinctive Feature: prosthetic limb:1.6).nThese must be clearly visible and easily identifiable.nnThe background is industrial ship bay with mist, detailed yet subtle, adding depth without distracting from the character,nnBust shot, centered composition, clean silhouette, no extra text or logos, ZIP2D,  CXL-Mech",
                "Hires CFG Scale": 7,
                "Hires upscale": 2,
                "Hires steps": 15,
                "Hires upscaler": "ESRGAN_4x",
                "TI hashes": "ZIP2D: 353cf9be0675, CXL-Mech: 000b204acc87, ZIP2D: 353cf9be0675, CXL-Mech: 000b204acc87, CXL-Mech: 000b204acc87, CXL-Mech: 000b204acc87, CXL-Mech: 000b204acc87, CXL-Mech: 000b204acc87, CXL-Mech: 000b204acc87, CXL-Mech: 000b204acc87, CXL-Mech: 000b204acc87, CXL-Mech: 000b204acc87, CXL-Mech: 000b204acc87, CXL-Mech: 000b204acc87, CXL-Mech: 000b204acc87, CXL-Mech: 000b204acc87, CXL-Mech: 000b204acc87, CXL-Mech: 000b204acc87, zip2d_neg: a764ec702efd, zip2d_neg: a764ec702efd, CXL-Mech: 000b204acc87, CXL-Mech: 000b204acc87, zip2d_neg: a764ec702efd, zip2d_neg: a764ec702efd",
                "Pad conds": "True",
                "Version": "f1.0.0v2-v1.10.1RC-latest-2454-g9086b215",
                "Source Identifier": "Stable Diffusion web UI",
                "ControlNet 0": "Module: CLIP-ViT-H (IPAdapter), Model: ip-adapter-plus_sdxl_vit-h [bc449f62], Weight: 0.35, Resize Mode: ResizeMode.INNER_FIT, Processor Res: 0.5, Threshold A: 0.5, Threshold B: 0.5, Guidance Start: 0.3, Guidance End: 0.7, Pixel Perfect: False, Control Mode: ControlMode.BALANCED, Hr Option: HiResFixOption.BOTH",
                "ControlNet 1": "Module: CLIP-ViT-H (IPAdapter), Model: ip-adapter-plus-face_sdxl_vit-h [368cf551], Weight: 1, Resize Mode: ResizeMode.INNER_FIT, Processor Res: 0.5, Threshold A: 0.5, Threshold B: 0.5, Guidance Start: 0.1, Guidance End: 0.9, Pixel Perfect: False, Control Mode: ControlMode.BALANCED, Hr Option: HiResFixOption.BOTH",
                "prompt": "A vibrant cyberpunk illustration, comic-book/anime hybrid, bold colors, defined line art, high-contrast neon lighting.\nA ((male)) Mothership RPG Teamster character, 22 years old.\nThe character is skilled in Industrial Equipment, Heavy Machinery, and Piloting.\nThese skills are represented visually through specific details:\n- Industrial Equipment → oil-stained gloves\n- Heavy Machinery → loader exo-frame parts\n- Piloting → flight harness and console wristband\n(Holding Old Work Glove:1.8), (Distinctive Feature: prosthetic limb:1.6).\nThese must be clearly visible and easily identifiable.\nThe background is industrial ship bay with mist, detailed yet subtle, adding depth without distracting from the character,\nBust shot, centered composition, clean silhouette, no extra text or logos, ZIP2D,  CXL-Mech",
                "negativePrompt": "Compression artifacts, bad art, worst quality, low quality, plastic, fake, bad limbs, conjoined, featureless, bad features, incorrect objects, watermark, ((signature):1.25), logo, zip2d_neg",
                "width": 832,
                "height": 832,
                "hashes": {
                    "model": "6330883d2c"
                },
                "resources": [
                    {
                        "type": "model",
                        "name": "artium_v20",
                        "hash": "6330883d2c"
                    }
                ]
            },
            "gen_info_raw": "A vibrant cyberpunk illustration, comic-book/anime hybrid, bold colors, defined line art, high-contrast neon lighting.\nA ((male)) Mothership RPG Teamster character, 22 years old.\n\nThe character is skilled in Industrial Equipment, Heavy Machinery, and Piloting.\nThese skills are represented visually through specific details:\n- Industrial Equipment → oil-stained gloves\n- Heavy Machinery → loader exo-frame parts\n- Piloting → flight harness and console wristband\n\n(Holding Old Work Glove:1.8), (Distinctive Feature: prosthetic limb:1.6).\nThese must be clearly visible and easily identifiable.\n\nThe background is industrial ship bay with mist, detailed yet subtle, adding depth without distracting from the character,\n\nBust shot, centered composition, clean silhouette, no extra text or logos, ZIP2D,  CXL-Mech\nNegative prompt: Compression artifacts, bad art, worst quality, low quality, plastic, fake, bad limbs, conjoined, featureless, bad features, incorrect objects, watermark, ((signature):1.25), logo, zip2d_neg\nSteps: 40, Sampler: DPM++ 2M, Schedule type: Karras, CFG scale: 7, Seed: 2417230464, Size: 832x832, Model hash: 6330883d2c, Model: artium_v20, Denoising strength: 0.3, RNG: CPU, ControlNet 0: \"Module: CLIP-ViT-H (IPAdapter), Model: ip-adapter-plus_sdxl_vit-h [bc449f62], Weight: 0.35, Resize Mode: ResizeMode.INNER_FIT, Processor Res: 0.5, Threshold A: 0.5, Threshold B: 0.5, Guidance Start: 0.3, Guidance End: 0.7, Pixel Perfect: False, Control Mode: ControlMode.BALANCED, Hr Option: HiResFixOption.BOTH\", ControlNet 1: \"Module: CLIP-ViT-H (IPAdapter), Model: ip-adapter-plus-face_sdxl_vit-h [368cf551], Weight: 1, Resize Mode: ResizeMode.INNER_FIT, Processor Res: 0.5, Threshold A: 0.5, Threshold B: 0.5, Guidance Start: 0.1, Guidance End: 0.9, Pixel Perfect: False, Control Mode: ControlMode.BALANCED, Hr Option: HiResFixOption.BOTH\", Hires prompt: \"A vibrant cyberpunk illustration, comic-book/anime hybrid, bold colors, defined line art, high-contrast neon lighting.\\nA ((male)) Mothership RPG Teamster character, 29 years old.\\n\\nThe character is skilled in Industrial Equipment, Heavy Machinery, and Piloting.\\nThese skills are represented visually through specific details:\\n- Industrial Equipment → oil-stained gloves\\n- Heavy Machinery → loader exo-frame parts\\n- Piloting → flight harness and console wristband\\n\\n(Holding Old Work Glove:1.8), (Distinctive Feature: prosthetic limb:1.6).\\nThese must be clearly visible and easily identifiable.\\n\\nThe background is industrial ship bay with mist, detailed yet subtle, adding depth without distracting from the character,\\n\\nBust shot, centered composition, clean silhouette, no extra text or logos, ZIP2D,  CXL-Mech\", Hires CFG Scale: 7, Hires upscale: 2, Hires steps: 15, Hires upscaler: ESRGAN_4x, TI hashes: \"ZIP2D: 353cf9be0675, CXL-Mech: 000b204acc87, ZIP2D: 353cf9be0675, CXL-Mech: 000b204acc87, CXL-Mech: 000b204acc87, CXL-Mech: 000b204acc87, CXL-Mech: 000b204acc87, CXL-Mech: 000b204acc87, CXL-Mech: 000b204acc87, CXL-Mech: 000b204acc87, CXL-Mech: 000b204acc87, CXL-Mech: 000b204acc87, CXL-Mech: 000b204acc87, CXL-Mech: 000b204acc87, CXL-Mech: 000b204acc87, CXL-Mech: 000b204acc87, CXL-Mech: 000b204acc87, CXL-Mech: 000b204acc87, zip2d_neg: a764ec702efd, zip2d_neg: a764ec702efd, CXL-Mech: 000b204acc87, CXL-Mech: 000b204acc87, zip2d_neg: a764ec702efd, zip2d_neg: a764ec702efd\", Pad conds: True, Version: f1.0.0v2-v1.10.1RC-latest-2454-g9086b215, Source Identifier: Stable Diffusion web UI"
        },
        {
            "type": "file",
            "id": 175,
            "date": "2025-09-09 22:32:16",
            "created_date": "2025-09-09 22:32:16",
            "size": "2.97 MB",
            "is_under_scanned_path": true,
            "bytes": 3115682,
            "name": "00139-2417230463.png",
            "fullpath": "/Users/pixelkaos/Library/Application Support/StabilityMatrix/Packages/Stable Diffusion WebUI reForge/outputs/txt2img-images/2025-09-09/00139-2417230463.png",
            "gen_info_obj": {
                "steps": 40,
                "sampler": "DPM++ 2M",
                "Schedule type": "Karras",
                "cfgScale": 7,
                "seed": 2417230463,
                "size": "832x832",
                "Model hash": "6330883d2c",
                "Model": "artium_v20",
                "Denoising strength": 0.3,
                "RNG": "CPU",
                "Hires CFG Scale": 7,
                "Hires upscale": 2,
                "Hires steps": 15,
                "Hires upscaler": "ESRGAN_4x",
                "TI hashes": "ZIP2D: 353cf9be0675, CXL-Mech: 000b204acc87, ZIP2D: 353cf9be0675, CXL-Mech: 000b204acc87, CXL-Mech: 000b204acc87, CXL-Mech: 000b204acc87, CXL-Mech: 000b204acc87, CXL-Mech: 000b204acc87, CXL-Mech: 000b204acc87, CXL-Mech: 000b204acc87, CXL-Mech: 000b204acc87, CXL-Mech: 000b204acc87, CXL-Mech: 000b204acc87, CXL-Mech: 000b204acc87, CXL-Mech: 000b204acc87, CXL-Mech: 000b204acc87, CXL-Mech: 000b204acc87, CXL-Mech: 000b204acc87, zip2d_neg: a764ec702efd, zip2d_neg: a764ec702efd, CXL-Mech: 000b204acc87, CXL-Mech: 000b204acc87, zip2d_neg: a764ec702efd, zip2d_neg: a764ec702efd",
                "Pad conds": "True",
                "Version": "f1.0.0v2-v1.10.1RC-latest-2454-g9086b215",
                "Source Identifier": "Stable Diffusion web UI",
                "ControlNet 0": "Module: CLIP-ViT-H (IPAdapter), Model: ip-adapter-plus_sdxl_vit-h [bc449f62], Weight: 0.35, Resize Mode: ResizeMode.INNER_FIT, Processor Res: 0.5, Threshold A: 0.5, Threshold B: 0.5, Guidance Start: 0.3, Guidance End: 0.7, Pixel Perfect: False, Control Mode: ControlMode.BALANCED, Hr Option: HiResFixOption.BOTH",
                "ControlNet 1": "Module: CLIP-ViT-H (IPAdapter), Model: ip-adapter-plus-face_sdxl_vit-h [368cf551], Weight: 1, Resize Mode: ResizeMode.INNER_FIT, Processor Res: 0.5, Threshold A: 0.5, Threshold B: 0.5, Guidance Start: 0.1, Guidance End: 0.9, Pixel Perfect: False, Control Mode: ControlMode.BALANCED, Hr Option: HiResFixOption.BOTH",
                "prompt": "A vibrant cyberpunk illustration, comic-book/anime hybrid, bold colors, defined line art, high-contrast neon lighting.\nA ((male)) Mothership RPG Teamster character, 29 years old.\nThe character is skilled in Industrial Equipment, Heavy Machinery, and Piloting.\nThese skills are represented visually through specific details:\n- Industrial Equipment → oil-stained gloves\n- Heavy Machinery → loader exo-frame parts\n- Piloting → flight harness and console wristband\n(Holding Old Work Glove:1.8), (Distinctive Feature: prosthetic limb:1.6).\nThese must be clearly visible and easily identifiable.\nThe background is industrial ship bay with mist, detailed yet subtle, adding depth without distracting from the character,\nBust shot, centered composition, clean silhouette, no extra text or logos, ZIP2D,  CXL-Mech",
                "negativePrompt": "Compression artifacts, bad art, worst quality, low quality, plastic, fake, bad limbs, conjoined, featureless, bad features, incorrect objects, watermark, ((signature):1.25), logo, zip2d_neg",
                "width": 832,
                "height": 832,
                "hashes": {
                    "model": "6330883d2c"
                },
                "resources": [
                    {
                        "type": "model",
                        "name": "artium_v20",
                        "hash": "6330883d2c"
                    }
                ]
            },
            "gen_info_raw": "A vibrant cyberpunk illustration, comic-book/anime hybrid, bold colors, defined line art, high-contrast neon lighting.\nA ((male)) Mothership RPG Teamster character, 29 years old.\n\nThe character is skilled in Industrial Equipment, Heavy Machinery, and Piloting.\nThese skills are represented visually through specific details:\n- Industrial Equipment → oil-stained gloves\n- Heavy Machinery → loader exo-frame parts\n- Piloting → flight harness and console wristband\n\n(Holding Old Work Glove:1.8), (Distinctive Feature: prosthetic limb:1.6).\nThese must be clearly visible and easily identifiable.\n\nThe background is industrial ship bay with mist, detailed yet subtle, adding depth without distracting from the character,\n\nBust shot, centered composition, clean silhouette, no extra text or logos, ZIP2D,  CXL-Mech\nNegative prompt: Compression artifacts, bad art, worst quality, low quality, plastic, fake, bad limbs, conjoined, featureless, bad features, incorrect objects, watermark, ((signature):1.25), logo, zip2d_neg\nSteps: 40, Sampler: DPM++ 2M, Schedule type: Karras, CFG scale: 7, Seed: 2417230463, Size: 832x832, Model hash: 6330883d2c, Model: artium_v20, Denoising strength: 0.3, RNG: CPU, ControlNet 0: \"Module: CLIP-ViT-H (IPAdapter), Model: ip-adapter-plus_sdxl_vit-h [bc449f62], Weight: 0.35, Resize Mode: ResizeMode.INNER_FIT, Processor Res: 0.5, Threshold A: 0.5, Threshold B: 0.5, Guidance Start: 0.3, Guidance End: 0.7, Pixel Perfect: False, Control Mode: ControlMode.BALANCED, Hr Option: HiResFixOption.BOTH\", ControlNet 1: \"Module: CLIP-ViT-H (IPAdapter), Model: ip-adapter-plus-face_sdxl_vit-h [368cf551], Weight: 1, Resize Mode: ResizeMode.INNER_FIT, Processor Res: 0.5, Threshold A: 0.5, Threshold B: 0.5, Guidance Start: 0.1, Guidance End: 0.9, Pixel Perfect: False, Control Mode: ControlMode.BALANCED, Hr Option: HiResFixOption.BOTH\", Hires CFG Scale: 7, Hires upscale: 2, Hires steps: 15, Hires upscaler: ESRGAN_4x, TI hashes: \"ZIP2D: 353cf9be0675, CXL-Mech: 000b204acc87, ZIP2D: 353cf9be0675, CXL-Mech: 000b204acc87, CXL-Mech: 000b204acc87, CXL-Mech: 000b204acc87, CXL-Mech: 000b204acc87, CXL-Mech: 000b204acc87, CXL-Mech: 000b204acc87, CXL-Mech: 000b204acc87, CXL-Mech: 000b204acc87, CXL-Mech: 000b204acc87, CXL-Mech: 000b204acc87, CXL-Mech: 000b204acc87, CXL-Mech: 000b204acc87, CXL-Mech: 000b204acc87, CXL-Mech: 000b204acc87, CXL-Mech: 000b204acc87, zip2d_neg: a764ec702efd, zip2d_neg: a764ec702efd, CXL-Mech: 000b204acc87, CXL-Mech: 000b204acc87, zip2d_neg: a764ec702efd, zip2d_neg: a764ec702efd\", Pad conds: True, Version: f1.0.0v2-v1.10.1RC-latest-2454-g9086b215, Source Identifier: Stable Diffusion web UI"
        },
        {
            "type": "file",
            "id": 90,
            "date": "2025-09-09 22:15:53",
            "created_date": "2025-09-09 22:15:53",
            "size": "2.88 MB",
            "is_under_scanned_path": true,
            "bytes": 3018420,
            "name": "00137-1346288478.png",
            "fullpath": "/Users/pixelkaos/Library/Application Support/StabilityMatrix/Packages/Stable Diffusion WebUI reForge/outputs/txt2img-images/2025-09-09/00137-1346288478.png",
            "gen_info_obj": {
                "steps": 40,
                "sampler": "DPM++ 2M",
                "Schedule type": "Karras",
                "cfgScale": 7,
                "seed": 1346288478,
                "size": "832x832",
                "Model hash": "6330883d2c",
                "Model": "artium_v20",
                "Denoising strength": 0.3,
                "RNG": "CPU",
                "Hires CFG Scale": 7,
                "Hires upscale": 2,
                "Hires steps": 15,
                "Hires upscaler": "ESRGAN_4x",
                "TI hashes": "CXL-Mech: 000b204acc87, CXL-Mech: 000b204acc87, CXL-Mech: 000b204acc87, CXL-Mech: 000b204acc87, CXL-Mech: 000b204acc87, CXL-Mech: 000b204acc87, CXL-Mech: 000b204acc87, CXL-Mech: 000b204acc87, CXL-Mech: 000b204acc87, CXL-Mech: 000b204acc87, CXL-Mech: 000b204acc87, CXL-Mech: 000b204acc87, CXL-Mech: 000b204acc87, CXL-Mech: 000b204acc87, zip2d_neg: a764ec702efd, zip2d_neg: a764ec702efd, CXL-Mech: 000b204acc87, CXL-Mech: 000b204acc87, zip2d_neg: a764ec702efd, zip2d_neg: a764ec702efd",
                "Pad conds": "True",
                "Version": "f1.0.0v2-v1.10.1RC-latest-2454-g9086b215",
                "Source Identifier": "Stable Diffusion web UI",
                "ControlNet 0": "Module: CLIP-ViT-H (IPAdapter), Model: ip-adapter-plus_sdxl_vit-h [bc449f62], Weight: 0.35, Resize Mode: ResizeMode.INNER_FIT, Processor Res: 0.5, Threshold A: 0.5, Threshold B: 0.5, Guidance Start: 0.3, Guidance End: 0.7, Pixel Perfect: False, Control Mode: ControlMode.BALANCED, Hr Option: HiResFixOption.BOTH",
                "ControlNet 1": "Module: CLIP-ViT-H (IPAdapter), Model: ip-adapter-plus-face_sdxl_vit-h [368cf551], Weight: 1, Resize Mode: ResizeMode.INNER_FIT, Processor Res: 0.5, Threshold A: 0.5, Threshold B: 0.5, Guidance Start: 0.1, Guidance End: 0.9, Pixel Perfect: False, Control Mode: ControlMode.BALANCED, Hr Option: HiResFixOption.BOTH",
                "prompt": "A vibrant cyberpunk illustration, comic-book/anime hybrid, bold colors, defined line art, high-contrast neon lighting.\nA ((male)) Mothership RPG Teamster character, 22 years old.\nThe character is skilled in Industrial Equipment, Heavy Machinery, and Piloting.\nThese skills are represented visually through specific details:\n- Industrial Equipment → oil-stained gloves\n- Heavy Machinery → loader exo-frame parts\n- Piloting → flight harness and console wristband\n(Holding Patchwork Toolbelt:1.8), (Distinctive Feature: grease-stained overalls:1.6).\nThese must be clearly visible and easily identifiable.\nThe background is sci-fi corridor with glowing panels, detailed yet subtle, adding depth without distracting from the character,\nBust shot, centered composition, clean silhouette, no extra text or logos, ZIP2D,  CXL-Mech",
                "negativePrompt": "Compression artifacts, bad art, worst quality, low quality, plastic, fake, bad limbs, conjoined, featureless, bad features, incorrect objects, watermark, ((signature):1.25), logo, zip2d_neg",
                "width": 832,
                "height": 832,
                "hashes": {
                    "model": "6330883d2c"
                },
                "resources": [
                    {
                        "type": "model",
                        "name": "artium_v20",
                        "hash": "6330883d2c"
                    }
                ]
            },
            "gen_info_raw": "A vibrant cyberpunk illustration, comic-book/anime hybrid, bold colors, defined line art, high-contrast neon lighting.\nA ((male)) Mothership RPG Teamster character, 22 years old.\n\nThe character is skilled in Industrial Equipment, Heavy Machinery, and Piloting.\nThese skills are represented visually through specific details:\n- Industrial Equipment → oil-stained gloves\n- Heavy Machinery → loader exo-frame parts\n- Piloting → flight harness and console wristband\n\n(Holding Patchwork Toolbelt:1.8), (Distinctive Feature: grease-stained overalls:1.6).\nThese must be clearly visible and easily identifiable.\n\nThe background is sci-fi corridor with glowing panels, detailed yet subtle, adding depth without distracting from the character,\n\nBust shot, centered composition, clean silhouette, no extra text or logos, ZIP2D,  CXL-Mech\nNegative prompt: Compression artifacts, bad art, worst quality, low quality, plastic, fake, bad limbs, conjoined, featureless, bad features, incorrect objects, watermark, ((signature):1.25), logo, zip2d_neg\nSteps: 40, Sampler: DPM++ 2M, Schedule type: Karras, CFG scale: 7, Seed: 1346288478, Size: 832x832, Model hash: 6330883d2c, Model: artium_v20, Denoising strength: 0.3, RNG: CPU, ControlNet 0: \"Module: CLIP-ViT-H (IPAdapter), Model: ip-adapter-plus_sdxl_vit-h [bc449f62], Weight: 0.35, Resize Mode: ResizeMode.INNER_FIT, Processor Res: 0.5, Threshold A: 0.5, Threshold B: 0.5, Guidance Start: 0.3, Guidance End: 0.7, Pixel Perfect: False, Control Mode: ControlMode.BALANCED, Hr Option: HiResFixOption.BOTH\", ControlNet 1: \"Module: CLIP-ViT-H (IPAdapter), Model: ip-adapter-plus-face_sdxl_vit-h [368cf551], Weight: 1, Resize Mode: ResizeMode.INNER_FIT, Processor Res: 0.5, Threshold A: 0.5, Threshold B: 0.5, Guidance Start: 0.1, Guidance End: 0.9, Pixel Perfect: False, Control Mode: ControlMode.BALANCED, Hr Option: HiResFixOption.BOTH\", Hires CFG Scale: 7, Hires upscale: 2, Hires steps: 15, Hires upscaler: ESRGAN_4x, TI hashes: \"CXL-Mech: 000b204acc87, CXL-Mech: 000b204acc87, CXL-Mech: 000b204acc87, CXL-Mech: 000b204acc87, CXL-Mech: 000b204acc87, CXL-Mech: 000b204acc87, CXL-Mech: 000b204acc87, CXL-Mech: 000b204acc87, CXL-Mech: 000b204acc87, CXL-Mech: 000b204acc87, CXL-Mech: 000b204acc87, CXL-Mech: 000b204acc87, CXL-Mech: 000b204acc87, CXL-Mech: 000b204acc87, zip2d_neg: a764ec702efd, zip2d_neg: a764ec702efd, CXL-Mech: 000b204acc87, CXL-Mech: 000b204acc87, zip2d_neg: a764ec702efd, zip2d_neg: a764ec702efd\", Pad conds: True, Version: f1.0.0v2-v1.10.1RC-latest-2454-g9086b215, Source Identifier: Stable Diffusion web UI"
        },
        {
            "type": "file",
            "id": 146,
            "date": "2025-09-09 21:51:12",
            "created_date": "2025-09-09 21:51:12",
            "size": "2.88 MB",
            "is_under_scanned_path": true,
            "bytes": 3016245,
            "name": "00134-3363076200.png",
            "fullpath": "/Users/pixelkaos/Library/Application Support/StabilityMatrix/Packages/Stable Diffusion WebUI reForge/outputs/txt2img-images/2025-09-09/00134-3363076200.png",
            "gen_info_obj": {
                "steps": 40,
                "sampler": "DPM++ 2M",
                "Schedule type": "Karras",
                "cfgScale": 7,
                "seed": 3363076200,
                "size": "832x832",
                "Model hash": "6330883d2c",
                "Model": "artium_v20",
                "Denoising strength": 0.3,
                "RNG": "CPU",
                "Hires prompt": "A vibrant cyberpunk illustration, comic-book/anime hybrid, bold colors, defined line art, high-contrast neon lighting.nA ((female)) Mothership RPG Teamster character, 29 years old.nnThe character is skilled in Industrial Equipment, Heavy Machinery, and Piloting.nThese skills are represented visually through specific details:n- Industrial Equipment → oil-stained glovesn- Heavy Machinery → loader exo-frame partsn- Piloting → flight harness and console wristbandnn(Holding Patchwork Toolbelt:1.8), (Distinctive Feature: grease-stained overalls:1.6).nThese must be clearly visible and easily identifiable.nnThe background is futuristic laboratory filled with strange equipment, detailed yet subtle, adding depth without distracting from the character,nnBust shot, centered composition, clean silhouette, no extra text or logos, ZIP2D,  CXL-Mech",
                "Hires CFG Scale": 7,
                "Hires upscale": 2,
                "Hires steps": 15,
                "Hires upscaler": "ESRGAN_4x",
                "TI hashes": "ZIP2D: 353cf9be0675, CXL-Mech: 000b204acc87, ZIP2D: 353cf9be0675, CXL-Mech: 000b204acc87, CXL-Mech: 000b204acc87, CXL-Mech: 000b204acc87, CXL-Mech: 000b204acc87, CXL-Mech: 000b204acc87, CXL-Mech: 000b204acc87, CXL-Mech: 000b204acc87, CXL-Mech: 000b204acc87, CXL-Mech: 000b204acc87, CXL-Mech: 000b204acc87, CXL-Mech: 000b204acc87, CXL-Mech: 000b204acc87, CXL-Mech: 000b204acc87, CXL-Mech: 000b204acc87, CXL-Mech: 000b204acc87, zip2d_neg: a764ec702efd, zip2d_neg: a764ec702efd, CXL-Mech: 000b204acc87, CXL-Mech: 000b204acc87, zip2d_neg: a764ec702efd, zip2d_neg: a764ec702efd",
                "Pad conds": "True",
                "Version": "f1.0.0v2-v1.10.1RC-latest-2454-g9086b215",
                "Source Identifier": "Stable Diffusion web UI",
                "ControlNet 0": "Module: CLIP-ViT-H (IPAdapter), Model: ip-adapter-plus_sdxl_vit-h [bc449f62], Weight: 0.35, Resize Mode: ResizeMode.INNER_FIT, Processor Res: 0.5, Threshold A: 0.5, Threshold B: 0.5, Guidance Start: 0.3, Guidance End: 0.7, Pixel Perfect: False, Control Mode: ControlMode.BALANCED, Hr Option: HiResFixOption.BOTH",
                "ControlNet 1": "Module: CLIP-ViT-H (IPAdapter), Model: ip-adapter-plus-face_sdxl_vit-h [368cf551], Weight: 1, Resize Mode: ResizeMode.INNER_FIT, Processor Res: 0.5, Threshold A: 0.5, Threshold B: 0.5, Guidance Start: 0.1, Guidance End: 0.9, Pixel Perfect: False, Control Mode: ControlMode.BALANCED, Hr Option: HiResFixOption.BOTH",
                "prompt": "A vibrant cyberpunk illustration, comic-book/anime hybrid, bold colors, defined line art, high-contrast neon lighting.\nA ((female)) Mothership RPG Teamster character, 29 years old.\nThe character is skilled in Industrial Equipment, Heavy Machinery, and Piloting.\nThese skills are represented visually through specific details:\n- Industrial Equipment → oil-stained gloves\n- Heavy Machinery → loader exo-frame parts\n- Piloting → flight harness and console wristband\n(Holding Patchwork Toolbelt:1.8), (Distinctive Feature: grease-stained overalls:1.6).\nThese must be clearly visible and easily identifiable.\nThe background is starship command deck with holographic displays, detailed yet subtle, adding depth without distracting from the character,\nBust shot, centered composition, clean silhouette, no extra text or logos, ZIP2D,  CXL-Mech",
                "negativePrompt": "Compression artifacts, bad art, worst quality, low quality, plastic, fake, bad limbs, conjoined, featureless, bad features, incorrect objects, watermark, ((signature):1.25), logo, zip2d_neg",
                "width": 832,
                "height": 832,
                "hashes": {
                    "model": "6330883d2c"
                },
                "resources": [
                    {
                        "type": "model",
                        "name": "artium_v20",
                        "hash": "6330883d2c"
                    }
                ]
            },
            "gen_info_raw": "A vibrant cyberpunk illustration, comic-book/anime hybrid, bold colors, defined line art, high-contrast neon lighting.\nA ((female)) Mothership RPG Teamster character, 29 years old.\n\nThe character is skilled in Industrial Equipment, Heavy Machinery, and Piloting.\nThese skills are represented visually through specific details:\n- Industrial Equipment → oil-stained gloves\n- Heavy Machinery → loader exo-frame parts\n- Piloting → flight harness and console wristband\n\n(Holding Patchwork Toolbelt:1.8), (Distinctive Feature: grease-stained overalls:1.6).\nThese must be clearly visible and easily identifiable.\n\nThe background is starship command deck with holographic displays, detailed yet subtle, adding depth without distracting from the character,\n\nBust shot, centered composition, clean silhouette, no extra text or logos, ZIP2D,  CXL-Mech\nNegative prompt: Compression artifacts, bad art, worst quality, low quality, plastic, fake, bad limbs, conjoined, featureless, bad features, incorrect objects, watermark, ((signature):1.25), logo, zip2d_neg\nSteps: 40, Sampler: DPM++ 2M, Schedule type: Karras, CFG scale: 7, Seed: 3363076200, Size: 832x832, Model hash: 6330883d2c, Model: artium_v20, Denoising strength: 0.3, RNG: CPU, ControlNet 0: \"Module: CLIP-ViT-H (IPAdapter), Model: ip-adapter-plus_sdxl_vit-h [bc449f62], Weight: 0.35, Resize Mode: ResizeMode.INNER_FIT, Processor Res: 0.5, Threshold A: 0.5, Threshold B: 0.5, Guidance Start: 0.3, Guidance End: 0.7, Pixel Perfect: False, Control Mode: ControlMode.BALANCED, Hr Option: HiResFixOption.BOTH\", ControlNet 1: \"Module: CLIP-ViT-H (IPAdapter), Model: ip-adapter-plus-face_sdxl_vit-h [368cf551], Weight: 1, Resize Mode: ResizeMode.INNER_FIT, Processor Res: 0.5, Threshold A: 0.5, Threshold B: 0.5, Guidance Start: 0.1, Guidance End: 0.9, Pixel Perfect: False, Control Mode: ControlMode.BALANCED, Hr Option: HiResFixOption.BOTH\", Hires prompt: \"A vibrant cyberpunk illustration, comic-book/anime hybrid, bold colors, defined line art, high-contrast neon lighting.\\nA ((female)) Mothership RPG Teamster character, 29 years old.\\n\\nThe character is skilled in Industrial Equipment, Heavy Machinery, and Piloting.\\nThese skills are represented visually through specific details:\\n- Industrial Equipment → oil-stained gloves\\n- Heavy Machinery → loader exo-frame parts\\n- Piloting → flight harness and console wristband\\n\\n(Holding Patchwork Toolbelt:1.8), (Distinctive Feature: grease-stained overalls:1.6).\\nThese must be clearly visible and easily identifiable.\\n\\nThe background is futuristic laboratory filled with strange equipment, detailed yet subtle, adding depth without distracting from the character,\\n\\nBust shot, centered composition, clean silhouette, no extra text or logos, ZIP2D,  CXL-Mech\", Hires CFG Scale: 7, Hires upscale: 2, Hires steps: 15, Hires upscaler: ESRGAN_4x, TI hashes: \"ZIP2D: 353cf9be0675, CXL-Mech: 000b204acc87, ZIP2D: 353cf9be0675, CXL-Mech: 000b204acc87, CXL-Mech: 000b204acc87, CXL-Mech: 000b204acc87, CXL-Mech: 000b204acc87, CXL-Mech: 000b204acc87, CXL-Mech: 000b204acc87, CXL-Mech: 000b204acc87, CXL-Mech: 000b204acc87, CXL-Mech: 000b204acc87, CXL-Mech: 000b204acc87, CXL-Mech: 000b204acc87, CXL-Mech: 000b204acc87, CXL-Mech: 000b204acc87, CXL-Mech: 000b204acc87, CXL-Mech: 000b204acc87, zip2d_neg: a764ec702efd, zip2d_neg: a764ec702efd, CXL-Mech: 000b204acc87, CXL-Mech: 000b204acc87, zip2d_neg: a764ec702efd, zip2d_neg: a764ec702efd\", Pad conds: True, Version: f1.0.0v2-v1.10.1RC-latest-2454-g9086b215, Source Identifier: Stable Diffusion web UI"
        }
    ]
}